"title","date","tags","article"
"（教えて　憲法）前文と１０３条、何が書かれている？","2018年2月9日22時20分","政治,国政","教えて！憲法　基本のき：４日本国憲法の章だてには意味がある。いずれの章も重要だが、より大切だと考えられたことほど、前に書いてあるといっていい。特集：教えて！憲法冒頭にある前文は、「国のかたちをきめる権力＝主権」を新たに手にした国民の「宣誓文」だ。主権が国民にないなかで戦争の道に突き進んだ反省をもとに、憲法を制定する意義や目的をしるした。ほとんどの文の主語は「日本国民」と「われら」。国民みずからが主人公だとの思いを前面に、全６４３字に国民主権と平和主義をつづる。本文は全１１章、１０３条。ほかの近現代の憲法と同じように、前半に基本的人権の保障が、後半に国の機関のありようや国家権力の使い方が書かれている。基本的人権の保障が政治の目的で、国家権力はそのための手段という考え方にもとづく。一方、日本国憲法に特徴的なものもある。一つは、第１章の「天皇」だ。大日本帝国憲法（明治憲法）と同じ順番、同じ表題だが、内容は大きくことなる。主権が天皇から国民に移ったことをはっきりとしめした。天皇を日本や日本国民の統合の「象徴」とし、国民主権をあきらかにした。もう一つは、第２章の「戦争の放棄」だ。憲法の三大原理の一つ、平和主義として、国民主権の次におかれた。ふたたび戦争の惨禍が起こることのないようにすると誓った前文にもとづき、軍隊も戦力も持たないとしるした、独特な規定だ。自衛隊が軍隊や戦力に当たらないのか、憲法論争の焦点になってきたのもこの章だ。第３章の「権利・義務」にも、国家が個人の思想を不当に弾圧したり個人を拘束したりした戦前、戦時中への反省が映っている。みんなの迷惑にならないなかで、どこに住んでも、どんな職業についても自由。どんな考えを持とうとも自由だ。自分の考えを発表する集会を開いたり出版をしたりする表現の自由もしるされている。不当に逮捕されない身体の自由もある。親が子どもに教育を受けさせる義務、勤労する義務、税金を納める義務もここにしるされている。第４章は「国会」、第５章は「内閣」、第６章は「司法」だ。国家権力が特定の機関に集中しないように、法律をつくる権限を国会に、行政をつかさどる権限を内閣に、法律を適用して争いを解決する権限を裁判所に分担させ、たがいがたがいをチェックする三権分立のしくみをとり入れた。国会は主権者である国民に直接えらばれた国会議員でつくられている。憲法は国会を「国権の最高機関」と呼び、国民との近さから、三権のなかでいちばん前におかれている。その後は財政（第７章）、地方自治（第８章）、憲法改正手続き（第９章）が続く。憲法の最高法規としての位置づけを書いた第１０章では、憲法を尊重し、守る義務が政治家や公務員ら、国家権力の側にあることを明記する。（二階堂勇）◇〈基本的人権の保障〉　国民主権、平和主義とともに、日本国憲法をつらぬく三大原理の一つ。人が生まれながらに持つ権利で、１１条は「国民は、すべての基本的人権の享有を妨げられない」とさだめ、「侵すことのできない永久の権利」と位置づけている。１３条も「生命、自由及び幸福追求に対する国民の権利については、最大の尊重を必要とする」とさだめる。一方、「公共の福祉に反しない限り」と制限も。他人のお金を盗んで幸せになる、という権利はみとめないというのがそれだ。憲法に人権規定があるから「それでおしまい」ともいかない。１２条で、国民の不断の努力により保持しなければならないとも強調している。また、スマホなど情報通信機器の普及にともない、プライバシーや「知る権利」といった「新しい人権」も誕生。権利と権利がぶつかり、社会問題化する場合がある。◇〈憲法改正手続き〉　憲法９６条に「各議院の総議員の３分の２以上の賛成で、国会が、これを発議し、国民に提案してその承認を経なければならない。承認に過半数の賛成を必要とする」と定める。現行憲法が１９４７年の施行以来、一度も改正されていないのは、９６条の高いハードルが一つの理由とされている。通常の法律制定より難しい改正手続きを持つ日本のような憲法を「硬性憲法」という。"
"五輪開会日に公表「詐欺的行為」　森友文書、野党が批判","2018年2月9日21時11分","政治,国政,有料記事","森友学園への国有地売却問題で新たに文書が公開された９日、野党は一斉に政府を批判した。「隠蔽（いんぺい）だ」「まだ隠している文書があるんじゃないか」。衆院予算委員会の質疑で麻生太郎財務相を追及。佐川宣寿・前財務省理財局長（現・国税庁長官）の証人喚問も要求し、攻勢を強める構えだ。森友関連の文書、新たに２０件　検査院検査には提出せず財務省が公表した森友学園側との交渉内容が含まれる文書財務省が新たな文書を参院予算委の理事懇談会に提出したのは、９日午前１１時。午後１時に再開した衆院予算委の冒頭、立憲民主党の山内康一氏が早速取り上げた。「昨年の国会審議の時も提出されていない。会計検査院の調査の時も提出されていない。今ごろになって出てきた」。こう批判し、麻生氏がいつ文書の存在を知ったのかをただした。「今日ではありませんけど、つい最近です」。麻生氏の答弁に納得しない山内氏はさらに質問を重ねるが、麻生氏は「私どもとしては意図的に隠したわけでもありません」と平然と答弁。議論は深まらなかった。その後、質問に立った希望の党の山井和則氏は「隠蔽体質甚だしい。国民に対して不誠実ではないか。一言謝罪をお願いします」と追及。これに対しても麻生氏は「所要の手続きを経て開示をした」と答弁し、謝罪することはなかった。山井氏は終了後、朝日新聞の取材にこう憤った。「平昌冬季五輪の開会と同じ日に公表してきた。ニュース価値を下げようとしている。隠蔽だけでなく、政府の詐欺的行為だ」希望の泉健太国会対策委員長は同日、朝日新聞の取材に「新たな文書に基づき、予算委の集中審議を求めていく」と表明。佐川氏の国会招致のほか、公表の遅れに関して関係者の処分も求めていくとした。立憲、希望、共産、民進の野党４党は９日、佐川氏の証人喚問を改めて与党に強く求めることで一致。野党第１党の立憲の辻元清美国会対策委員長は同日午後、自民党の森山裕国対委員長との会談の場に、公表文書一式を持ち込んだ。表紙には「森友学園事案についての法律相談の文書」との表題の下に「財務省理財局」。辻元氏は、森山氏の目の前で「理財局」の文字を指でとんとんとたたきながら、「当時、この理財局の文書がないと言っていたんじゃないですか。やはり（佐川氏は）出てきて説明をするべきだ」と要求。森山氏は「重い申し入れだ」と答えたという。ただ、政府・与党は佐川氏の参考人招致や証人喚問は拒否する構えだ。野党は今後の審議で佐川氏の答弁の矛盾などを突き、国会招致に応じざるを得ない雰囲気をつくる戦略を描く。与野党は９日、衆院予算委で経済問題などに関する集中審議を１３日に行うことで合意した。野党側は今回の問題について安倍晋三首相の姿勢をただすとみられる。（別宮潤一）"
"野田聖子総務相が女性向け政治塾　地元・岐阜で４月から","2018年2月9日21時09分","社会,その他・話題,政治,国政","野田聖子総務相は、地元・岐阜で女性向けの政治塾を４月１日に開講する。政治家を志す岐阜県内の女性が主な対象で、野田氏や各分野の専門家による講義を予定している。８月までの計６回コース。９日の閣議後の記者会見で、質問に答えた。１０日から野田氏のホームページで受講者募集を始める。野田氏は自民党岐阜県連会長だが、受講しても選挙の候補者選考で優遇されることはないという。"
"麻生財務相、在任最長更新へ「長くやりゃいいもんでも」","2018年2月9日20時46分","政治,国政","麻生太郎財務相（７７）は、財務相の在任期間が１２日で１８７５日になり、宮沢喜一氏を抜いて戦後最長を更新する。９日の記者会見でそのことを問われると、「長くやりゃいいってもんでもない」と語った。第２次安倍内閣が発足した２０１２年１２月２６日に副総理兼財務相に就任。以来、菅義偉官房長官とともに政権の中枢を占める。首相経験者として、安倍晋三首相の信頼も厚い。財政出動と大胆な金融緩和によって経済成長とデフレ脱却をめざすが、物価は目標の２％になかなか届かない。この間、麻生氏は消費税率１０％への引き上げを首相に直言したが、２度先送りされた。財政再建目標も延期され、国と地方の借金は１千兆円を超える。一方で、その発言がたびたび物議を醸し、昨年夏には「ヒトラーはいくら動機が正しくてもダメ」と話して、直後に撤回した。最近では、森友学園への国有地売却問題をめぐって国会で野党の追及を受ける。戦前には、明治時代に日本銀行の設立にも尽力した松方正義（通算５３０２日）や、昭和恐慌後に積極的な財政出動でデフレ脱却に取り組んだ高橋是清（同３２１４日）が、長く蔵相を務めている。（長崎潤一郎）"
"農産物・食品輸出、５年連続過去最高　目標達成には課題","2018年2月9日20時05分","経済,産業・商品,政治,国政,経済政策,有料記事","日本から２０１７年に輸出した農林水産物と食品は前年より７・６％多い８０７３億円（速報値）で、５年連続で過去最高を更新した。政府が掲げる「１９年に１兆円」という目標にはなお開きがある。農林水産省が９日発表した。内訳は水産物が４・２％増の２７５０億円、加工食品が１１・９％増の２６３６億円、農産物（加工食品を除く）が４・２％増の２３３２億円、林産物が３２・３％増の３５５億円。輸出先は香港、米国、中国、台湾、韓国が上位を占めた。日本食レストランの増加なども追い風になり、品目別では牛肉が４１・４％増の１９２億円、緑茶が２４・３％増の１４４億円、日本酒が１９・９％増の１８７億円など。農水省が力を入れるコメは３２億円と規模は小さいが、１８・１％伸びた。一方、以前から主力の輸出品であるホタテ（調整品含む）は過去の天候被害の影響が残り、１７・７％減の５５７億円。リンゴは台湾で人気の大玉が少なかったことなどから１７・７％減の１０９億円だった。食品は国や地域によって検疫を理由に持ち込めない品目が少なくない。年１兆円の目標達成には、各国に輸入検疫の緩和を促すなど、政府の取り組みも欠かせない。日本との経済連携協定に合意した欧州連合（ＥＵ）には現在、豚肉、鶏肉、鶏卵、乳製品などが持ち込めず、解禁に向けた手続きを進めている。東アジア諸国や米国などでは、福島原発事故後に設けた輸入規制が今も続く。（山村哲史）"
"首相、北朝鮮の金永南氏と握手し言葉交わす　平昌で","2018年2月9日20時02分","政治,国政,国際,アジア・太平洋","平昌（ピョンチャン）冬季五輪開会式出席のため韓国を訪問中の安倍晋三首相は９日午後、韓国の文在寅（ムンジェイン）大統領主催の五輪歓迎レセプションに出席した際、北朝鮮の金永南（キムヨンナム）最高人民会議常任委員長と握手し、言葉を交わした。韓国大統領府が明らかにした。日韓首脳が会談　安倍首相、北朝鮮への圧力維持を要求金氏は金日成（キムイルソン）国家主席の存命中から朝鮮労働党幹部や北朝鮮外相などを歴任した人物。首相は小泉内閣の官房副長官時代の２００２年に小泉純一郎首相（当時）の訪朝に同行した際、金氏と対面している。また、１３年に首相が日本人拉致問題の進展を狙い、小泉元首相の政務秘書官として日朝交渉に関わった飯島勲・内閣官房参与を派遣した際には金氏が対応した。"
"締め切りまでに９条改正案提出を　自民改憲本部が議員に","2018年2月9日19時33分","政治,国政","自民党の憲法改正推進本部は９日、党所属国会議員に対し、憲法９条改正に向けた条文案を１９日正午までに提出するよう求める文書を出した。細田博之本部長が７日の全体会合で、議員から条文案を募る考えを示したことに伴うもの。同本部は寄せられた条文案をもとに、２項「維持」と「削除」の論点を整理し、党改憲原案づくりに反映させる。文書では、緊急事態条項などを念頭に、他の改憲項目の条文案も募った。また、同本部は９日、参院選挙区の「合区」の解消をテーマとした全体会合を来週開くことを決めた。"
"江崎氏「揚げ足取り」発言を謝罪　読み上げ答弁に批判も","2018年2月9日19時11分","政治,国政,沖縄はいま","江崎鉄磨・沖縄北方担当相は９日の衆院予算委員会で、前日の同委で野党議員の質問を「揚げ足取り」などと批判したことについて問われ、謝罪し、撤回した。江崎氏は８日、答弁の誤読を指摘されて「揚げ足を取るのは予算委員会の役目でない」と反論していた。江崎沖縄相、また言い間違い　６５億円を「６５０万円」立憲民主党の山内康一氏の質問に答えた。山内氏は「国会を軽視している発言だ」として謝罪、撤回を要求。江崎氏は「不用意な発言であったことをおわび申し上げる」と述べた。ただ、江崎氏は、その後もメモを読み上げる答弁が続き、山内氏は「大臣としての資質の問題だ」と批判した。さらにこの日、希望の党の小熊慎司氏が沖縄への思いをただしたところ、江崎氏は「沖縄は明治以降、苦難の歴史を歩んできた。例えば、いわゆる『沖縄処分』」と発言。明治政府が琉球王国を併合した「琉球処分」を言い間違えた。その後、「先ほど沖縄処分と言ったが琉球処分だ」と訂正した。また、９日の衆院予算委では、河野太郎外相が前日の同委で「核の世界を不安定にしているのはロシアだ」と断定し、米国の核戦略見直しを擁護した発言も取り上げられた。山内氏が「発言は日ロ関係改善に逆効果では」と指摘すると、河野氏は「米国がそう述べているところを紹介したまでだ」と釈明した。（山岸一生）"
"対北朝鮮「対話のための対話に意味なし」　首相、文氏に","2018年2月9日18時15分","政治,国政,国際,アジア・太平洋,有料記事","安倍晋三首相は９日午後、訪問先の韓国・平昌（ピョンチャン）で文在寅（ムンジェイン）大統領と会談した。その後、記者団に対して「北朝鮮が拉致問題、核・ミサイル問題の解決に向けて具体的な行動をとるよう、引き続き日韓米の緊密な連携のもとに強く働きかけていきたい」と強調。北朝鮮に対する圧力強化について文大統領と確認したことを明らかにした。日韓首脳が会談　安倍首相、北朝鮮への圧力維持を要求へ会談は平昌冬季五輪の開会式出席に合わせて五輪会場近くのホテルで１時間行われた。首相は記者団に対し、対北朝鮮政策について「対話のための対話には意味がありません」と文大統領に伝えたと説明。「国連安保理の制裁決議をすべての加盟国が順守し、圧力を最大限まで高めていく必要がある。日米で完全に一致した確固たる方針を、文大統領と改めて確認した」と語った。日韓慰安婦合意については「最終的かつ不可逆的に解決した合意であり、国と国との約束は二国間関係の基盤だ」と強調。こうした日本の立場について文大統領に対して「明確にかつ詳細にお伝えしました」と述べた。（久木良太、松井望美）日韓関係と北朝鮮をめぐる主な動き２０１５年１２月　慰安婦問題を「最終的かつ不可逆的に解決」する日韓合意が成立１６年１２月　韓国・釜山の日本総領事館前に「少女像」設置１７年１月　日本政府が対抗措置として駐韓大使らを一時帰国３月　韓国憲法裁判所が朴槿恵大統領を罷免（ひめん）５月　韓国大統領選で文在寅氏が当選７月　安倍晋三首相、文氏がドイツでのＧ２０で初会談９月　北朝鮮が６回目の核実験１１月　北朝鮮が大陸間弾道ミサイル（ＩＣＢＭ）を発射１８年１月　韓国政府が日韓合意に否定的な新方針を発表。文氏は「完全解決」に「心を尽くした謝罪」を主張同　　南北朝鮮の閣僚級協議で、平昌五輪への北朝鮮代表団派遣で合意同　　カナダで北朝鮮に関する関係国外相会合。北朝鮮への圧力強化を確認２月　安倍首相が、トランプ米大統領との電話協議、ペンス米副大統領との会談で、圧力路線の維持を文氏に直訴する方針を確認"
"生活困窮者へ支援策、閣議決定　医療扶助では抑制策も","2018年2月9日13時20分","社会,政治,国政,医療・健康・福祉（アピタル）","政府は９日、生活が苦しい人たちへの支援策の改革法案を閣議決定した。生活保護世帯の子どもの大学進学時に一時金を支給したり、劣悪な「無料低額宿泊所」を排除する規制を設けたりして自立を後押しすることが柱だ。一方、生活保護受給者の薬は後発医薬品（ジェネリック）を原則にする。今の国会に提出し、今年度内の成立を目指す。生活保護、４月から減らされるの？この法案は、生活保護法や生活困窮者自立支援法など４本の改正法をまとめた一括法案だ。子どもの貧困対策では、生活保護世帯の子どもが大学や専門学校に進む場合、新生活準備のためとして１０万～３０万円を支給する制度創設を盛り込んだ。新年度から導入する方針だ。ひとり親家庭に支給する児童扶養手当は、４カ月ごとにまとめて年３回支給する仕組みを、２カ月ごとにまとめて年６回支給するように変える。家計管理をしやすくする狙いだ。無料低額宿泊所は、劣悪な施設に生活保護の受給者を集めて多額の経費を取る「貧困ビジネス」の温床との指摘もある。都道府県への事前届け出制とし、防火体制や部屋面積などの最低基準を設けるなど規制を強化する。基準は都道府県ごとに条例で定める。一方で質の高い自立支援に取り組む施設を認定し、運営費を補助できるようにもする。生活保護費の医療費にあたる「医療扶助」（国と地方を合わせた新年度当初予算案ベースで約１兆９千億円）の抑制策も入った。割安な後発医薬品について今は可能な限り使用を促すとし、本人が望めば先発薬を医師が処方している。これを後発薬の使用を原則にし、医師が医学的に問題ないと判断すれば、本人の希望に関わらず処方するようにする。政府は、生活保護受給者の後発薬の使用率を今の７２％から１８年度中に８０％に高めたい考えだ。厚生労働省によると、１ポイント上がると１０億～１５億円の費用削減効果があるという。ただ、「受給者が薬を選べなくなる」との批判もある。（佐藤啓介）生活が苦しい人への支援策改革法案の主な項目【施行時期】生活保護法改正案・生活保護世帯の子どもの大学や専門学校への進学時に、一時金を支給する制度を創設。自宅から通うなら１０万円、自宅以外から通う場合は３０万円【２０１８年４月】・生活保護受給者の後発薬の利用を原則化。医者が医学的に使って問題ないと判断することが条件【１８年１０月】・生活保護受給者の健診データなどを福祉事務所が管理し、生活習慣を指導する仕組みを創設【２１年１月】社会福祉法改正案・無料低額宿泊所を事前届け出制とし、防火体制などの最低基準を整備。劣悪な宿泊所へは改善命令を出せるようにする【２０年４月】生活困窮者自立支援法改正案・住まいを失った人に宿泊場所を提供する「一時生活支援事業」に見守りや日常生活支援の取り組みを追加。自治体の事業費や民間への委託費に補助金を出す【１９年４月】・家計改善支援を効果的に行う自治体への国庫補助率を２分の１から３分の２へ引き上げる【１８年１０月】・子どもの学習支援事業として行う生活習慣改善などの取り組みについて、自治体への補助対象と明確化【１９年４月】児童扶養手当法改正案・児童扶養手当の支払い回数を年３回から奇数月の年６回に変更【１９年９月】"
"菅長官「経済運営に万全期す」　世界同時株安受け","2018年2月9日12時46分","社会,その他・話題,経済,産業・商品,政治,国政","世界的な株価急落について、菅義偉官房長官は９日午前の記者会見で、「米国経済をはじめ世界経済は堅調に推移しており、日本経済は企業収益が過去最高、雇用所得環境は改善をし、経済の好循環は確実に回り始めている」と指摘。「金融市場の動向を含め、世界経済の動きや日本経済の動向をしっかり注視し、経済運営に万全を期していきたい」と強調した。麻生太郎財務相は「（株価が）上がったり下がったり、やたら幅が大きい。世界経済のファンダメンタルズ（基礎的条件）は全然悪くない」と、相場の乱高下は一時的な調整との考えを示した。茂木敏充経済再生相は「金融資本市場の動向については、実体経済にどういう影響を与えるか注視したい」と述べた。"
"安倍首相、平昌五輪開会式へ出発　日韓首脳会談も","2018年2月9日12時18分","政治,国政,国際,アジア・太平洋,スポーツ,ウインタースポーツ,平昌五輪","安倍晋三首相は９日午前、同日午後に予定される日韓首脳会談と平昌（ピョンチャン）冬季五輪開会式に出席するため、韓国に向けて政府専用機で羽田空港を出発した。首相は出発前、首相官邸で記者団に「北朝鮮の脅威に対して、日米韓の協力関係は揺るぎないことを世界に発信する首脳会談にしたい」と述べ、首脳会談で北朝鮮への圧力強化路線の維持を訴える考えを示した。慰安婦問題をめぐる日韓合意については「改めて日本の立場を明確に伝えたい」と着実な履行を迫る姿勢を強調した。特集：平昌オリンピックSPIN THE DREAM 羽生結弦首相は１０日に五輪の日本選手団を激励し、同日帰国する。"
