"title","date","tags","article"
"大雪続く北陸、福井北部で休校相次ぐ　ＪＲ特急も運休","2018年2月13日12時03分","社会,災害・交通情報","１３日も日本海側を中心に大雪となり、学校の休校や鉄道の運休が相次いだ。１４日は冬型の気圧配置が緩み、雪は弱まる見通しだ。福井県北部では６日から休校していた小中学校、高校の多くが１３日から再開予定だったが、前夜から激しい雪が降り続き、休校が続出した。県教育委員会によると、１３日午前９時時点で小学校８８校、中学校３０校、県立高校２３校が休校した。福井市の積雪は午前９時現在で１０９センチになる。ＪＲ西日本によると、特急「サンダーバード」（大阪―金沢）と特急「しらさぎ」（名古屋・米原―金沢）が１３日は終日運休する。在来線は北陸線の敦賀―福井間で始発から運休し、福井―金沢間でも一部列車で運転を取りやめている。空の便も、小松空港を発着する一部の便で欠航が出ている。"
"除雪作業の事故相次ぐ　広範囲で大雪、１３日も警戒必要","2018年2月12日19時15分","社会,事件・事故・裁判,災害・交通情報","上空に強い寒気が入り込んだ影響で１２日、日本海側を中心に広い範囲で大雪となった。１３日も強い冬型の気圧配置が続く見通しで、気象庁は大雪やなだれへの警戒を呼びかけている。山形県大蔵村の肘折では、１２日午後４時までの２４時間の降雪量が９９センチを記録。同５時、積雪は過去最深の４１６センチに達した。除雪作業中の事故が各地で相次いだ。宮城県加美町では１２日午前１０時１０分ごろ、町道を歩いていた柳川真砂子さん（８７）が、バックしてきた除雪作業の重機車にはねられて死亡した。県警は、運転していた同町の設備工事業中島吉悦容疑者（６９）を自動車運転死傷処罰法違反（過失運転致死）容疑で現行犯逮捕し、発表した。「確認したが、歩行者はいないと思った」と述べている。署によると、事故当時、雪はほとんど降っていなかったが路面は圧雪状態でセンターラインや路側帯が見えにくかったという。新潟県十日町市倉俣の用水路（水深約３０センチ）では同日朝、近くの農業高野新平さん（９０）が倒れているのが見つかり、死亡が確認された。現場周辺は１メートル以上の雪が積もっていたという。県警は、高野さんが雪かき中に足を滑らせて転落した可能性があるとみている。同日午前９時半ごろには同県長岡市宮沢の集水升で近くの小熊矢代江さん（６２）が沈んでいるのが見つかり、死亡が確認された。現場は自宅前の用水路の約４０メートル下流。小熊さんは前日の夕方に雪かきに出てから自宅に戻っておらず、消防が捜索していた。同市富島町では午後４時ごろ、近藤充さん（７８）が自宅前で倒れているのが発見された。首の骨が折れており、搬送先で死亡が確認された。県警は、雪下ろしの際に屋根から転落したとみて調べている。同県燕市内では１２日午前８時４０分ごろ、ＪＲ越後線の東三条発寺泊行き普通列車（３両）が車両の下に雪を抱え込み立ち往生した。ＪＲ東日本によると、乗客は２人で、約１時間半後にＪＲが手配したタクシーに乗り換えたという。"
"日本海側、再び大雪の恐れ　車立ち往生など注意呼びかけ","2018年2月11日16時43分","社会,災害・交通情報","冬型の気圧配置が強まり、記録的な豪雪に見舞われた北陸など、北日本から西日本の日本海側を中心に、１３日ごろにかけて再び大雪の恐れが強まっている。気象庁などは、車の立ち往生や、交通機関の乱れ、雪崩などの被害に注意するよう呼びかけている。気象庁によると、１１日は低気圧が本州の東側へ移動して冬型の気圧配置が強まっている。１２日には北陸地方の上空約５千メートルに零下３６度以下、北日本の上空約５千メートルには零下４２度以下の寒気が流れ込み、１３日にかけて日本海側を中心に大雪となる恐れがあるという。１２日午後６時までの２４時間に予想される降雪量は、いずれも多いところで、北陸地方８０センチ、東北地方６０センチ、東海地方５０センチ、北海道と近畿地方４０センチなど。１２日午後６時から１３日午後６時までの２４時間では、北陸地方で６０～８０センチなどの降雪が予想されている。非常に強い風も予想される。北陸地方では、１２日にかけて最大風速２０メートル、最大瞬間風速は３０メートルと予想されており、海上は大しけになる見込み。１１日午後３時現在、福井市で７９センチ（平年１９センチ）、金沢市で３６センチ（同１３センチ）と、平年の３～４倍近い雪が残っている状況だ。今後さらに降雪が予想されることから、気象庁では大雪や路面凍結による交通障害、ふぶき、雪崩などに注意を呼びかけている。"
"九州新幹線が一時運転見合わせ　架線に障害物","2018年2月11日16時15分","社会","ＪＲ九州によると、１１日午後３時ごろ、九州新幹線の新鳥栖―久留米間で架線に障害物が見つかり、同区間で一時、運転を見合わせたが、午後３時５０分ごろに再開した。架線の電気を止め、引っかかっていたビニールを撤去したという。上下線に遅れが出た。"
"北陸や近畿北部、１２～１３日に大雪のおそれ","2018年2月10日22時43分","社会,災害・交通情報","１１日から西日本の上空に強い寒気が流れ込み、再び冬型の気圧配置が強まる見込み。北陸や近畿北部では１２～１３日を中心に大雪のおそれがあるという。気象庁によると、北陸では１０日、全域で雨が降った。１０日午後８時現在の積雪は、福井市９７センチ、金沢市４８センチ、富山市３６センチなど。１１日午後６時までの２４時間に予想される降雪量は、福井、石川、富山の各県で３０センチになっている。山沿いなどでは雪崩にも警戒が必要という。同庁は「比較的雪が少ないとみられる１１日のうちに、安全を確認して除雪を進めてほしい」と呼びかけている。福井県災害対策本部によると、６～７日に県内で３人が雪の影響で死亡。いずれも雪に埋もれた車内から心肺停止の状態で見つかった。屋根の雪下ろし中に転落するなどしてけがをした人は５～１０日で重傷１２人、軽傷３６人。一方、国道８号などの除雪にあたっていた陸上自衛隊は１０日、任務を終えた。"
"南海トラフ地震、３０年以内「７０～８０％」　最新予測","2018年2月9日21時51分","社会,災害・交通情報","政府の地震調査委員会は９日、静岡県から九州沖合にかけての南海トラフ沿いでマグニチュード（Ｍ）８～９級の大地震が３０年以内に起こる確率が「７０～８０％」に高まったと発表した。毎年の数値の更新によるもので、震源域に特別な変化はないという。南海トラフ地震の被害想定地震の発生確率は、過去の発生間隔と直近の地震からの経過年数で計算し、毎年少しずつ高まる。南海トラフ地震は平均間隔の８８年と、１９４４～４６年の昭和東南海・南海地震からの経過時間を使って計算し、毎年約１％ずつ上昇。最大確率が７４・２％だった昨年は「７０％程度」の表記だったが、今年１月１日時点で７５・３％になり、四捨五入すると最大で「８０％」の表記になったという。また北海道・根室沖でＭ７・８～８・５の地震が３０年以内に発生する確率も、昨年時点の７０％程度から、８０％程度に上昇した。委員長の平田直・東京大教授は「大きく値が変わったわけではないが、次の地震に少しずつ近づいていることを表している。起きる可能性を忘れずに備えていただきたい」と話す。（竹野内崇宏）"
"大江戸線、不具合の原因は配線の接続不良　当面遅れ残る","2018年2月9日19時47分","社会","車両の進路を変える転轍（てんてつ）機（ポイント）の不具合の影響で運転本数が半分ほどに減っていた都営大江戸線は、午後２時１５分ごろに不具合が解消した。運行本数は徐々に増えているが、当面は遅れが残る見通しという。都営大江戸線、一部で運休や遅れ　夜間の作業が影響都交通局によると、光が丘駅（東京都練馬区）付近でポイントを新型に交換する作業を夜間にしたところ、正常に作動しなくなった。不具合の原因は、配線の接続不良だったという。"
"福井県、自衛隊に線路の除雪など追加で要望","2018年2月9日17時05分","社会,災害・交通情報,福井,有料記事","災害派遣の要請を受け、国道８号で発生した車両の立ち往生の解消に向けて除雪作業をしてきた陸上自衛隊に対し、福井県は９日、線路の除雪などの新たな活動内容を要望した。【タイムライン】北陸の大雪被害大雪の影響で鉄道の運行に支障が出ていることから、第１４普通科連隊（金沢市）と第３７２施設中隊（福井県鯖江市）が、えちぜん鉄道と福井鉄道の除雪を支援する。えちぜん鉄道は松岡駅と永平寺口駅の構内、福井鉄道は新木田交差点の周辺と北府駅から越前武生駅間の線路と各駅構内。ラッセル車が使えない場所を人力で除雪するという。福井県災害対策本部の担当者は「市街地だけでも病院に行けるようにしたい。人命救助の観点からお願いした」と話した。また、除雪車の燃料が不足していることから、第１０後方支援連隊（名古屋市）が、福井県永平寺町内のガソリンスタンド１カ所に除雪車用の軽油を補給するという。"
"「早く除雪を」　福井市に２千件近い問い合わせ","2018年2月9日16時03分","社会,災害・交通情報","豪雪に見舞われた福井市で、市道の除雪を担当する市道路課に「自宅前が除雪されていない」「早く除雪して」などの問い合わせが２千件近く寄せられている。【タイムライン】北陸の大雪被害福井市の市道の総延長は約２１３０キロ。計画では、除雪機械が入れない場所などを除いた約１７９６キロを除雪する予定になっている。しかし、除雪車の燃料となる軽油が不足しているうえ、雪捨て場まで移動するのに時間がかかり、住宅街の生活道路を中心に作業が追いついていない状態という。"
"北陸豪雪、戻る日常に「ひと安心」　配送や特急列車再開","2018年2月9日15時50分","社会,災害・交通情報","記録的な豪雪に見舞われた福井県の国道８号は９日未明、車両の立ち往生が解消された。石川県加賀市から福井市までの間の通行止めは同日午前５時に解除となり、滞っていた物流は回復する見通し。ただ、週末に再び大雪になる恐れもあり、気象庁は注意を呼びかけている。【特集】北陸・福井の大雪被害を時系列で気象庁によると、９日午前１１時現在の積雪は福井市１２４センチ、金沢市６７センチ、富山市５２センチ。北陸地方の雪はいったん落ち着き、高気圧に覆われるため気温が上がる見込み。１０日には雨になるところもあるとみられ、融雪による洪水や雪崩に注意が必要という。１１～１２日は冬型の気圧配置が強まり、再び荒れた天気となる可能性がある。国道８号の立ち往生は６日に発生。福井県あわら市や坂井市を中心に最大約１５００台が巻き込まれた。災害派遣要請を受けた陸上自衛隊や国土交通省の職員らがスコップで１台ずつ車両の周りの雪をかき出し、自力脱出できなければ重機で引っ張り出した。ＪＲ西日本は９日朝、大阪―金沢間などで特急の運行を４日ぶりに再開。一部は運休しており、通常ダイヤに戻るのは１０日以降になるという。空の便は、小松空港で一部を除いて４日ぶりに運航が再開された。物流も復活しつつある。県北部の一部のスーパーでは食料品が届かない状況が続いていたが、９日朝から全店舗への配送が可能になったという。県北部でスーパー５店舗を展開する平和堂（滋賀県）の広報担当者も「生鮮食品や加工品もお届けできると聞いており、ひと安心しています」と話す。ガソリンスタンドへの燃料油の供給も徐々に改善する見込み。県北部の２３０店のうち、８日に燃料油が届いたのは１９店にとどまっていたが、９日には８２店に供給される予定という。週末には再び大雪が予想され、現地は除雪に追われている。福井市道路課には「自宅前を早く除雪して」などの電話が２千件近く殺到。ただ、除雪車の燃料となる軽油の不足や、雪捨て場への移動に時間がかかり、住宅街の生活道路を中心に作業が追いついていないという。"
"霧島山・御鉢、小規模噴火の恐れ　警戒レベル引き上げ","2018年2月9日15時04分","社会,災害・交通情報","福岡管区気象台は９日、宮崎・鹿児島県境の霧島山・御鉢（おはち）で、同日朝から火山性地震が増加し、小規模な噴火がおきる恐れがあるとして、噴火警戒レベルを１（活火山であることに留意）から２（火口周辺規制）に引き上げた。火口からおおむね１キロの範囲で、大きな噴石への警戒を呼びかけている。"
"ＴＶ放送中断事故、原因は落雷　石川の民放２社が報告書","2018年2月9日12時58分","社会,災害・交通情報,カルチャー,テレビ・芸能,石川","１月にテレビ放送の中断事故を起こした石川県の石川テレビ（フジテレビ系列、金沢市）と北陸放送（ＴＢＳ系列、同）が９日、総務省北陸総合通信局に事故報告書を提出した。両社によると、原因は共用する金沢市内の送信用鉄塔の側面への落雷による火災。鉄塔側面に新たな避雷針を設置するなどの再発防止策を講じると報告した。落雷か、石川テレビなどの放送一時中断　北陸地方で荒天放送中断は１月１０日夜に発生し、石川テレビ、北陸放送ともに最大で約３８万世帯が一時視聴できなくなった。翌１１日に仮アンテナで放送を再開したが、現在も少なくとも約５４０世帯でどちらかの放送の視聴に障害があるという。"
"都営大江戸線、一部で運休や遅れ　夜間の作業が影響","2018年2月9日11時32分","社会","都営大江戸線は９日、光が丘駅（東京都練馬区）での夜間作業の遅延のため、午前５時の始発から練馬―光が丘間の上下線で運転を見合わせた。午前６時半ごろに全線で運転を再開したが、運行本数を通常の半分ほどに減らしている。都交通局によると、夜間に車両の進路を変える転轍（てんてつ）機（ポイント）を新型に交換したところ、作動しなかったという。原因は不明で、午前１１時時点で通常運行に戻せるめどは立っていない。原因次第では夜間の復旧作業となることから、しばらくは５割程度の運行状況が続くとみており、完全復旧は１０日となる可能性もあるという。"
"福井の車両立ち往生、３日ぶり解消　国道８号","2018年2月9日07時58分","社会,災害・交通情報,福井","６日から続いていた福井県内の国道８号の車両の立ち往生について、国土交通省福井河川国道事務所は９日午前５時までに状況が解消されたとして、通行止めを解除したと発表した。「すぐ動く」…信じて２４時間　大雪の車中、死の恐怖国交省は６日午前１１時から、同県あわら市から坂井市にかけての約１０キロを通行止めにして除雪にかかったが、６日午後には立ち往生の車両は約１５００台に上った。福井県は６日、自衛隊に災害派遣を要請。国交省は通行止めの区間を石川県加賀市から福井市までの約３０キロに広げ、少しずつ除雪を進めた。立ち往生が本格的に解消し始めたのは、雪が弱まった７日以降。動けなくなった車両の周囲は大量の雪に覆われており、車列を解消するため１台ずつ作業していった。国交省の職員と災害派遣された自衛隊員らは、スコップで雪を掘り出して動かせる状態にした。自力で脱出できない車は、重機で引っ張り出すこともあったという。"
"福井・国道８号の立ち往生、解消へ　物流網への影響続く","2018年2月8日23時31分","社会,災害・交通情報","記録的な大雪となった北陸地方は８日、降雪が小康状態となり、福井県内の国道８号で続いていた車両の立ち往生は同日中におおむね解消された。ただ、ガソリンスタンドへの燃料油供給やスーパーなどへの食品配送が滞り、市民生活への影響がなお続いている。【タイムライン】北陸の大雪被害県内では５日以降、大雪の影響で２人が死亡したが、県警によると７日夕、新たに同県坂井市内の国道３６４号で雪に埋もれた軽乗用車が見つかり、運転席で富山県の男性会社員（１９）が死亡していた。死因は一酸化炭素中毒という。気象庁によると、８日午後８時現在の積雪は福井市１３２センチ、福井県越前市１００センチ、金沢市７２センチ、富山市５５センチ。冬型の気圧配置が次第に緩み、積雪は減っているが、なお平年の２～７倍の量という。国道８号は６日から、福井県のあわら市や坂井市を中心に大型トラックなどの立ち往生が発生。巻き込まれた車両は最大約１５００台に上り、陸上自衛隊などが除雪を進めていた。国土交通省によると、８日午後９時時点で約８０台に減った。解消後に除雪や凍結防止剤の散布を進め、石川県加賀市から福井市の間の通行止めを解除するという。ＪＲ西日本金沢支社によると、大阪や名古屋と北陸を結ぶ特急「サンダーバード」と「しらさぎ」は８日も終日運休。９日は午前の一部を除いて運行を再開する。在来線の北陸線も福井―金沢間の運行を９日朝から再開する見込みという。空の便では、小松空港では８日もすべての便が欠航したが、９日は午前中の一部の便を除いて再開予定。福井県内では燃料や食品の不足が続く。県が８日午後１時時点で県北部のガソリンスタンドに聞き取ったところ、ガソリンや軽油、灯油の在庫が底をつきつつある店が半数近かった。県北部のスーパーでも発注した商品の２割ほどしか配送されない状況という。北陸地方は、９日は晴れ間が出る所もあるが、１１日ごろから再び冬型の気圧配置が強まり、大雪となる恐れがあるという。福井地方気象台は落雪やなだれ、除雪作業中の事故などに注意を呼びかけている。"
"雨でぬかるむ足元、揺れも収まらず…台湾地震、救助難航","2018年2月8日22時48分","社会,災害・交通情報,国際,アジア・太平洋","台湾東部の花蓮県などを襲った地震は発生から丸２日を迎える８日、日本などの支援も受けて捜索・救助活動が本格化した。当局が確認した死者は１０人、負傷者は２７０人に上る。なお７人の安否が確認できていないが、相次ぐ地震や降雨の影響で活動は思うようには進んでいない。時間との戦いの中、救助隊員からは焦りの言葉も漏れた。６日深夜の地震で大きく傾いた住居兼店舗ビル「雲門翠堤」。行方不明者の多くが閉じ込められている可能性があり、８日、ショベルカーなど多くの重機が持ち込まれた。だが、降り続ける雨で足元はぬかるみ、揺れも収まらない。中央気象局によると、６日深夜から８日午後５時までの地震は体に感じないものも含めて計２３５回。建物が倒壊する恐れがあり、作業はたびたび中断した。救助隊員の一人は「時間とともに傾きが大きくなっているようで、安全性を確認するために作業を中断せざるを得ない。（マンションが倒壊した）２０１６年の台湾南部の地震よりも作業は困難だ」とやつれた様子で語った。午後４時ごろには、日本政府が派遣した海上保安庁や東京消防庁などの災害救助の専門家７人が現場に到着した。外務省の国際協力局緊急・人道支援課の米田麻希子主査は報道陣の取材に「活動している（救助隊の）みなさんを見て、厳しい現場だなと思っている。精いっぱいやりたい」と話した。日本から移住して「雲門翠堤」に住んでいた大久保忠雄さん（７４）、淑珉さん（６４）夫妻は地震発生時、７階の自宅のリビングで過ごしていた。６日深夜は突然、「ボン」という大きな音がした後、ビルが傾いた。ベランダから救助されるとき、淑珉さんは「２階にいるような高さ」と感じたという。花蓮市内では同ビルやホテル「統帥大飯店」などビル４棟だけが傾いた。低層階の旅館が改装して壁を取り払った疑いが出るなど、地元メディアは建物の強度の問題を指摘している。一方、倒れた４棟は市内を南北に走る活断層に沿う形になっている。地震研究が専門の石瑞銓・中正大学副教授は「断層に沿って強い力が働いたことと、建物自体の構造的な弱さが合わさって、被害が大きくなったのではないか」とみる。（花蓮＝平賀拓哉、西本秀）"
"福井のあわら温泉、キャンセル相次ぐ　大雪の影響受け","2018年2月8日19時15分","社会,災害・交通情報,トラベル","「関西の奥座敷」とも言われる福井県あわら市のあわら温泉では、大雪で交通網に混乱が広がった影響を受け、宿泊のキャンセルが相次いでいる。【タイムライン】北陸・福井の大雪被害市が８日朝の時点で、市内にあるおおむね１００人以上が収容できる約２０軒の旅館・ホテルを調べたところ、宿泊のキャンセルは５～９日の５日間分で計４６７件、２０９５人に上っていた。回答を得られなかった旅館もあり、実際はさらに多いとみられるという。「大江戸温泉物語　あわら」では、京阪神や中京方面の予約客を中心に、４日ごろからキャンセルの連絡が次々と入り始めた。北陸地方と各地をつなぐ鉄道の運休なども響いているとみられ、８日夕までに約１５０件に上った。フロントマネジャーの中村弥生（やすお）さん（５２）は「影響は大きい。とにかく早く交通網が回復してほしい」。１０日からは３連休で、客入りが期待できる時期。あわら市観光協会の米由誠事務局長は「『越前がに』のキャンペーンなどで、１２月と１月のあわら温泉の宿泊客数は前年比でプラスだった。大雪は非常に痛手で、早く天候が安定してほしい」と話していた。（堀川敬部）"
