"title","date","tags","article"
"「今回の雪下ろしは悪条件」　北陸の豪雪、専門家が指摘","2018年2月8日17時45分","社会,災害・交通情報","記録的な大雪となった北陸地方では、９日から１０日にかけて気温が上がる見通しだ。屋根からの落雪が起きやすくなったり、雪下ろしの作業中に滑って転落しやすくなったりする恐れがある。その後は再び大雪となる可能性もあり、専門家が注意を呼びかけている。【タイムライン】北陸・福井の大雪被害気象庁の８日午後５時現在の予報によると、暖かい南風の影響で気温が上昇し、福井、石川、富山の各県では最高気温が９日に７度、１０日には１０度前後に達する見込みだ。気温が高い中で屋根の雪下ろしをする際には、最大限の注意が必要だ。長岡技術科学大学の上村靖司教授（雪氷工学）は、「今回の豪雪の雪下ろしは、悪条件が重なる」と指摘する。まず、１９８１年の「５６豪雪」以来の大雪で、久しぶりに屋根に上がる人が、慣れない作業で転倒する危険がある。また、気温が上がると、雪と屋根の間を潤滑油のように雪解け水が流れる。これが、屋根からの落雪や作業する人の転落の原因になる。北陸地方では１０日、雨も予想される。雨が降ると雪が水を吸ったスポンジのように重くなる。その後に降雪があれば重みはさらに増す。気象庁によると、１１日から１２日にかけて、再び冬型の気圧配置が強まり、大雪のおそれもある。上村さんは「これまで大丈夫だったカーポートの屋根などが倒壊する可能性もある」と指摘する。「今回の豪雪のような車の立ち往生が再び起きる可能性がある」とも語り、大雪時の外出や車による移動はなるべく控えるよう呼びかけている。暖かくなると雪解け水で川が増水する「融雪洪水」にも注意が必要だ。東北大理学研究科の山崎剛准教授（気象学）によると、一般に気温が５～１０度になると雪解けが進み、水が一気に川に流れ込む恐れがある。山崎さんは「今回の積雪量は、中小河川が増水するのに十分な量だ。不用意に川に近づかない方が良い」と話す。（後藤一也）"
"大雪で燃料不足、軽油４千リットルを提供　岡山県総社市","2018年2月8日17時27分","社会,災害・交通情報,福井","記録的な大雪の影響で、福井県内でガソリンや軽油などの供給が難しくなっていることを受け、岡山県総社市が８日、福井県勝山市に軽油４千リットルを提供した。同日午後、総社市の消防職員らがタンク車と勝山市を訪れ、市内のガソリンスタンドへ軽油を運んだ。両市長の個人的つながりで実現したという。勝山市によると、提供された軽油は市が所有する除雪車と、民間委託分の除雪車に給油する予定という。勝山市内のガソリンスタンドでは大雪に影響でガソリンや軽油が入荷しなかった。まだ降雪が続くことを考慮して７日昼から８日未明まで、除雪車を動かすのを控えていた。"
"降り続く雪に隠せぬ疲労　減る燃料、国道８号の車列なお","2018年2月8日15時39分","社会,災害・交通情報","北陸地方は８日午前も雪が断続的に降り、福井県内の国道８号で立ち往生した車列も３日目に入った。疲労の色が浮かぶドライバーたち。道路の流れが滞った影響で、各地のガソリンスタンドでは暮らしに直結する燃料の在庫が尽き始めた。北陸の豪雪、タイムラインで立ち往生から３日目。福井県坂井市内の国道８号では８日午前１０時になっても、高さ１メートルほどの雪に阻まれたトラックや乗用車の車列が残っていた。滋賀県東近江市のトラック運転手、中嶋彬人さん（３４）は６日午前４時ごろにこの現場で止まって以降、５０時間以上を車内で過ごしてきた。石川県小松市に荷物を届ける途中だった。配布されるパンなどで空腹をしのぐ。積んであった毛布で寒さに耐えているが、熟睡はできない。「さすがに疲れた。早くお風呂に入って、ひげをそりたい」と疲労の色は隠せない。金沢大４年の男性（２２）は６日午前６時ごろから、止まった乗用車の中で過ごす。福井市の実家から金沢市の下宿先に戻る途中だった。排ガスが車内に逆流して一酸化炭素中毒になるのを防ぐため、寒くなったらエンジンをかけ、しばらくしたら切るという繰り返し。「時間がかかるのは想定していたが、まさか２日も閉じ込められるとは……」と語った。福井市の自宅から金沢市内に向かっていた女性（５９）も、６日午前７時ごろから動けない。前方にいた車は脇道に迂回（うかい）したが、女性の軽乗用車では細い雪道を通れるか心配で、とどまった。「脇道にそれていたら、こんなことにはならなかったかも」と悔やむ。ガソリンも減り、エンジンを切ると車内は凍えるように寒かった。耐えきれず、車はひとまずそのままにして、７日未明から数キロ離れた休憩場所の「高椋（たかぼこ）コミュニティセンター」で過ごしている。「とにかく早く雪がやんでほしい」と疲れた表情で話した。（千種辰弥、辻村周次郎）燃料不足、市民直撃大雪は市民の足を直撃している。燃料不足だ。「２日前から燃料油が入ってこない。こんなことは初めて」。福井市のガソリンスタンド「丸福産業セルフかいほつ店」の原田慶一所長（３９）は８日午前、不安そうに話した。福井県内では幹線の国道や県道で除雪が進まず、ガソリンや軽油、灯油を積んだタンク車がスタンドに来ないという。レギュラーガソリンの残量は減る一方で、「このままではもって４０～５０台分」。住民から「ガソリンはあるか」という問い合わせも増えているが、セルフの給油機では１０リットルか２０リットルしか選べないように制限しているという。勝山市のガソリンスタンド「タキナミＳＳ」でも入荷がなく、７日夜にレギュラーとハイオクのすべてのガソリンがなくなった。灯油も１人１缶（１８リットル）のみ販売しているが、８日中に底をつく見通しだ。店長の男性は「いつタンク車が来るか見通しが立たず、困っている」と話す。燃料油を貯蔵する坂井市の油槽所には在庫が十分あるが、主要道路の除雪が進まないため、タンク車がたどり着けないという。影響は除雪作業にも及ぶ。勝山市の雪害対策本部によると、７日午前から、除雪車が使う軽油が市内で枯渇し、市は大半の除雪作業を中断。県を通じて軽油３９００リットルが届いたこともあり、８日未明から再開した。担当者は「暖房用の灯油も心配」と話した。鉄道・バスの運休も続く。福井市の男性会社員（４５）は８日、自宅から約４キロ離れた会社まで徒歩で通勤した。午前６時半に家を出たが「しんどいですね。自宅前は除雪されていないので、歩くのもやっと」と苦笑いを浮かべた。福井銀行本店では、「家に帰ったら出てこられるかわからない」と周辺のホテルに２連泊、３連泊した行員らが、雪に覆われた営業車を掘り出していた。（南有紀、荻原千明）"
"国道の立ち往生、４０台減って３１０台に　福井の大雪","2018年2月8日12時53分","社会,災害・交通情報,福井","国土交通省福井河川国道事務所は、福井県内の国道８号で立ち往生しているトラックなどの車両は８日午前９時現在で計約３１０台に上ると発表した。午前５時よりも４０台減った。車両はあわら市から坂井市にかけての約５・５キロの区間の上下線で約２９０台のほか、福井市から坂井市に向かう約１・８キロの区間に約２０台ある。国交省はこれらの区間を含む石川県加賀市から福井市にかけての約３０キロを通行止めにしており、除雪作業を進めている。現地ではところにより降雪が続いているが、除雪作業が進み、台数は少しずつ減っている。ただ、立ち往生の解消や通行止めの解除の時刻は未定という。"
"立ち往生の山崎製パン配送トラック、パン配る　福井豪雪","2018年2月8日11時53分","社会,災害・交通情報","福井県内で６日から起きていた国道８号の車両の立ち往生は２日以上に及んだ。立ち往生した車両の中には山崎製パンの配送トラック１８台も含まれており、本来の納入先には届けられないと判断し、積んでいたパンを困っている人々に配っていた。豪雪で立ち往生の車に５００人前　餃子の王将、無償で【タイムライン】北陸・福井の大雪被害同社広報（東京）によると、福井県災害対策本部を通じ、７日夜までにトラックの荷台や福井営業所に残っていたパン約８万２千個を自治体の避難所などへ提供した。パンが残ったトラックは、前後で立ち往生している車両にも無償で配ったという。同県あわら市で立ち往生していたトラックの男性運転手（５１）＝新潟市＝は７日午後、周囲の運転手たちがパンの袋を持って歩いているのを目にした。「この先でパンを配っている」と聞き、約１００メートル先まで歩くと、立ち往生した山崎製パンの配送車が荷台を開放していたという。運転手に「好きなだけ持っていって」と言われ、７袋の総菜パンや菓子パンを受け取ったという。「あのパンがなければ、食料が底を突いていた。本当に助かった」"
"国道の立ち往生、４８時間超える　北陸の大雪、続く混乱","2018年2月8日11時21分","社会,災害・交通情報","強い寒気による大雪に見舞われた北陸地方は、８日も市民生活の混乱が続いた。福井県内で６日から起きていた国道８号の車両の立ち往生は２日以上に及んだ。冬型の気圧配置は次第に緩み、降雪は８日夕までの見通し。国土交通省は８日中の立ち往生の解消を目指している。北陸の豪雪、タイムラインで雪は小康状態となり、８日午前９時時点の積雪は福井市で１３８センチ、福井県越前市で１０４センチ、金沢市で８４センチ。いずれも平年の６～７倍超となっている。今回の大雪で２人が亡くなった福井県によると、屋根の雪下ろし中の転落などによるけが人は計１６人となった。７人が重傷という。国道８号の立ち往生について国交省は、８日午前９時時点で石川県内はすでに解消し、福井県内でトラックなど約３１０台がとどまっていると発表した。車両はあわら市から坂井市の約５・５キロの上下線で約２９０台、坂井市から福井市の約１・８キロに約２０台。約１１００台が残っていた７日午後５時半時点から約８００台減ったという。この区間を含めて石川県加賀市から福井市にかけての約３０キロを通行止めとし、除雪を進めている。ＪＲ西日本金沢支社によると、特急サンダーバード（大阪―金沢・和倉温泉）と特急しらさぎ（名古屋・米原―金沢）は８日の運休を決めた。在来線では北陸線の敦賀―金沢間が運休していたが、３日ぶりに敦賀―福井間で朝から本数を半分程度に減らして運行を再開した。福井―金沢間は再開していない。一方、長浜―敦賀間は午前中の列車の運行を中止し、米原―長浜間でも一部の列車の運行を取りやめている。空の便は、８日に小松空港を発着する午前中の全便が欠航となった。学校への影響も続き、８日は福井県内の小学校１４０校と中学校５６校、県立高校２３校が休校した。気象庁によると、９日の北陸地方は高気圧に覆われ、福井市などでは晴れ間も見込まれている。屋根からの落雪に注意が必要であるほか、気温は低いため、路面の凍結にも警戒を呼びかけている。"
"雪に埋もれた車内で２人死亡　福井、１６人重軽傷","2018年2月8日10時31分","社会,災害・交通情報,福井","福井県災害対策本部は８日、北陸地方を襲った大雪の影響で、５日から８日午前９時までの間、雪に埋もれた車の中で心肺停止の状態で見つかった男性２人が死亡したほか、自宅の屋根の雪下ろし中に転落するなどして７人が重傷、９人が軽傷を負ったと発表した。"
"北陸の在来線、福井―金沢間の運行取りやめ　大雪の影響","2018年2月8日10時30分","社会,災害・交通情報","北陸地方の大雪の影響で、福井、石川両県を走る鉄道は８日の始発から特急や在来線の一部区間で運休した。北陸の豪雪、タイムラインでＪＲ西日本金沢支社によると、特急サンダーバード（大阪―金沢・和倉温泉）と特急しらさぎ（名古屋・米原―金沢）は８日の運休を決めた。在来線では北陸線の福井―金沢間の運行をすべて取りやめた。また、敦賀―福井間は朝から本数を半分程度に減らして運行。長浜―敦賀間では午前中の列車の運行を中止し、米原―長浜間でも一部の列車の運行を取りやめている。空の便は、８日に小松空港を発着する午前中の便が欠航が決まっている。北陸自動車道は福井県内で通行止めの区間はなくなったが、丸岡、金津両インターチェンジは閉鎖している。"
"大雪の福井、休校相次ぐ　小学校１４０校、中学校５６校","2018年2月8日10時29分","社会,災害・交通情報,福井","福井県教育委員会によると、８日午前８時現在、北陸地方で降り続く大雪の影響で、県内の小学校１４０校と中学校５６校、県立高校が２３校が休校になったという。北陸の豪雪、タイムラインで"
"福井大雪、なお３５０台が立ち往生　降雪続く","2018年2月8日10時20分","社会,災害・交通情報,福井","国土交通省福井河川国道事務所は、福井県内の国道８号で立ち往生しているトラックなどの車両は８日午前５時現在で計約３５０台に上ると発表した。【タイムライン】北陸・福井の大雪被害車両はあわら市から坂井市にかけての約５・５キロの区間の上下線で約３２０台のほか、坂井市から福井市に向かう約１・８キロの区間に約３０台ある。国交省はこれらの区間を含む石川県加賀市から福井市にかけての約３０キロを通行止めにしており、除雪作業を進めている。現地ではところにより降雪が続いているという。８日午前８時半の時点で、台数は徐々に減っているとみられるが、立ち往生の解消や通行止めの解除の時刻は未定という。"
"ＪＲ中央線快速が一時運転見合わせ　人身事故","2018年2月8日09時40分","社会","ＪＲによると、中央線快速電車は８日午前８時２７分ごろ、阿佐ケ谷駅で起きた人身事故の影響で、上下線で運転を見合わせていたが、９時２５分ごろ運転を再開した。"
"北陸大雪、原因はＪＰＣＺと低気圧の停滞　８日も警戒を","2018年2月7日23時30分","社会,災害・交通情報","記録的な大雪に見舞われた北陸地方は、７日も交通機関や市民の暮らしへの影響が続いた。福井、石川、富山３県などによると、７日夕方までに３県で計３人が死亡、３４人が重軽傷を負った。石川県から福井県にかけての国道８号では車両の立ち往生が２４時間以上に及んだ。強い寒気の流入は８日も続き、断続的に雪が降る見込みとなっている。【タイムライン】北陸・福井の大雪被害福井県は７日、大雪の影響で福井市内の男性（５０）が６日に死亡していたと発表した。同県内での死者は２人になった。自宅駐車場の車の中で心肺停止の状態で見つかり、排気口の部分が雪に埋まっていたという。同県内では、雪下ろしや除雪中の事故が相次ぎ、重軽傷者は１５人に上っている。石川県内でも除雪中の転倒などで１３人が負傷した。また、７日午前８時２０分ごろ、富山市の農道で、フォークリフトで除雪作業中の近くの男性会社員（４９）が、農道脇の用水路に転落し、フォークリフトの下敷きになって死亡した。このほか、富山県内では７日までに６人がけがをした。新潟県でも６～７日、６０～８０代の男性計４人が除雪作業中に死亡した。福井県の国道８号では、６日から動けない車両が続出。７日昼には石川県加賀市から福井県坂井市の約２０キロでトラックなど約１４００台が立ち往生した。陸上自衛隊が除雪を進めたが、国土交通省によると、午後５時半時点で約１１００台が残った。８日中に解消すると見込んでいる。７日午後５時現在の積雪量は福井市で１４４センチ、福井県越前市で１０５センチを記録し、それぞれ平年と比べて６・９倍、７・５倍になった。金沢市は７９センチで平年の５・６倍、富山市は６２センチで平年の２・５倍だったという。ＪＲ西日本金沢支社によると、特急サンダーバード（大阪―金沢）と特急しらさぎ（名古屋・米原―金沢）が終日運休し、８日も午前中は運休する。在来線は北陸線が敦賀―金沢間で７日の運行を中止。８日は朝から本数を通常の半分程度に減らして運行する。空の便は、７日に小松空港を発着する全便が欠航し、８日も午前中の欠航が決まった。北陸自動車道は福井県内の通行止めは７日朝までに解除されたが、石川、富山両県内の一部区間での通行止めが続いている。学校の休校も相次ぐ。７日は福井県内は小中学校１８２校や県立高校２１校、石川県内は公立の小中高校計２３８校などのほか、富山県内も私立を含む計４１校が休校となった。福井県内では、８日も小中学校１９６校が休校を予定し、９日についてもすでに１１６校が休校を見込んでいる。気象庁によると、今回の記録的な大雪は、日本海上で帯状になった雪雲が福井県の上空に停滞し、平年より強い寒気が雪雲の活動を強めたためだ。大陸から吹く北西の風が朝鮮半島北部の山脈で二手に分かれた後、日本海上で合流し、帯状になった雪雲が発生する。この「日本海寒帯気団収束帯（ＪＰＣＺ）」はこれまでも日本海側を中心に大雪をもたらしてきた。今回はＪＰＣＺが福井県の上空に流れ込んだうえ、低気圧が停滞したために上空に居座る状態が続いた。さらに、北陸地方の上空約５千メートルには、平年を１０度近く下回る零下３９度以下の強い寒気があり、ＪＰＣＺを活発化させたという。８日午後６時までの２４時間の降雪量は福井、富山両県で最大４０センチ、石川県で同２５センチと予想されている。９日以降は冬型の気圧配置や寒気が次第に弱まるにつれ、雪雲の活動が収まっていく見通しという。"
"「すぐ動く」…信じて２４時間　大雪の車中、死の恐怖","2018年2月7日23時03分","社会,災害・交通情報","記録的な大雪に見舞われた北陸地方では、前日に続いて７日も、国道８号で多数の車両が立ち往生する状態が続いた。地元自治体のほか、沿道の店舗や住民らに支援の動きが広がる。一方、豪雪の影響は医療や産業などにも及んだ。豪雪で立ち往生の車に５００人前　餃子の王将、無償で【タイムライン】北陸・福井の大雪被害「すぐに動くだろうと信じて、ずっと車の中で待ち続けていました」立ち往生から３０時間以上過ぎた７日午後４時ごろ、福井市の会社員波多野（はたの）佐代美（さよみ）さん（５９）が話した。６日午前６時、自宅を車で出発。福井県あわら市内の職場へ向かった。ふだんなら４０分程度で到着するが、午前７時半ごろ、同県坂井市内の国道８号上で、車が前に進まなくなった。前後を大型トラックに挟まれていた。ドアを閉めても時折、エンジンが焼けたような焦げくさい臭いが車内に広がる。暖房をつけているとガソリンがどんどん減るため、自分の車は同日午後６時ごろからエンジンを切って過ごした。車中泊を決意し、午後１０時過ぎに眠りについた。大雪で帰れず、職場に泊まるのを見越して持参していた毛布で、寒さをしのいだ。７日午前６時ごろ、車外に出ようとすると、車の窓の下まで雪が積もり、ドアが開かない。「どうしよう、閉じ込められた！」。パニックになりかけたが、力ずくでこじ開けた。近くの車の運転手に「凍え死なずにすんでよかったね」と言われ、怖くなった。７日午後１時ごろから休憩場所になっていた坂井市の高椋（たかぼこ）コミュニティセンターに一時的に身を寄せた。トイレを気にして飲食を控えていたが、ようやくパンを口にできた。「情報が入らず困った。立ち往生していた私たちも有志のボランティアとして何か協力できたのでは」。波多野さんはそう話し、車に戻った。（辻村周次郎）"
"線路に大量の雪、電車が発車できず　北陸線・余呉駅","2018年2月7日20時04分","社会,災害・交通情報","７日午後４時１０分ごろ、ＪＲ北陸線余呉（よご）駅（滋賀県長浜市）で、線路上に大量の雪が積もり、近江塩津発米原行きの新快速電車（４両編成）が発車できなくなった。このため、ＪＲ西日本は約６０人の乗客をバスで代替輸送した。ＪＲ西は、深夜にかけて降雪が続くことが見込まれることから、７日の終電まで北陸線の長浜―敦賀間、湖西線の近江今津―近江塩津間で運転を見合わせるという。"
