"title","date","tags","article"
"プチデモン前州首相の再選焦点　議会招集","2018年1月17日 21時00分","スペイン,ベルギー,欧州,速報,国際","【パリ賀有勇】スペイン北東部カタルーニャ自治州議会（定数１３５）が１７日、昨年末の出直し選挙後初めて招集された。議会で州首相が選出される際、中央政府から解任されベルギーにとどまり続けているプチデモン前州首相が再選されるかが焦点になっている。自治州は昨年１０月に独立を問う住民投票を強行。中央政府は、住民投票結果を元に独立宣言した州議会を解散し、州議会選を実施した。投票率は過去最高の７９％を記録し、独立派３政党が計７０議席で過半数を獲得した。だが、当選者のうちプチデモン氏ら元州政府幹部５人は、スペイン司法当局から「反逆」などの容疑がかけられ、ベルギーでの滞在を続けている。首班指名選挙で投票できないとされるため、一部が党内の落選候補に議席を譲ることで、独立派として過半数を維持したい考えだ。プチデモン氏は再選に意欲を示しているものの、スペイン司法当局から「反逆」などの容疑で逮捕状が出ており、帰国すれば拘束される。州議会は、首班指名に際して州首相候補が政府方針を示すことを規定している。このため独立派は、書面による代読やビデオ映像を用いた演説も検討している。だが、中央政府は州首相候補の議会への出席が必要と主張しており、プチデモン氏がベルギーから立候補を試みれば法的に争う構えを示している。２月２日までに新州首相が選出されなければ、更なる交渉期間が与えられた後、州議会再選挙が実施される可能性もある。"
"経済協力強化の方針を確認","2018年1月16日 23時30分","ルーマニア,北朝鮮,朝鮮半島情勢,欧州,アジア・オセアニア,速報,国際","【ブカレスト松倉佑輔】欧州歴訪中の安倍晋三首相は１６日午後（日本時間１６日夜）、最後の訪問国となるルーマニアに到着し、首都ブカレストでヨハニス大統領と会談した。経済協力を強化する方針を確認した。会談では日本企業の投資・進出支援で一致した。安倍首相はインフラ整備や人的交流の活発化なども提案するほか、北朝鮮への圧力強化も呼びかけた。首相は１５日（日本時間１５日深夜）にはセルビアでブチッチ大統領と会談。同国など西バルカン地域の経済社会改革を支援する枠組みの新設を表明し、セルビアの欧州連合（ＥＵ）加盟に向けた支援を強化することで一致した。首相は１６日夜（日本時間１７日未明）にルーマニアを政府専用機で出発し、１７日に羽田空港に帰国する予定。"
"偽ニュース対策強化　ロシア念頭に有識者会合","2018年1月16日 10時25分","フランス,ドイツ,欧州,速報,国際","【ブリュッセル八田浩輔】欧州連合（ＥＵ）は１５日、インターネットを通じて広がるフェイクニュース対策を検討するため、情報技術（ＩＴ）企業やメディアなどから有識者を集めた初の会合をブリュッセルで開いた。ＥＵはロシアを念頭に、フェイクニュースを利用した選挙介入や加盟国の分断をあおる情報工作を「脅威」と位置付けており、議論を重ねたうえで４月下旬に欧州委員会への提言をまとめる。取り組みを主導するガブリエル欧州委員（デジタル経済・社会担当）は、会合後の記者会見で「フェイクニュースは憂慮する速さで広がっている。メディアの信用や民主主義の健全さを脅かす」と語り、誤った情報を識別し流布を制限するメカニズムが必要だと指摘。表現の自由への配慮を強調しつつ「適切な対策を取らなければ状況は悪化する」と訴えた。専門家会合には学術界やグーグルなどのＩＴ大手、欧州メディアから約４０人が参加し、フェイクニュースの定義から議論を始める。現状では違法ではない誤情報のソーシャルメディアなどを通じた拡散をどう食い止めるのかが焦点となる。ＥＵは２０１５年、加盟国のほかジョージア（グルジア）、モルドバなど東方の近隣国を「標的」としたロシアによる情報工作に対処する専門チームを欧州対外行動庁（ＥＵ外務省に相当）に設置。ネット上に広がるフェイクニュースや情報の事実関係を１件ずつ精査して訂正した内容を発信するなどの取り組みを続けるが、１４人の専属職員による対策には限界がある。フランスのマクロン大統領は今月初めの記者会見で、年内にメディア関連法の改正を通してフェイクニュース対策を強化する意向を示した。しかし表現の自由との二律背反を招く法規制には慎重論も根強い。昨年の仏大統領選では終盤にマクロン氏の「隠し口座」などを巡る虚偽の疑惑がＳＮＳで拡散。ロシア側は関与を否定したが、マクロン陣営は露政府系メディアの取材を制限するなどの措置をとった。また欧州メディアの報道によると、ＥＵ離脱を決めた英国の国民投票やスペイン・カタルーニャ州の独立を巡る住民投票などで、ロシアのアカウントから介入があった。"
"北朝鮮へ最大限圧力の方針確認","2018年1月15日 18時45分","スペイン,北朝鮮,朝鮮半島情勢,欧州,アジア・オセアニア,速報,国際","小野寺五典防衛相は１５日、スペインのデコスペダル国防相と防衛省で会談し、核・ミサイル開発を続ける北朝鮮に対して最大限の圧力をかける方針を確認した。自衛隊とスペイン軍の共同訓練や人材育成など防衛協力を推進するため、次官級協議の初会合を年内にもスペインで開くことで合意した。小野寺氏は、スペインが昨年９月、北朝鮮大使を国外退去処分にしたことを「高く評価する」と支持し、国連安全保障理事会の制裁決議の厳格な履行に協力を求めた。デコスペダル氏は「北朝鮮の挑発は地域の平和を大きく損なっている。日本を応援し、協力する」と応じた。今年は両国の国交樹立１５０周年に当たり、デコスペダル氏は安倍晋三首相のスペイン訪問に期待を示した。【秋山信一】"
"親露の現職首位、過半数なく決選投票へ","2018年1月14日 18時48分","チェコ,欧州,速報,国際","【ウィーン三木幸治】チェコ大統領選が１３日開票され、現職のミロシュ・ゼマン氏（７３）が首位、チェコ科学アカデミー元総裁のイジー・ドラホシュ氏（６８）が２位となった。過半数を獲得した候補はおらず、２６、２７日に決選投票が行われる。ゼマン氏は親ロシア・中国で欧州連合（ＥＵ）の難民政策に強く反対していることで知られる。一方のドラホシュ氏は親ＥＵを主張する。チェコの大統領は儀礼的な存在だが世論に与える影響力は強く、決選投票の結果はチェコの動向に影響を与えそうだ。当局によると、開票率９９％でゼマン氏は約３８．６％、ドラホシュ氏は約２６．６％を獲得。大統領選には９人が立候補した。ゼマン氏は主に地方が支持基盤で、ドラホシュ氏は首都プラハなど都市部で人気が高い。"
"大連立政権、交渉入りへ合意　社民党内に反対強く","2018年1月12日 19時37分","国際,欧州,速報","【ベルリン中西啓介】ドイツのメルケル首相の国政最大会派キリスト教民主・社会同盟（ＣＤＵ・ＣＳＵ）と国政第２党・社会民主党は１２日、大連立政権継続のため政権協定交渉入りを目指す方針で合意した。社民党は２１日に西部ボンで開く臨時党大会で交渉入りについて審議する。戦後最長の政権空白収束に向けた動きが加速するが、社民党内には与党入りに反対の声もなお強く、党大会は難航が予想される。ＣＤＵ・ＣＳＵと社民党の３党合意文書によると、３党は「新たな欧州政策」や「（排外主義など社会の）分断の克服」「民主主義の活性化」などを政権の方向性とすることで合意した。社民党のシュルツ党首は欧州連合（ＥＵ）改革を重視。合意ではＥＵに否定的なトランプ米大統領や、中国、ロシアが台頭する国際情勢を念頭に、３党は「欧州は自らの運命にこれまで以上に責任を持つべきだ」とし、ＥＵ内の投資増や格差解消に取り組むことを明記。「独仏連携でＥＵ刷新が成功する」とし、具体的な改革案を提示するマクロン仏大統領と連携する姿勢を強調した。内政政策では社民党が求めていた富裕層への増税や医療保険の抜本改革は見送られた。一方で、社民党が否定的だった難民受け入れの上限については「年間１８万～２２万人を超えない範囲」と盛り込まれた。保守色の強いＣＳＵが強く主張したとみられ、再選挙による議席減を恐れる社民党が譲歩した形だ。一方、社民党大会に向け、党青年部は「大連立反対キャンペーン」を強化する構えだ。争点が少ないＥＵ政策では踏み込んだ合意が実現したが、内政面では、格差縮小を求めた社民党に対し歳出増を嫌うＣＤＵ・ＣＳＵの主張が色濃く反映された。シュルツ氏は、大連立反対派の党内左派や党青年部の説得を図る考えだが、２１日の党大会では異論が噴出する可能性が高い。大会で政権協定交渉入りが承認されたとしても、全党員による投票で政権参加が決まるため、最終段階で政権入りが否決される可能性も残されており、当面不透明な状況が続く。"
"アサンジ容疑者に国籍付与　移動は不明","2018年1月12日 17時16分","イギリス,中南米,欧州,速報,国際","【サンパウロ山本太一】南米のエクアドル政府は１１日、英国の同国大使館に５年以上、籠城（ろうじょう）している内部告発サイト「ウィキリークス」創設者ジュリアン・アサンジ容疑者（４６）に、エクアドル国籍を与えたと発表した。英警察は大使館外に出れば拘束する方針で、アサンジ容疑者が移動するかは不明だ。エスピノサ外相は記者会見で「保護の一環として昨年１２月に国籍取得を認めた」とし、大使館から安全に移動できるよう今後もアサンジ容疑者を支援する考えを示した。また、拘束を避けるため英政府に外交官としての立場を認めるよう要請したが、拒否されたことも明かした。アサンジ容疑者は、スウェーデンでの性犯罪容疑で国際指名手配され、２０１０年に英国で逮捕。保釈中の１２年にエクアドル大使館に逃げ込んだ。スウェーデン検察は１７年５月、捜査打ち切りを発表したが、英警察は保釈条件に違反したとして逮捕する方針を維持している。"
"大連立の協議が難航　税制・難民で隔たり","2018年1月12日 10時28分","国際,欧州,速報","【ベルリン中西啓介】メルケル独首相の国政最大会派キリスト教民主・社会同盟（ＣＤＵ・ＣＳＵ）と国政第２党・社会民主党による大連立政権継続を目指す政策協議が難航している。税制や難民問題を巡る意見の隔たりが埋まらず、徹夜の協議は１２日も続いている。連立交渉が決裂すれば、戦後初の連邦議会（下院）解散による再選挙の見通しが強まる。政権空白で長引く混乱を避けるため、各党は大幅な妥協を迫られている。今回の協議は７日に始まった。各党幹部３９人が財政、社会保障、難民問題など１５の作業部会で、政権協定の協議入りに向けた合意が可能か議論してきた。当初は１１日中に結論を出し、社民党は１２日朝の幹部会で合意の内容を精査。政権協定作成が可能と判断すれば、２１日に西部ボンで開く臨時党大会で、党員の同意を取り付ける方針を決めていた。だが、中低所得者の負担を減らし富裕層への増税を求める社民党に対し、１０月に主要地方選を控える企業寄りのＣＳＵが反対。難民政策や社民党が求める医療保険改革でも対立があり、社民党の交渉担当者は独紙ビルトに「ＣＳＵが何でも阻止しようとする」と不満を漏らしたという。"
"ＥＵ離脱、２度目の国民投票を提案　独立党元党首","2018年1月12日 10時25分","イギリス,欧州,速報,国際","【ロンドン矢野純一】英国の欧州連合（ＥＵ）離脱を巡り、反ＥＵや反移民を掲げる英国独立党（ＵＫＩＰ）のファラージ元党首は１１日、英テレビ番組で残留を求める議論に終止符を打つため、離脱の是非を問う２度目の国民投票の実施を提案した。２０１６年の離脱の是非を問う国民投票で離脱運動の急先鋒（せんぽう）だったファラージ氏の発言は英国内で波紋を呼びそうだ。ファラージ氏は番組で「（２度目の国民投票を行えば）離脱派が前回より多くの支持を得て再び勝つ」と発言。国民が離脱を選択したにもかかわらず離脱反対派はＥＵ残留をあきらめていないとして「離脱問題に決着をつけるべきだ」と述べた。残留派で労働党のブレア元首相や野党・自由民主党が、離脱交渉の結果を受けた国民投票の実施を求めている。一方、メイ首相は「２度目の国民投票は行わない」と繰り返し明言している。残留派からはファラージ氏の発言に賛同の声が上がっている。自由民主党のクレッグ元党首は自身のツイッターに「賛同する」と投稿。同党報道官は「国民は離脱に伴う負担を懸念しており、ファラージ氏は離脱派が勝つと思うべきではない」と述べた。離脱派やＵＫＩＰ内からは元党首の発言に反発する声が上がっている。離脱支持の保守党議員は英紙ガーディアンに対し「注目を集めたいだけ」と冷めた見方を示した。国民投票で離脱を支持した最大野党・労働党内では温度差がある。コービン党首は昨年１２月、英メディアに対して「我々は２度目の国民投票を支持していない」と説明。同党のワトソン副党首は「排除すべきでない」と述べている。"
"北朝鮮選手団は「約２０人」　韓国報道","2018年1月11日 21時31分","北朝鮮,スイス,韓国,朝鮮半島情勢,アジア・オセアニア,速報,国際,欧州","【ソウル米村耕一】聯合ニュースは１１日、９日に行われた南北閣僚級会談で、北朝鮮側が平昌（ピョンチャン）冬季五輪（２月）に派遣する北朝鮮選手団の規模について「約２０人になる」と伝えていたと報じた。うち１０人程度は選手に同伴するコーチなどで、選手は１０人前後となるという。詳細は今月２０日にスイスで開かれる南北の代表や国際オリンピック委員会（ＩＯＣ）が開く会議で決まる見通しだ。北朝鮮選手で公式に予選を通過しているのはフィギュアスケートのペア２人だが、聯合ニュースによるとＩＯＣが定員外に出場を認める特別枠で残る８人前後が出場する可能性があるという。"
"核合意の維持、米に要請へ　外相が会談","2018年1月11日 20時07分","アメリカ,イラン,ドイツ,北米,速報,国際,中東,欧州","【ブリュッセル八田浩輔】イランのザリフ外相は１１日、ブリュッセルを訪問し、欧州連合（ＥＵ）のモゲリーニ外務・安全保障政策上級代表（外相）らと会談した。米トランプ政権がイラン核合意に基づく対イラン制裁の停止を継続するかの判断が迫る中、欧州とイランは米側に核合意の維持を改めて働きかける。会談には核協議に参加した英独仏の各外相も出席した。核合意は２０１５年に国連安全保障理事会の常任理事国（米英仏中露）にドイツを加えた６カ国とイランが結んだ。トランプ大統領は昨年１０月にイランによる合意順守を「認めない」と表明。その後、対イラン制裁の再発動の是非は米議会に委ねられたが、議会は２カ月の期限内に対応を取らないまま合意は維持されている。欧州側はトランプ氏の決定に強く反発し、合意の維持を求めて米議会に働きかけてきた。イランも再交渉は認めないとの立場だ。イラン国内の核施設への査察を続ける国際原子力機関（ＩＡＥＡ）もイランの合意順守を確認している。米国務省によると、トランプ氏は１２日にも対イラン制裁を再発動するかどうかを判断する見通しで、制裁停止が解除されれば、核合意の破棄にもつながりかねないとして欧州側は懸念を強めている。米国では今月８日、共和党穏健派の重鎮、ルーガー元上院議員やオニール元財務長官ら約５０人が、イラン核合意は米国の安全保障に不可欠だとしてトランプ政権に順守を求めた。"
"国際養子縁組禁止の法律可決　虐待などの懸念","2018年1月11日 18時15分","デンマーク,アメリカ,欧州,北米,速報,国際,アフリカ","【ヨハネスブルク小泉大士】東アフリカのエチオピア議会は１０日、自国の子供が外国人の養子となることを禁じる法律を可決した。虐待などを受ける懸念から国際養子縁組を規制すべきだとの議論が高まっていた。英ＢＢＣ放送によると、１９９９年以降エチオピアから１万５０００人以上の子供が米国人家庭に引き取られ、米国における国際養子の約２割を占める。人気俳優のブラッド・ピットさんとアンジェリーナ・ジョリーさんもエチオピアで生まれた娘を養子に迎えた。だが、２０１１年に米国でエチオピア出身の少女が養親から虐待を受けて死亡する事件が発生。営利目的のあっせんなども懸念され、デンマーク政府は１６年にエチオピアからの養子受け入れを認めないことを決めた。今回の法律は孤児や親が育てられない子供はエチオピア国内で保護すべきだなどと定めているが、同国にはこうした子らを受け入れる施設や制度が不十分との懸念も出ている。"
"プラスチック課税を検討　英国離脱後の新財源","2018年1月11日 09時29分","イギリス,欧州,速報,国際","【ブリュッセル八田浩輔】欧州連合（ＥＵ）の欧州委員会は１０日、買い物袋などに使用するプラスチックへの課税を検討していると明らかにした。海洋汚染など環境への負荷軽減が目的だが、２０１９年３月末にＥＵを離脱する英国による拠出金を穴埋めする主要な財源の一つにも位置付ける。欧州委は近く、「プラスチック税」の導入を正式に加盟国に提案する。ＥＵ予算の財源は、加盟国の経済規模に応じた分担金の他、加盟各国の付加価値税の一定割合分などで構成される。英国は独仏に次ぐ拠出国で、欧州委は英離脱に伴い年約１５００億ユーロ（約１９兆９５００億円）のＥＵ予算に１２０億ユーロ（約１兆６０００億円）以上の穴が開くとみている。１０日に記者会見したエッティンガー欧州委員（財政担当）は、英離脱に伴う不足分について、半分は支出削減、残る半分は「プラスチック税」を含む新たな財源でまかなう必要があるとの考えを強調した。税率や課税対象の製品などは検討段階という。新財源としては、エネルギーや輸送分野の課税も取りざたされている。ユンケル欧州委員長は２１年から始まる７年間の次期中期予算について、移民対策や域外国境の管理などを強化するため加盟国の国内総生産（ＧＤＰ）全体の１％としている現行予算を１割程度拡大する考えを示している。"
"内閣改造　メイ首相の指導力に疑問も","2018年1月10日 21時59分","イギリス,欧州,速報,国際","【ロンドン矢野純一】メイ英首相は９日、内閣改造を行った。昨年１２月に欧州連合（ＥＵ）との離脱交渉で離脱を巡る清算金の支払いなどで合意、一つの山を越えたため、足場固めを図る狙いがあった。だがＥＵへの立場を異にする主要閣僚が軒並み留任したほか異動打診の拒否もあるなど、指導力に対する疑問が出ている。新内閣ではジョンソン外相やデービスＥＵ離脱担当相らＥＵ強硬派と、ハモンド財務相、ラッド内相など親ＥＵ派双方が留任した。昨年１２月にセクハラ告発を受け辞任したグリーン筆頭国務相の後任は置かず、グリーン氏が兼任していた内閣府担当相にはリディントン前司法相が就任した。一方、英メディアによると、メイ首相が異動を打診したグリーニング教育相は怒って辞任。ハント保健相にも異動を求めたが、逆にメイ氏が説得され留任となったという。メイ氏率いる与党保守党は、昨年６月の総選挙で少数与党となっている。"
"ポーランド「司法改革」巡る協議は平行線","2018年1月10日 19時34分","ポーランド,欧州,速報,国際","【ブリュッセル八田浩輔】欧州連合（ＥＵ）のユンケル欧州委員長は９日夜、ポーランドのモラウィエツキ首相とブリュッセルで会談した。ＥＵが重視する「法の支配」に違反するとして制裁手続きに入ったポーランドの司法改革を巡る協議は平行線をたどった。共同声明によると、会談は「友好的」に行われ、司法改革を巡り「詳細な議論」を交わした。ポーランド政府の司法介入に懸念を強める欧州委側は、昨年１２月末に議決権停止につながる制裁手続きの着手を決めた。３カ月の間にポーランド側が歩みよれば手続きを取り下げると通告している。だがモラウィエツキ氏はこの日も「制度をより効果的にするもの」だとして正当性を主張し、譲歩しない姿勢をみせた。両者は２月下旬に再度会談する。"
