"title","date","tags","article"
"セクハラ波紋、与野党が調査へ　首相側近にも疑惑","2017年11月7日 10時25分","イギリス,欧州,速報,国際","【ロンドン矢野純一】英国の議員による女性記者やスタッフらに対するセクハラ問題が次々と浮上している。与党保守党ではファロン国防相が１５年前のセクハラ問題を認め１日辞任したばかりだが、メイ首相側近のグリーン筆頭国務相（６１）にも疑惑が浮上。労働党の複数の議員も問題を指摘されており、両党とも調査を始めた。メイ氏は６日、野党党首らと会談し、議会内に女性の申し立てを受け付ける仕組みを作ることで合意した。英メディアなどによると、グリーン氏の疑惑は２０１５年にパブで女性記者の足を触ったとする内容。１年後、同じ記者はグリーン氏から思わせぶりなテキストメッセージを受け取ったという。また、国会内事務所の同氏のコンピューターから０８年にポルノ写真が見つかっていたという。グリーン氏はメイ氏の古い友人で、与党が過半数割れした今年６月の総選挙後、政権ナンバー２の筆頭国務相に就任。求心力を失うメイ氏を支える。疑惑は「悪意ある人格攻撃」と否定している。保守党では国際貿易省のガルニエ政務官（５４）にも、わいせつな道具を買うよう秘書に求めた疑惑が浮上。ポールター元保健省政務官（３９）には、３人の女性議員が体を触られたなどのセクハラ被害を申し立てた。野党労働党でも複数議員のセクハラ疑惑が表面化。ホプキンス前影の内閣文化相（７６）は１４年の同党イベントで女性活動家の体を触ったとされる。この活動家は英メディアに「党に報告したがコービン党首はホプキンス氏を影の内閣の大臣に昇進させた」と述べている。"
"カタルーニャ前州首相ら保釈　条件付きで","2017年11月6日 09時58分","スペイン,ベルギー,欧州,速報,国際","【ブリュッセル八田浩輔】スペイン北東部カタルーニャ自治州の独立問題で、一方的な独立宣言を主導したとして中央政府に解任されたプチデモン前州首相ら元州幹部５人が５日、滞在中のベルギーで警察に出頭し、拘束された。ベルギー当局は同日夜、スペインに送還するか否かを決めるまで５人について条件付きで保釈した。スペイン当局は国家への反逆などの容疑で欧州連合（ＥＵ）共通の欧州逮捕状を発行し、ベルギー側に協力を求めていた。プチデモン氏の弁護士は、身柄移送が決まった場合には不服を申し立てる意向を示してきた。最終的な手続きが終わるには２カ月近くかかる可能性がある。プチデモン氏はスペイン中央政府による自治権停止の一環で実施が決まった１２月２１日の州議会選挙には国外にとどまったまま立候補する意向を示している。"
"プチデモン氏ら出頭　他４人も拘束","2017年11月5日 23時46分","ベルギー,スペイン,欧州,速報,国際","【ブリュッセル八田浩輔】スペイン北東部カタルーニャ自治州の独立問題で、一方的な独立宣言を主導したとして中央政府に解任されたプチデモン前州首相ら元州幹部５人は５日、滞在中のベルギーで警察に出頭し、拘束された。スペイン当局は国家への反逆などの容疑で欧州連合（ＥＵ）共通の欧州逮捕状を発行し、ベルギー側に協力を求めていた。ベルギー検察によると、ベルギーの裁判所が同日プチデモン氏らを尋問し、身柄の拘束を続けるか、保釈するかを決める。その後、裁判所はスペインに身柄を移送するかを１５日以内に判断する。一方、プチデモン氏の弁護士は身柄移送が決まった場合は不服を申し立てる意向を示しており、最終的な手続きが終わるには２カ月近くかかる可能性がある。プチデモン氏はスペイン中央政府による自治権停止の一環で実施が決まった１２月２１日の州議会選挙には国外にとどまったまま立候補する意向を示している。"
"会談へ　北朝鮮問題、ＡＰＥＣ会合で協議","2017年11月5日 22時47分","シリア,北朝鮮,中国,ロシア,ベトナム,イラン,アメリカ,朝鮮半島情勢,すべて表示する","【ワシントン会川晴之、モスクワ杉尾直哉】トランプ米大統領は５日、今回のアジア歴訪中にロシアのプーチン大統領と北朝鮮問題などを協議する意向を、日本に向かう機中で記者団に明らかにした。タス通信によると、ペスコフ露大統領報道官も、１０日からベトナムのダナンで開かれるアジア太平洋経済協力会議（ＡＰＥＣ）首脳会議の場での会談に向け調整中と語った。北朝鮮問題や過激派組織「イスラム国」（ＩＳ）掃討後のシリア情勢、イラン情勢などが主要議題になるとみられる。ロシアは中国とともに、北朝鮮核・ミサイル問題の平和的解決を主張する。国連安全保障理事会の制裁決議を受け各国は北朝鮮との交易を減らすが、ロシアはウラジオストクと北朝鮮の羅先（ラソン）を結ぶ貨客船、万景峰号の定期便運航を１０月に２カ月ぶりに再開するなど交流を続ける。イラン問題では、プーチン氏は１日にテヘランで最高指導者のハメネイ師と会談し、米露など主要６カ国とイランが２０１５年に結んだ核合意の重視で一致。イランが核開発を大幅に制限する代わりに米欧などが制裁を解除する同合意からの離脱を模索する米政権をけん制した。"
"北朝鮮のテロ国家再指定「近々に判断」","2017年11月5日 19時42分","北朝鮮,アメリカ,ロシア,朝鮮半島情勢,アジア・オセアニア,速報,国際,欧州,北米","トランプ米大統領は５日、北朝鮮のテロ支援国家再指定について、「近々に判断する」と述べた。ハワイから日本に向かう大統領専用機中で、記者団に語った。トランプ氏は６日、東京都内で再指定を強く求める北朝鮮の拉致被害者・家族と面会する予定だ。米国は１９８８年に北朝鮮をテロ支援国家に指定したが、２００８年に解除した。仮に再指定すれば、北朝鮮に対する強い姿勢を示す象徴的な意味合いがあるとみられている。北朝鮮の核・ミサイル問題について、トランプ氏は「米国にとっても世界にとっても大きな問題であり、解決したい」と語り、日中韓などアジア５カ国歴訪で各国の協力を仰ぐ考えを示した。一方で北朝鮮国民について「勤勉で、世界が考えるより温かい素晴らしい人々だ」と述べ、「彼らのためにも（北朝鮮）問題を解決できればよい」と語った。また８日から訪問する中国では、第１９回党大会を経て権力基盤を固めた習近平国家主席がより強い立場で米中首脳会談に臨むとの見方に対して、「私もそうだ」と主張。「株価は史上最高値を更新し、失業率は１７年間で最低の水準だ。我々も大きな力を背景に（会談に）臨む」と強調した。【高本耕太】"
"ゼネスト呼びかけ　前州首相逮捕状に反発","2017年11月4日 20時23分","スペイン,欧州,速報,国際","【ブリュッセル八田浩輔、パリ賀有勇】スペイン北東部カタルーニャ自治州の独立問題で、スペインの裁判所は３日、司法当局の出廷要請を拒み、ベルギーに滞在中のプチデモン前州首相ら元州幹部５人に対し、欧州連合（ＥＵ）共通の「欧州逮捕状」を発行した。独立派は８日にゼネストを呼びかけるなど、司法当局の判断に反発を一層強めている。ベルギー側は逮捕状を受理し、身柄の取り扱いについて裁判所が審理する。今後、プチデモン氏らは一時的に拘束され、２４時間以内に裁判所の尋問を受けることになる。裁判所はベルギー国内法への違反の有無を考慮しながら拘束の維持と身柄の引き渡し、条件付き保釈、逮捕状の却下などの対応を判断する。ベルギーメディアによると、プチデモン氏の弁護士は、スペインへの身柄引き渡しが認められた場合には不服を申し立てる意向で、最終的な判断が下されるまでには２カ月近くを要すると伝えている。プチデモン氏が直ちにスペインに移送される可能性は低い。スペイン司法当局は逃亡の恐れがあるとして前州副首相らを既に拘束しており、独立派は、８日にゼネスト、１１日には大規模なデモ行進を呼びかけるなど反発を強めている。"
"東部のＩＳ要衝デリゾールを奪還　最終段階に","2017年11月4日 10時53分","イラク,ロシア,動画配信記事,中東,欧州,速報,国際,毎日動画","【カイロ篠田航一】シリアのアサド政権軍は３日、過激派組織「イスラム国」（ＩＳ）との攻防が続いた東部の要衝デリゾール県の県都デリゾール市を奪還したと発表した。国営シリア・アラブ通信が伝えた。既にＩＳは１０月に「首都」の北部ラッカを失っており、シリア国内でＩＳが勢力を保つのはイラク国境地帯のごく一部を残すのみとなった。デリゾール近辺は油田地帯で、２０１４年以降、原油密輸を資金源としてきたＩＳの重要拠点の一つとなっていた。アサド政権軍は今年９月からロシア軍などの支援を受け進軍していたが、米軍などが支援するクルド人主体の民兵組織「シリア民主軍」（ＳＤＦ）もアサド政権軍とは別の方向からデリゾール攻略を進めていた。ＩＳ追放後の油田地帯の支配を巡り、今後、双方の主導権争いが激化する可能性もある。米軍主導の有志国連合報道官はロイター通信に対し、残るＩＳ戦闘員はイラク側のカイムに１５００～２５００人、シリア側のアブカマルに２０００～３０００人と述べた。その後、中東の衛星テレビ局アルジャジーラは、イラク政府がカイム奪還を宣言したと報じた。ＩＳは１４年にシリアとイラクにまたがる地域で「国家」樹立を宣言したが、既に最大拠点だったイラク北部モスル、「首都」のラッカを喪失している。デリゾールには劣勢に立たされたＩＳ幹部や戦闘員が逃れていたとされ、アサド政権軍やイラク軍などによるＩＳ掃討作戦は最終段階を迎えている。ＩＳは今年９月、最高指導者アブバクル・バグダディ容疑者の「肉声」とされる声明をインターネット上に公開し、「勝利には忍耐が必要」と戦闘継続を呼びかけた。だが所在は不明で、生死についての情報は錯綜（さくそう）している。"
"前州首相ら５人に「欧州逮捕状」発行","2017年11月4日 10時34分","ＥＵ,ベルギー,スペイン,欧州,速報,国際","【ブリュッセル八田浩輔】スペイン北東部カタルーニャ自治州の独立問題で、スペインの裁判所は３日夜（日本時間４日未明）、司法当局の出廷要請を拒み、ベルギーに滞在中のプチデモン前州首相ら５人の元幹部に対し、欧州連合（ＥＵ）共通の「欧州逮捕状」を発行した。ベルギー側は逮捕状を受理し、身柄の取り扱いについて一両日中に裁判所が審理に入る。欧州逮捕状はＥＵ加盟国間で刑事事件の協力を巡る障害を取り除くために設けられた制度だが、プチデモン氏らは、手続きの引き延ばしを模索してベルギーにとどまり続ける意向で、直ちにスペインに移送される可能性は極めて低い。ベルギー当局が欧州逮捕状を受理したことにより、プチデモン氏らは一時的に拘束され、２４時間以内に裁判所の尋問を受けることになる。裁判所はベルギー国内法に反していないかなどを考慮しながら拘束の維持と身柄の引き渡し、条件付き保釈、逮捕状の却下などの対応を判断する。ベルギーメディアによるとプチデモン氏の弁護士は、スペインへの身柄引き渡しが認められた場合は不服を申し立てる意向で、最終的な判断が下されるまでには２カ月近くを要すると伝えている。一方、プチデモン氏は３日夜、逮捕状の発行直前にベルギー公共放送ＲＴＢＦに出演し、スペインの司法判断を「政治的」だと批判しながらも「ベルギーでの手続きには協力する」と述べた。またカタルーニャ州の自治権停止措置を決めた中央政府が１２月２１日に実施する州議会選挙を巡り「立候補する準備はできている」と述べ、国外にとどまったまま選挙活動を展開する意向を示した。"
"イスラエル首相と会談　イラン核合意で","2017年11月3日 21時23分","イスラエル,イギリス,イラン,欧州,速報,国際,中東","【ロンドン矢野純一、エルサレム高橋宗男】英国のメイ首相は２日、英首相官邸でイスラエルのネタニヤフ首相と会談した。トランプ米政権が「認めない」とするイラン核合意について、メイ氏は地域の安全保障にとって必要だとする考えを示した。ネタニヤフ氏は「イランは中東を支配しようとするばかりでなく、核兵器開発を決意している」と強調し、米国同様「合意の不備を修正しなければならない」と訴えた。一方、シリアやレバノンで活動するイスラム教シーア派武装組織ヒズボラへの支援など、イランが地域を不安定化させる活動に対抗するため両国が協力することでは合意。また、メイ氏はパレスチナ国家を樹立してイスラエルとの共存を目指す「２国家共存」への支持を改めて表明した。首脳会談はイスラエル建国につながった「バルフォア宣言」から１００年の節目を記念したもの。第一次世界大戦中の１９１７年１１月２日、バルフォア英外相がロスチャイルド英国シオニスト連盟会長に送った書簡の中で、ユダヤ人の民族的郷土をパレスチナにつくることを支持し、４８年の建国につながった。ネタニヤフ氏は「ユダヤ人の国家建設に道を開いた」と宣言をたたえ、メイ氏は「英国が果たした役割は誇りだ」と述べた。"
"前州首相らの逮捕状発行へ　スペイン裁判所","2017年11月3日 20時34分","スペイン,欧州,速報,国際","【ブリュッセル八田浩輔】スペイン北東部カタルーニャ自治州の独立問題で、スペイン司法当局の出廷要請に応じなかったプチデモン前州首相ら５人の元幹部に対し、スペインの裁判所が３日にも、欧州連合（ＥＵ）共通の「欧州逮捕状」を発行する見通しとなった。スペイン検察筋の話として、ＡＦＰ通信などが伝えた。またスペイン当局は２日、国家に対する反逆容疑などで尋問した前州副首相ら９人を逃亡の恐れがあるとして拘束した。独立賛成が圧倒的多数となった１０月１日の住民投票を受けた州幹部の身柄拘束は初めて。中央政府による独立派の強制的な一掃が進んでいる。カタルーニャの州都バルセロナのコラウ市長はツイッターに「カタルーニャにとって暗黒の日だ」と投稿。プチデモン氏も釈放を求める声明を発表した。スペイン当局は今後、プチデモン氏らが滞在しているベルギーの司法当局に身柄の拘束と移送について協力を求める。欧州逮捕状はＥＵ加盟国間の刑事司法協力を簡素化するためのものだが、執行にはベルギー国内での司法手続きも必要になる。ベルギー政府はこれまで、プチデモン氏らの滞在を「欧州市民の移動の自由」を理由に黙認していた。プチデモン氏の弁護士は２日、ベルギー公共放送ＶＲＴに対し、司法手続きに協力する意向は示したものの、ベルギーの裁判所がスペインへの身柄引き渡しを認めれば、不服を申し立てると主張。その場合は、最終的な決定まで１カ月半から２カ月を要するとの見通しを語った。一方、スペイン当局は拘束した９人のうち、独立宣言に反対した１人にのみ５万ユーロの支払いを条件に保釈を認めた。スペイン中央政府は、カタルーニャ州の自治権停止措置の一環として１２月２１日に州議会選挙を実施する意向を表明。プチデモン氏らは選挙結果を尊重する考えを示している。"
"前州首相ら国際手配要求　検察、司法当局に","2017年11月3日 01時20分","スペイン,ベルギー,欧州,速報,国際","【ブリュッセル八田浩輔】スペイン北東部カタルーニャ自治州の独立問題で、スペインの検察当局は２日、ベルギーに滞在するプチデモン前州首相ら５人の国際指名手配を出すよう司法当局に求めた。今後、ベルギー当局の協力を得て身柄拘束を図るものと見られる。ＡＰ通信などが報じた。マドリードの裁判所では同日、今回の問題で中央政府が解任した州政府幹部らが反逆容疑などで尋問を受けた。しかし、ベルギーメディアによると、出廷を命じられていたプチデモン氏らは「法的な根拠がない」などと受け入れを拒否。ベルギーでの聴取には応じる意向を示していた。反逆罪で起訴された場合、最高刑は禁錮３０年となる。"
"核合意の維持で一致","2017年11月2日 21時13分","ロシア,アゼルバイジャン,イラン,欧州,速報,国際,中東","【モスクワ杉尾直哉】ロシアのプーチン大統領とアゼルバイジャンのアリエフ大統領は１日、訪問先のイランの首都テヘランでロウハニ大統領と会談した。タス通信などによるとイラン核合意の維持やシリア紛争終結へ向けた協力で一致した。イランが核開発を大幅に制限するかわりに米欧などが経済制裁を解除する２０１５年の核合意はトランプ米大統領が激しく批判し、ロシアや欧州連合（ＥＵ）が反発している。ロシアとイランは、欧米と関係が良い旧ソ連構成国アゼルバイジャンと連携し対米圧力を強めるねらいがある。ロシアは核合意の維持を前提に、イラン南部のブシェール原発の第２、３号機建設を進めている。３大統領は来年、モスクワで会談することを決めた。プーチン氏は、イランの最高指導者ハメネイ師とも別途、会談した。イランからの報道によると、ハメネイ師は米国がロシアとイランに科す制裁に対抗するため「米ドル決済の拒否」を提案した。"
"ファロン国防相が引責辞任　セクハラ問題で","2017年11月2日 21時11分","イギリス,欧州,速報,国際","【ロンドン矢野純一】英国のファロン国防相（６５）は１日、女性記者に対する２００２年のセクハラ問題で引責辞任すると明らかにした。メイ首相は２日、ウィリアムソン下院院内幹事長（４１）を国防相に任命した。欧州連合（ＥＵ）との離脱交渉が難航する中、メイ政権の弱体化に拍車がかかりかねない。英メディアによると、ファロン氏は０２年の保守党夕食会で女性記者の膝に何度も手を置き、相手が「同じ事をしたら殴る」と警告するまで続けた。ファロン氏は報道直後に事実を認め謝罪した。ファロン氏はメイ氏宛て書簡で国防相は辞任するが議員として政権を支えると述べた。英ＢＢＣには「１５年前に受け入れられていたかもしれないことは、今は受け入れられない」と語った。英政界では、議員のスタッフらに対するセクハラ疑惑が浮上。英メディアは約４０人の保守党議員の関与の可能性を報じている。"
"州幹部が裁判所に出廷","2017年11月2日 19時49分","スペイン,欧州,速報,国際","【ブリュッセル八田浩輔】スペイン北東部カタルーニャ自治州の独立問題で、一方的な独立宣言に向けた動きを主導したとして中央政府に解任された州政府幹部らが２日、スペイン司法当局の命令に応じてマドリードの裁判所に出廷した。予審判事が反逆などの容疑で２日間尋問する。ＡＦＰ通信によると、当局が出廷を命じた前州幹部計１４人のうち、プチデモン前首相を含む５人は姿を見せなかった。先月３０日からベルギーに滞在するプチデモン氏は、命令は「法的根拠がなく、懲罰を目的としたもの」と主張。ベルギー公共放送ＶＲＴが顧問弁護士の話として伝えたところによると、ベルギーでなら尋問に応じる意向を示している。一方、スペイン当局はプチデモン氏に対してあくまで本国での尋問を求める構えで、要請を拒み続けた場合は欧州連合（ＥＵ）共通の逮捕状を発行し、ベルギー当局の協力を得て身柄の拘束に乗り出す可能性もある。反逆罪で起訴された場合、最高刑は禁錮３０年。"
"ファロン国防相辞任　過去のセクハラ問題で","2017年11月2日 09時40分","イギリス,欧州,速報,国際","【ロンドン矢野純一】英国のファロン国防相（６５）は１日、女性記者に対する２００２年のセクハラ問題が浮上したとして、責任を取って国防相を辞任することを明らかにした。メイ首相は辞任を了承した。欧州連合（ＥＵ）との離脱交渉が難航する中、メイ政権の弱体化にさらに拍車がかかる可能性がある。１０月３１日付の英大衆紙サンが、ファロン氏が０２年の保守党夕食会で、女性記者の膝に何度も手を置き、女性記者が「また同じ事をしたら殴りつける」と警告するまで続けたと報じていた。ファロン氏は報道直後に事実を認めて謝罪していた。ファロン氏は、メイ氏に宛てた手紙で「私の過去の事実が、英軍に要求される高い規律に達していなかったことを受け入れる」として辞任を表明。議員は辞職せず、メイ政権を支えるとした。また、英ＢＢＣに対して、ファロン氏は「１０年、１５年前に受け入れられていたかもしれないことは、今は受け入れられない」と述べた。英政界では、議員のスタッフらに対するセクハラ行為を巡る疑惑が浮上。英メディアは３６人の保守党議員に疑惑があると報じていた。メイ氏は、議員の行動に自覚を促すと共に、厳格に対応することを明らかにしていた。ファロン氏はキャメロン政権時代の１４年７月から国防相を務めていた。"
