"title","date","tags","article"
"離脱で基本合意　「将来の関係」など次の協議へ","2017年12月8日 20時13分","ＥＵ,イギリス,欧州,速報,国際","【ブリュッセル八田浩輔、ロンドン矢野純一】英国のメイ首相と欧州連合（ＥＵ）のユンケル欧州委員長は８日、ブリュッセルで会談し、英国のＥＵ離脱の条件を巡って基本合意に至ったと発表した。離脱交渉は大きく前進し、双方は今後、２０１９年３月末に英国が離脱した後の混乱を避ける移行期間や自由貿易など「将来の関係」の協議に移る。基本合意したのは、英国が支払うＥＵ予算分担金などの「手切れ金」▽アイルランドとの国境管理▽英国に暮らす約３００万人のＥＵ加盟国出身者の権利保障－－の三つの課題。ＥＵは１４、１５日の首脳会議で英国を除く２７加盟国で英ＥＵ間の貿易協議に入ることを正式に決める。ＥＵ基本条約で定められた交渉期限は残り約１年３カ月。双方は、２年程度の移行期間を設ける必要性では一致するが、利害が衝突する貿易協議ではこれまで以上に厳しい交渉が控え、時間切れによる「決裂」の回避が焦点となる。トゥスク欧州理事会常任議長（ＥＵ大統領）は８日の記者会見で進展を歓迎しつつ、「新たな関係を築く（交渉の）方がさらに困難だ。簡単なはずの課題に時間をかけすぎた」と焦燥感をにじませた。貿易関係を含む最終合意には双方の議会の承認が必要となっており、期限から逆算して１８年秋には実質的な交渉を終わらせる必要がある。今年６月に始まった交渉で、英国は早期の貿易協議開始を要求。だが、ＥＵ側は三つの課題で「十分な進展」がない限り、それを認めない姿勢を示していた。特に「手切れ金」で交渉が行き詰まり、当初目指した１０月の貿易協議入りは先送りに。１１月末に英国が大幅増額で譲歩したが、アイルランド問題が最後の壁として残り、ＥＵは今週末を「最後の期限」として英国に妥協案の提示を迫っていた。２０１７年３月２９日　　　　英国がＥＵに離脱を正式に通告（交渉期間はこの日から２年間）６月１９日　　　　離脱交渉を開始１２月　８日　　　　離脱条件で基本合意１４、１５日　ＥＵ首脳会議で英除く加盟国が貿易協議入りを正式決定へ２０１８年１０月ごろ　　　　　貿易関係を含めた最終合意をまとめた後、英国とＥＵの議会で合意内容を審議、批准手続きへ２０１９年３月２９日　　　　英国のＥＵ離脱日。その後、２年程度の移行期間中はＥＵ単一市場にとどまる？"
"首相が辞任、後任にモラウィエツキ財務相","2017年12月8日 18時54分","国際,欧州,速報","ポーランドの与党「法と正義」は７日、シドゥウォ首相が辞任し、後任にモラウィエツキ財務相を選んだと発表した。シドゥウォ氏は好調な経済を背景に支持率が高かったが、政府の司法介入を可能とする法案などを巡って欧州連合（ＥＵ）の反発を引き起こした。「法と正義」のカチンスキ党首は２０１９年の総選挙を見据え、政権の刷新が必要と判断したとみられる。【ウィーン】"
"ＶＯＡなど米９報道機関を「外国エージェント」に","2017年12月8日 18時09分","アメリカ,欧州,北米,速報,国際","ロシア司法省は５日、米国営ラジオ「ボイス・オブ・アメリカ」（ＶＯＡ）や米議会が資金を出す「ラジオ自由ヨーロッパ」など米国の９報道機関を「外国エージェント」に指定。外国のメディアの監視を強めることを目的とした改正マスコミ法に基づく措置。改正法はプーチン大統領が先月２５日に署名していた。【モスクワ】"
"社民党、メルケル氏と会談へ","2017年12月8日 17時55分","国際,欧州,速報","【ベルリン中西啓介】ドイツの国政第２党・社会民主党は７日、ベルリンで開いた党大会で、メルケル独首相の国政最大会派キリスト教民主・社会同盟（ＣＤＵ・ＣＳＵ）と大連立政権継続を含めた協議に着手する方針を決めた。独メディアによると、１３日にもメルケル氏と社民党のシュルツ党首による会談が行われる。第４次メルケル政権発足失敗による混乱収束に向けた一歩だが、社民党内には大連立反対派も多く情勢は予断を許さない。党大会では正式に連立協議入りをする場合、来年１月にも臨時党大会を開き交渉入りを承認することも決まった。その後、大連立協議がまとまることになれば、全党員約４４万人による投票で政権入りの可否を決める。社民党は大連立だけでなく、少数内閣への閣外協力や再選挙も視野に協議に臨む方針だが、大連立継続を求める世論は強まるとみられている。また党大会でシュルツ氏は得票率８１．９％で党首に再選された。"
"イシグロさん講演に「温かい人柄感じた」","2017年12月8日 09時41分","スウェーデン,イギリス,欧州,速報,国際","【ストックホルム鶴谷真】７日夕（日本時間８日未明）に行われた、ノーベル文学賞の恒例の記念講演。文学への信頼を約４５分にわたって語り終えたカズオ・イシグロさん（６３）が原稿から顔を上げると、聴衆は一斉に立ち上がって拍手を贈った。その１人で毎年駆けつけるという元新聞記者のクリステル・デュークさんは「過去の受賞者と比べても最高の講演の一つ。ユーモアがあり、温かい人柄を感じた」と語った。イシグロさんは長崎市で日本人の両親の元に生まれ、５歳で英国へ移住。「虚構の世界を創造する作家になるずっと前から、日本にまつわる両親の話を元に、日本という土地を頭の中で一生懸命に作っていた」と述べ、この想像力が文学的原点だと紹介した。また代表作「日の名残り」（１９８９年）をほぼ完成させたものの「何かが足りない」と自問していた時にシンガー・ソングライターのトム・ウェイツさんの曲「ルビーズ・アームズ」を聞いて「感情を抑えてきた（主人公である）執事の心のよろいにひびを入れねばならない」と気付いたエピソードを披露。これが世界的に評価の高い、執事が涙を流すラストシーンにつながったことを明らかにした。従来の文学の概念を押し広げてこそ偏狭なナショナリズムなどの「壁を取り払うだろう」と強調し、そのために若い世代を応援していく決意を表明した。リンショーピン大のラース・ハカン・スベンソン名誉教授（英文学）は「感動的で、周囲も引き込まれていた。分断が目立つ社会状況にも言及し、今日的だった」とたたえた。自身の多文化的背景を、文学と音楽との関連で明かしている。音の響きとしても、計算され尽くした講演だ。彼が耽溺（たんでき）した１９６０年代以降のロックンロールは、もともと民族や国家を超えた多文化音楽であり、だからこそさまざまな境界を取り払う破壊力と創造力を発揮した。夏目漱石が英文学者の道を断念して国民作家になって１００年あまり、イシグロはロックスターの道は断念しても、音楽家とも頻繁に共作する世界的作家だ。まさに２１世紀のノーベル文学賞受賞にふさわしい。"
"世界の分断、文学が突破口　イシグロさん講演","2017年12月8日 09時41分","スウェーデン,イギリス,欧州,速報,国際","【ストックホルム鶴谷真】今年のノーベル文学賞に選ばれた日系英国人作家、カズオ・イシグロさん（６３）が７日夕（日本時間８日未明）、スウェーデン・アカデミーで約５００人の聴衆を前に記念講演を行った。演題は「私の２０世紀の夜、そしてその他のささやかな突破口の数々」。格差が広がって世界中で人々が分断される中で「私たちはもっと多様にならねばならない」と語り、文学こそ貢献できるとの信念を示した。イシグロさんは２０代で小説を書き始めた理由を、出身地の長崎市でのわずかな記憶を残したいとの「奇妙な情熱」がきっかけだったと紹介。そこには５歳で英国へ移住して以降、学校では英国人、家庭では日本人として学んだ異なる価値観の影響があると述べた。小説執筆で壁にぶつかると、作家の先達や異分野のミュージシャンの仕事から多くのヒントを得てきたエピソードも具体的に紹介した。排外的な空気が広まる現代世界を憂慮しつつ、若い世代の文学者への期待を打ち出して締めくくった。イシグロさんは１０日の授賞式でメダルなどを授与され、晩さん会に出席する。"
"領内全域でＩＳ壊滅　露国防相が報告","2017年12月7日 21時42分","ロシア,中東,欧州,速報,国際","【モスクワ杉尾直哉】ロシアのショイグ国防相は６日、プーチン大統領に対し、シリア領内全域で過激派組織「イスラム国」（ＩＳ）を壊滅し、「シリア領が解放された」と報告した。プーチン大統領が記者団に明らかにした。プーチン氏は同日、「一部の残党の抵抗は残るかもしれないが、テロリスト壊滅という完全な勝利により、軍事作戦は終了した」と述べ、勝利と軍事作戦終結を宣言した。また「次のステップは政治プロセスだ」と述べ、アサド政権と幅広い反体制派の代表を集めた「国民対話会議」を開催し、大統領選挙や議会選挙の実施を目指す考えを示した。ロシアは２０１５年９月末からシリアで大規模な空爆作戦を展開してきた。"
"調印から３０年存続の危機　米露が非難合戦","2017年12月7日 21時36分","ロシア,アメリカ,欧州,北米,速報,国際","【ワシントン会川晴之】調印から８日で３０年となる米国とロシアの中距離核戦力（ＩＮＦ）全廃条約が存続の危機を迎えている。米露が互いに「条約違反だ」と非難合戦を展開する中、反露派が大勢を占める米議会は、ＩＮＦで禁止対象のミサイルの開発調査費として新年度予算に５８００万ドル（約６０億円）の計上を決定。近くまとめられる米国の核戦略の指針「核態勢見直し」（ＮＰＲ）にも影響を与えそうだ。「ロシアは数年にわたって条約を破ってきた」。マティス米国防長官は先月９日、北大西洋条約機構（ＮＡＴＯ）の国防相会議（ブリュッセル）での記者会見で断言した。ロシアは条約で禁止された中距離弾道ミサイルの製造に２０１２年から着手し、今年２月には巡航ミサイルを実戦配備した、というのが米国の主張だ。ロシアは「そのような批判は受け入れられない」（ペスコフ大統領報道官）と反論。プーチン大統領も「米国が条約を順守している限りロシアも尊重する」とし、米国の主張は事実無根と退けた。一方でロシアは、米国が１６年にルーマニアに配備した弾道ミサイル防衛（ＢＭＤ）施設が「攻撃用に変更可能で、条約違反だ」と非難。米国は「ＢＭＤは防衛兵器」と反論するなど、議論はかみ合わない状態だ。米露は１６年１１月、条約で定めた検証委員会を１３年ぶりに開いたが、そこでも議論は平行線に終わった。近く再会合を開く方向で調整している。米国には、条約を無視して新型の中距離弾道ミサイル製造を進める選択肢もある。だが、この分野ではロシアが先行しており、多額の費用もかかるため、マティス氏は「ロシアに対し、条約順守という元の状態に戻ってもらうよう努力を続けている」と説明している。条約が締結された冷戦時代は、ソ連（現ロシア）の通常戦力が米国を中心とする北大西洋条約機構（ＮＡＴＯ）軍のそれを上回っており、米国は欧州に中距離核ミサイルを配備することで軍事バランスをとろうとした。だが現在は情勢が逆転し、米国に通常戦力で劣るロシアが中距離核戦力の配備を急いでいるという背景もある。東西冷戦中の１９８７年に米国とソ連が結んだ条約。射程５００～５５００キロの中距離で地上発射型の弾道ミサイルと巡航ミサイルの保有を禁じ、欧州の緊張緩和につながった。９１年までに双方が対象ミサイルを廃棄。実験や製造、配備は違反だが、研究開発は認められている。"
"プーチン氏再出馬表明","2017年12月7日 21時20分","ロシア,欧州,速報,国際","【モスクワ杉尾直哉】ロシアのプーチン大統領（６５）が６日、任期満了に伴う来年３月１８日の大統領選への再出馬を表明した。再選が確実視され、任期は２０２４年５月まで。旧ソ連と連邦崩壊後のロシアを通じ、最も長く最高指導者のポストにいたのは、ソ連のスターリン書記長の２４年間以上だ。プーチン氏は９９年１２月末にエリツィン大統領から後継指名を受けて大統領代行となり、００年に大統領に就任。０８年から１２年までは連続３選を禁じた憲法に従って大統領職から離れ首相に退いたが、１２年に「３期目」に復帰した。首相だった４年間を除いても、大統領としての在職期間は計２０年となる。「４期目」は大統領としての最後の任期。７１歳となる任期切れまでの後継体制作りと、退任後の自らの処遇が問題となるが、意表を突く人事などで人々の関心を引き寄せ続けるとみられている。サイトに７日掲載した「露大統領選：再出馬表明プーチン氏　ブレジネフ超え確実に」の記事で、「過去１００年のロシアの最高指導者で最長の統治期間を手にすることが確実となった」は誤りでした。「ブレジネフ超え確実に」の見出しとともに削除します。また、これまで最長だったのは「ソ連のブレジネフ書記長の１８年間」とあるのは「ソ連のスターリン書記長の２４年以上」の誤りでした。プーチン氏が再選された場合の任期は、スターリンに続き２番目になります。"
"社民、大連立審議へ　党大会開幕、党員同意が焦点","2017年12月7日 19時41分","国際,欧州,速報","【ベルリン中西啓介】ドイツの国政第２党・社会民主党の党大会が７日、ベルリンで開幕した。国政最大会派キリスト教民主・社会同盟（ＣＤＵ・ＣＳＵ）を率いるメルケル首相が第４次政権の発足に失敗し、政治停滞が続く中、社民党が大連立協議着手に向けた最低条件となる党員の同意を得られるのか、注目されている。党大会初日にシュルツ党首が再選される。シュルツ氏は演説で「我々の生活を良くするためには（国政だけでなく）欧州を強くする必要がある」と述べ、欧州連合（ＥＵ）の統合を進め、２５年までに「欧州合衆国」に発展させる構想を提唱。「自動的に政権入りすることはないと保証する」と大連立を含めた協議への理解を求めた。当初野党路線だったシュルツ氏はメルケル氏が自由民主党、緑の党との３会派連立協議に失敗し、安定政権を求める世論が拡大したことで政権入り以外の選択肢も含めＣＤＵ・ＣＳＵと協議する考えに転じた。ＥＵ改革の旗手マクロン仏大統領も大連立を求めるなど国際的圧力が高まる。シュルツ氏は党内で広く支持されるＥＵ政策を前面に出すことで、大連立反対を掲げる党青年部などを説得し、求心力を高めたい狙いだ。だが、党青年部代表者が党大会で「大連立を拒否した過去の方針を維持しよう」と呼びかけると、大きな拍手が起きるなど大連立に向け党内がまとまるかは不透明だ。シュルツ氏は連立交渉後、党員投票で政権入りの可否を決める考えだ。"
"英首相「地域平和の助けにならない」","2017年12月7日 10時39分","イギリス,パレスチナ,イスラエル,アメリカ,速報,国際,中東,欧州,北米","【ロンドン矢野純一】トランプ米大統領がエルサレムをイスラエルの首都として認めるとした正式な発表に対して、英国のメイ首相は６日夜、エルサレムを首都として認めることに「同意しない」とする英政府の正式な立場を表明するとともに、「地域の平和の助けにならない」と批判した。米国と「特別な関係」にある英国だが、メイ氏らは最近、トランプ氏の言動に批判を繰り返す場面が目立っており、米英関係がぎくしゃくしている。トランプ氏の方針については同日午前、ジョンソン外相が記者の質問に答える形で、批判。メイ氏は正式なトランプ大統領の発表を待って声明を出した。メイ氏は声明で「エルサレムの位置づけは、イスラエルとパレスチナ間の交渉で決めるべきだ」とした。また、現在テルアビブにある英国大使館を、エルサレムに移転させる計画はないとした。一方、トランプ氏が「イスラエルとパレスチナの和平合意の仲介に関与し続ける」と表明したことは評価し「米政府が両国問題の解決に向けた具体的な提案をすることを期待する」と米国の和平への積極関与を求めた。英国ではトランプ氏の言動に批判が強まっている。英国の極右団体幹部がツイッターに投稿した反イスラム感情をあおる内容をトランプ氏が先月、リツイート（拡散）したことについて、メイ氏が「不適切だ」と非難していた。"
"プーチン氏が再出馬を表明","2017年12月7日 00時49分","ロシア,欧州,速報,国際","【モスクワ杉尾直哉】ロシアのプーチン大統領（６５）は６日、自身の任期満了に伴う来年３月の露大統領選への再出馬を表明した。再選が確実視されており、７１歳となる２０２４年５月まで実質４期を務めることになる。６日夕、訪問先のロシア中部のニジニノブゴロドで開かれた露自動車メーカー「ガス」の設立８５周年記念式典で再出馬を表明した。これに先だち、プーチン氏は、モスクワで約１万５０００人の若者を集めた催しに参加し、「大統領選への出馬条件はただ一つ。人々の支持だ。私が（出馬を）決心したら支持してくれるか」と問いかけ、熱狂的な大歓声を受けていた。旧ソ連の秘密警察、国家保安委員会（ＫＧＢ）出身のプーチン氏は４７歳で大統領に初当選。０８年までの連続２期（当時の任期は４年）を務めた後、連続３選を禁じた憲法に従い退任。側近のメドベージェフ氏（現首相）に大統領職を譲って、首相に退いた。１２年の大統領選で「３期目」当選した。"
"ロシアは懸念を表明","2017年12月6日 22時56分","イギリス,アメリカ,中国,インドネシア,パレスチナ,ロシア,イスラエル,すべて表示する","トランプ米大統領がエルサレムをイスラエルの首都と認める方針を示したことに、各国は懸念や不支持などを表明した。■ロシアロシアのプーチン大統領は５日、パレスチナ自治政府のアッバス議長との電話協議で「（中東情勢などの）状況を複雑化させる」として懸念を表明した。ペスコフ大統領報道官が６日、明らかにした。露大統領府によると、プーチン氏は、アッバス氏に対し、「エルサレムの地位」を含む中東和平問題の解決へ向け、「パレスチナとイスラエルの直接交渉の再開」を訴えた。また、パレスチナとイスラエルの「２国家共存」を最終目標とするロシアの方針を改めて表明した。ただ、ペスコフ報道官は、「（米政府が）まだ決定を表明していない」として、米国大使館をテルアビブからエルサレムに移転させる計画などへのコメントを避けた。【モスクワ杉尾直哉】■ＥＵ欧州連合（ＥＵ）のモゲリーニ外務・安全保障政策上級代表（外相）は５日、トランプ米大統領によるエルサレムの「首都承認」前にブリュッセルでティラーソン米国務長官と会談した。終了後の共同記者会見で、モゲリーニ氏はイスラエルとパレスチナの「２国家共存」の実現に向けた努力を支持する考えを示したうえで、「その土台を壊すようないかなる行動も絶対に回避すべきだ」と米側をけん制。「エルサレムの地位に関しては交渉による解決策を見いださなければならない」と述べた。ティラーソン氏はこの問題で発言しなかった。【ブリュッセル八田浩輔】■英国北大西洋条約機構（ＮＡＴＯ）外相会議に出席するためブリュッセルを訪問していた英国のジョンソン外相は６日、記者団に「懸念する」と述べ、米国の立場を支持しない方針を示した。また、英大使館をエルサレムに移転する計画がないことを明らかにしたうえで「エルサレムの地位に関する問題は、イスラエルとパレスチナ側の交渉で解決すべきだ」とした。【ロンドン矢野純一】■中国中国外務省の耿爽（こう・そう）副報道局長は６日の定例会見で、米国のエルサレム首都認定について「慎重に事を進め、地域の新たな対立誘発を避けるべきだ」と述べた。中国の立場については「中東和平プロセスの進展を終始、断固として支持し、パレスチナ人民が合法的な民族の権利を回復することを支持する」と説明した。【北京・浦松丈二】■インドネシア２億人超のイスラム教徒を抱えるインドネシアでは、カラ副大統領が地元メディアに「中東の政治状況がより複雑になる」と話し、米国の決定に懸念を表明した。カラ氏は、中東和平協議で米国が仲介役を務めるのが難しくなるとも指摘した。【ジャカルタ平野光芳】"
"最高検察庁、サーカシビリ氏を起訴","2017年12月6日 21時18分","ロシア,ジョージア（グルジア）,欧州,速報,国際","【モスクワ杉尾直哉】ウクライナ最高検察庁は６日、同国に滞在しているジョージア（グルジア）のサーカシビリ前大統領を「犯罪組織参加罪」などの罪で起訴した。ルツェンコ検事総長によると、２０１４年のウクライナ政変で失脚し、ロシアに亡命中のヤヌコビッチ前大統領のグループから資金を得て、反政府活動をしていた疑いがもたれている。サーカシビリ氏は５日、ウクライナ捜査当局に拘束されたが、連行した車の通行を阻止した支持者の助けで脱出。その後、首都キエフの最高会議（１院制議会）の近くで支持者数百人と共に集会を開き、「ポロシェンコ大統領の弾劾」を訴えた。サーカシビリ氏は行方をくらましており、当局が指名手配した。"
