"title","date","tags","article"
"再燃か、米が合意見直しに言及","2017年9月20日 10時22分","アメリカ,イラン,中東,北米,速報,国際","【ワシントン大前仁、ウィーン三木幸治】２０１５年にイランと主要６カ国が結んだ核合意について、トランプ米政権は厳密に査察できていないと主張し、１０月にも合意の見直しに乗り出す可能性をちらつかせている。国連総会に出席したトランプ大統領は１９日の一般討論で核合意を「一方的で米国にとって恥ずかしい合意だ」と批判しており、イラン核問題が再燃する恐れも出てきそうだ。演説でトランプ氏はイランが弾道ミサイルの開発を続けているとも批判し、「国際社会が圧力を強めるべきだ」と唱えた。米国は過去に核兵器の起爆装置の製造が試みられた疑いのある軍事施設について、イランが国際原子力機関（ＩＡＥＡ）の査察を受け入れていないと批判。２１日に開く国連安全保障理事会の閣僚会合でも、この点を取り上げるとみられる。ティラーソン米国務長官は１９日、米ＦＯＸニュースのインタビューで、「核合意は見直されなければならない。さもなければ、米国は合意の一端を担い続けることはできない」と述べ、合意からの離脱にも言及した。核合意履行を巡っては、米政府はイランが順守しているのかを３カ月ごとに判断し、議会へ報告している。次の報告期日を１０月１５日に控え、トランプ氏は「近く我々の決定が分かるだろう」と今月１８日に発言。もし米政府がイランの査察受け入れ態勢を「クロ」と判定すれば、議会の見解を聞いたうえで、イランへの制裁発動や米国の合意からの離脱などの対応を決めていく見通しだ。一方、ＩＡＥＡが８月末に出した報告書でも、イラン国内で貯蔵が認められている濃縮ウラン総量などで規定違反がなかったと認定されている。また国連総会に出席中のイランのロウハニ大統領は１８日にＣＮＮの番組に出演。「米国が合意から離脱すれば、高い代償を支払う羽目になるだろう。我々も対応を熟考している」と強く反発した。国際社会でも米国への支持は広がっていない。米国が問題視する「軍事施設の査察」については、合意締結を優先した当時のオバマ米政権が文書に明記することを断念しており、イランが査察を拒んでも明確な合意違反といえない模様だ。またイランと結んだ合意は米国以外の５カ国も署名しており、米国が破棄しても合意が存続する事情もある。合意の署名国の一つ、フランスのマクロン大統領は１８日にロウハニ師と会談した際、合意の維持を支持していく考えを確認した。"
"逮捕の１８歳は「イラク出身の難民」報道","2017年9月18日 20時00分","イギリス,シリア,イラク,欧州,速報,国際,中東","【ロンドン矢野純一】ロンドンの地下鉄で起きた爆弾事件で１８日、英スカイニュースはテロ容疑で逮捕された少年（１８）はイラク出身の難民と報じた。また、複数の英メディアは同容疑で逮捕された別の男はシリアのダマスカス出身のヤヤ・ファルク容疑者（２１）と伝えた。スカイニュースによると、少年は１５歳の時に英国に逃れたイラク難民で、両親はすでにイラクで死亡しているという。少年はロンドン西郊サリー地方サンベリー・オン・テムズで英国人の里親に育てられていたという。一方、ファルク容疑者も難民とみられ、同じ里親に一時、育てられていたという。現在は里親の元を離れ、同地方スタンウェルに住んでいる。同容疑者は自身のフェイスブックで、自宅近くの大学で英語を学び、イベント会社で働いているとしている。ロンドン警視庁は、過激派組織「イスラム国」（ＩＳ）との関連を調べているが、ラッド英内相は１７日、「現時点でＩＳとの背後関係を示す証拠はない」と話している。"
"対ＩＳ　イランが派兵、シリア紛争地に","2017年9月18日 18時18分","イラン,アフガニスタン,イラク,シリア,速報,国際,中東","イランが自国に居住するアフガニスタン難民を、シリア紛争の戦場に派兵するため、招集しているとみられる現場を毎日新聞が確認し撮影した。過去の派兵経験者の証言を基に、首都テヘラン近郊に集められている姿を２度取材した。欧米メディアなどが経験者の証言を報じたことはあるが、招集現場を撮影したのは極めて異例。複雑な中東情勢を背景に、イランは公式には戦闘行為に直接関与していないとの立場だが、実際にはシリアのアサド政権を支援し、過激派組織「イスラム国」（ＩＳ）と戦わせるため、組織的、継続的に派兵している現状が判明した。【テヘランで田中龍士】多数の死者が出たとの証言があり、難民条約などで保護すべき難民を危険にさらす行為は、人道上問題があるとして国際的な批判が高まる可能性がある。今年３月と７月、２回にわたり取材に応じた３０代の派兵経験のある難民男性は２０１４年、口コミで知り参加した。他の難民とともにイラン指導部に忠実な軍事組織「革命防衛隊」による軍事訓練を受け、自動小銃の操作方法などを学んだ。いったん解散し、再度招集されシリアに送られた。男性はイスラム教シーア派で、シリアの首都ダマスカスにある同派の聖地「ゼイナブ廟（びょう）」を守るのが目的と説明を受けていたが、実際には各地の最前線で戦い、銃撃などで多数の死者が出た。男性によると、難民は派兵直前、テヘラン近郊の地下鉄「ハラメ・モタッハル駅」近くの運動場のような施設に集められる。「招集日は毎週火曜日と木曜日」という。確認のため、７月２５日火曜日早朝、記者は現地を訪れた。周囲には観光地でもある聖地ホメイニ廟や、イラン最大の共同墓地「ベヘシュテ・ザフラ」が広がり、自動小銃を肩に掛けた兵士が角に立つ。約２００人の若者の影が見えたが、接近すると当局者とみられる男に「ヘイ、ミスター」と警告された。２日後の木曜日早朝、施設周辺の路上に集まっている若者たちを見つけた。派兵されているアフガン人民兵は「ファテミユン」と呼ばれる。イスラム教の開祖で預言者、ムハンマドの娘ファーティマがその由来とされる。２０歳前後とみられる若者に声をかけ「ファテミユンか」と尋ねると、若者は「はい」と認め「あそこに行く」と招集場所の施設の方を指さした。その後、イラン人とみられる関係者２人が現れ、若者らと握手すると、施設に消えた。男性の証言によると、施設内ではグループ分けや戦場での手順の確認などをし、約３０キロ南西の国際空港イマム・ホメイニから民間機でシリアに向かう。パスポートがなくても、特別に発行される書類で出入国できる。報酬の相場は１カ月約３０００万リアル（実勢レートで約８万３０００円）。勧誘の際「アフガンへの強制送還を免除する」と持ちかけるケースもあったという。アフガン難民は１９７９年の旧ソ連侵攻以来、発生し続けている。欧米メディアは「ＩＳと戦うために派兵された」などとする難民の証言を報じてきた。記者は先月、来日中のイランのアラグチ外務次官に「難民を派兵しているという情報がある。本当か」と尋ねた。すると「アフガン人がシーア派の（重要な）場所を守り、テロリストと戦うためシリアに行っているのは知っている。しかし、イランから行っているのか、アフガンからなのかは知らない」と話した。革命防衛隊に関する取材は困難で、派兵の状況は主に欧米メディアに難民らが証言する形で伝えられてきたが、今回の取材は招集現場を押さえた点で大変貴重だ。難民を組織的に「傭兵（ようへい）」のように送り込んでいる実態を明らかにした意義は大きい。イラン政府としては、自国民を戦闘に参加させ、多数の犠牲が出れば、イラン国内の反発が高まり、体制の動揺を招く懸念がある。難民を派兵するのはこれを防ぐ目的もあるが、人道上の問題に加え、派兵に関して強制があれば難民保護を定める難民条約にも抵触する可能性もあり、国際的批判を受けるだろう。１９７９年のイラン・イスラム革命後、イスラム共和国体制の護持を目的に、正規軍とは別に設立された軍事組織。最高指導者ハメネイ師の直轄で、大統領の権限も及ばない。総兵力は推定約１２万５０００人。対外工作を担う精鋭「コッズ部隊」のほか、陸海空軍部隊を持つ。若者中心の民兵組織「バシジ」を傘下に置き、市民の情報統制や通信の監視もする。２０１４年７月には容疑未公表のままワシントン・ポスト紙の記者を逮捕した（１６年１月釈放）。多数の関連企業を抱え経済にも影響力を持つとされる。"
"ハマスが和解交渉の意向　ファタハと","2017年9月17日 18時48分","国際,中東,速報","【エルサレム高橋宗男】パレスチナ自治区ガザ地区を実効支配するイスラム原理主義組織ハマスは１７日、声明を発表し、パレスチナ自治政府が統治するヨルダン川西岸と、ハマスが支配するガザ地区に分断された状況を解消するため、パレスチナ主流派ファタハと和解交渉する意向を示した。ＡＰ通信が伝えた。声明によると、ハマスはガザ地区の行政機構の閉鎖や、統一政府の樹立に向けた総選挙の実施など、自治政府のアッバス議長が求める和解の条件に応じる。ファタハとの和解交渉を即座に開始する用意があるとしている。エジプト当局が、ハマスとファタハ双方の代表団とカイロで個別協議するなど、双方の直接対話に向けた仲介を続けている。パレスチナ自治区では２００６年のパレスチナ評議会（国会）選挙でハマスが圧勝したが、０７年にファタハとハマスがガザ地区で武力衝突し、ハマスが自治区を分断支配している。ファタハ幹部は１７日、パレスチナメディアに対し、ハマスの声明を歓迎しつつ、事態の推移を注視する考えを示した。一方、イスラエルや米国はハマスを「テロ組織」と認定しており、ハマスを含む統一政府の樹立には反発するとみられる。"
"露が空爆か、クルド民兵負傷　米主導連合発表","2017年9月17日 17時19分","ロシア,中東,欧州,速報,国際","【カイロ篠田航一】過激派組織「イスラム国」（ＩＳ）掃討を進める米軍主導の有志国連合は１６日、シリア東部デリゾール付近のロシア軍機による空爆で、米軍側が支援するクルド人主体の民兵組織「シリア民主軍」（ＳＤＦ）に複数の負傷者が出たとの声明を発表した。デリゾール近辺は油田地帯で、原油密輸を主な資金源としてきたＩＳの重要拠点の一つ。ロシアが支援するアサド政権軍と、米軍などが支援するＳＤＦが別々にデリゾール攻略を進めており、この地域でのＩＳ追放後の影響力確保を巡り、偶発的な衝突も懸念されている。"
"クルド係争地で爆発、３人死亡","2017年9月17日 17時11分","国際,中東,速報","【カイロ篠田航一】イラク北部キルクークの路上で１６日、自動車爆弾によるとみられる爆発があり、少なくとも市民３人が死亡、９人が負傷した。クルド系メディア「ルダウ」などが伝えた。爆発は酒類を販売する店舗の前で起きたという。イラク内務省は爆発について「テロ攻撃」との見方を示した。キルクークは油田都市で、イラク中央政府と北部クルド人自治区がともに管轄権を主張している係争地域。だがキルクーク市を含むキルクーク県は、クルド人自治区が独立の賛否を問う２５日の住民投票に参加する意向を示している。これにイラク中央政府側は反発し、キルクーク県知事の解任を決めるなど対立が深まっている。地域を不安定化させるとの理由で投票実施に反対しているイラク中央政府のアバディ首相は１６日、ＡＰ通信に「イラクの人々に危険が及んだら、軍事介入も辞さない」と発言。投票実施によりクルド側とイラク側で衝突が起きた場合、イラク軍を出動させる考えを表明し、緊張が高まっている。"
"前大統領に終身刑　国家機密漏えいで","2017年9月17日 15時14分","カタール,アフリカ,中東,速報,国際","【カイロ篠田航一】エジプトの最高裁に相当する破棄院は１６日、国家機密をカタールに漏えいした罪で、イスラム組織「ムスリム同胞団」出身の前大統領、ムハンマド・モルシ被告（６６）に終身刑を言い渡した。エジプトのメディアが伝えた。シシ現政権は同胞団を「テロ組織」とみなして取り締まりを強化しているが、カタールは同胞団を支援しているとされる。エジプトの法律では終身刑は禁錮２５年に当たる。モルシ被告は昨年１０月、在任中の２０１２年にデモ隊の殺害を扇動した罪で禁錮２０年が確定したほか、複数の事件で審理が続いている。モルシ被告は１１年の中東民主化要求運動「アラブの春」でムバラク政権が崩壊した後、１２年にエジプト初の民主的な大統領選で初当選したが、１３年のクーデターで失脚した。"
"北部に安全地帯設置　露、トルコ、イランが合意","2017年9月16日 20時56分","ロシア,カザフスタン,イラン,トルコ,速報,国際,中東,欧州","【カイロ篠田航一】内戦が続くシリアの和平を目指す協議が１５日、カザフスタンの首都アスタナで開かれた。和平を仲介するロシア、トルコ、イランの３カ国は、シリア北部イドリブ県に戦闘行為を禁じる「緊張緩和地帯」（安全地帯）を設置し、３カ国の部隊が監視に当たることで合意した。ロイター通信などが伝えた。安全地帯構想は、シリアのアサド政権軍と反体制派の兵力を引き離し、避難民の保護など人道支援活動を可能にすることが目的。３カ国は５月に結んだ覚書で、イドリブ県、中部ホムス県など４カ所に設置する計画を協議し、既にイドリブ県以外の３カ所では設置が完了している。シリアでは、内戦の混乱に乗じて勢力を伸ばした過激派組織「イスラム国」（ＩＳ）がアサド政権軍などの攻撃を受け徐々に弱体化。一方で反体制派勢力が支配的なイドリブ県では、国際テロ組織アルカイダ系の武装組織が支配領域を拡大しており、今後はイドリブ県での治安確保が重要課題になるとみられる。"
"イスラエル首相「支持する」","2017年9月15日 19時10分","イスラエル,アメリカ,トルコ,イラク,速報,国際,中東,北米","【カイロ篠田航一】イラク北部のクルド人自治区で独立の是非を問うため２５日に予定している住民投票について、イスラエルのネタニヤフ首相は「支持する」との立場を明らかにした。イスラエルのハーレツ紙が１３日伝えた。イラクの国家分裂につながりかねない動きを懸念する周辺各国や米国が「反対」で足並みをそろえる中、イスラエルは「住民投票を公式に支持した初めての国」（ＡＰ通信）とされる。ネタニヤフ首相は声明で「自らの国を持ちたいとするクルドの人々の正当な努力を支持する」と述べた。イスラエルはクルド人自治区から石油を輸入しており、経済的な結び付きが強い。ネタニヤフ首相は隣国トルコの反政府武装組織「クルド労働者党」（ＰＫＫ）については「テロ組織」と非難する一方、イラクのクルド人に対しては理解を示した。この発言に対し、イラク中央政府の連邦議会議員からは「イスラエルは、イラクが分裂し、弱体化することを望んでいるだけだ」とネタニヤフ首相への反発の声が上がっている。"
"爆弾テロ、５０人死亡　ＩＳが犯行声明","2017年9月14日 23時35分","国際,中東,速報","【カイロ篠田航一】イラク南部ナシリヤ近郊で１４日、レストランと検問所を狙った爆弾テロがあり、ロイター通信によると、少なくとも５０人が死亡、８０人が負傷した。過激派組織「イスラム国」（ＩＳ）は、影響下にあるニュースサイト「アーマク通信」を通じ「多くのイスラム教シーア派を殺害した」との犯行声明を出した。スンニ派を自称するＩＳはシーア派を敵視しており、イラク南部はシーア派住民が多い地域だ。シーア派国家イランにも近く、死者には少なくともイラン国籍の１０人が含まれているという。実行役は数人のグループとみられ、レストラン店内で１人が爆発物を入れたベストを着用して自爆後、他の男らが客を銃撃したという。検問所では自動車爆弾が爆発した。ナシリヤ近辺はイラクの主要産業の油田地帯として知られる。"
"クルド人自治区の住民投票に反対","2017年9月13日 18時58分","イラク,中東,速報,国際","【カイロ篠田航一】イラク北部のクルド人自治区で２５日に計画されている独立の是非を問う住民投票について、アラブ人が多数を占めるイラク中央政府の連邦議会は１２日、投票実施に反対する決議を賛成多数で採択した。国家分裂を懸念する議員らは「憲法上、クルド独立に関する住民投票の規定はなく、実施は違憲」と指摘。決議では、国の一体性を保持するため、中央政府に「あらゆる手段を講じる」ことを求めている。クルド系メディア「ルダウ」によると、クルド人議員は採決をボイコットしたという。採択を受け、イラク中央政府のアバディ首相は「クルド側と対話を続けたい」と述べ、投票阻止に向け説得する意向を示した。一方、クルド自治政府トップのバルザニ議長は「予定通り実施する」と強行する考えを明らかにした。"
"アルカイダ系が台頭…北部、ＩＳ弱体化に乗じ","2017年9月13日 11時52分","国際,中東,速報","【カイロ篠田航一】内戦が続くシリアの北部イドリブ県で、国際テロ組織アルカイダ系のイスラム過激派「ハヤト・タハリール・シャム」（ＨＴＳ）が台頭している。イドリブ県はアサド政権に抵抗する反体制派の数少ない拠点の一つだが、７月には反体制派の有力組織「アフラル・シャム」が撤退。代わりにＨＴＳが県都イドリブ市を制圧し、急速に存在感を高めている。中東の衛星テレビ局アルジャジーラなどによると、ＨＴＳはアルカイダから分離した「シリア征服戦線（旧ヌスラ戦線）」を前身とする組織で、他のグループも吸収する形で今年１月に結成された。トルコや湾岸諸国の支援を受けているとされる「アフラル・シャム」と以前は連携していた時期もあったが、今年７月に衝突し、民間人１５人を含む９２人が死亡。その後、７月下旬にはＨＴＳがイドリブ県での支配を確立した。２０１１年に始まったシリアの内戦は、アサド政権側と反体制派側が今年７月、南西部などで避難民を保護する「安全地帯」設置に合意し、一部では停戦が発効している。内戦の混乱に乗じて勢力を拡大した過激派組織「イスラム国」（ＩＳ）も米軍などによる攻勢を前に弱体化した。その一方、ＨＴＳのような別の過激派が伸長し始めており、政情安定には程遠い状況が続く。ＨＴＳについては米国も、アルカイダ系であることを理由に「テロ組織」との認識を示している。もともと反体制派勢力が強かったイドリブ県では４月、猛毒の神経ガス「サリン」が使用され多数の市民が死傷する攻撃があった。米国はアサド政権軍による攻撃と断定し、出撃拠点と判断したシリア空軍基地にミサイル攻撃を実施した。"
"ＩＳ家族に「日本から来た人も」","2017年9月11日 17時43分","国際,中東,速報","【カイロ篠田航一】ＡＰ通信は１０日、イラク治安当局関係者の話として、過激派組織「イスラム国」（ＩＳ）に参加した外国人戦闘員の妻や子供ら約１３００人の中に、「遠く日本や韓国から来た人も含まれる」と伝えた。こうした家族は現在、イラク北部の避難民キャンプに収容されており、本国に送還される見通しという。イラク軍はＩＳの最大拠点だった北部モスルを７月に奪還し、８月には近郊のタルアファルも制圧した。戦闘員の家族はタルアファル陥落後、イラク北部クルド人自治区の治安部隊に投降したという。計１３３３人で出身国は１４カ国に上り、多くは中央アジアやロシア、トルコの出身と報じられている。外務省邦人テロ対策室は「在イラク日本大使館を通じ、イラク政府に事実を確認中だ」としている。"
"シリア旅券１万冊入手　偽造を警戒　独紙報道","2017年9月11日 10時55分","ドイツ,イラク,シリア,過激派組織「ＩＳ」,欧州,速報,国際,中東","【カイロ篠田航一】ドイツ大衆紙ビルト日曜版（電子版）は１０日、過激派組織「イスラム国」（ＩＳ）がシリア内戦の混乱に乗じ、シリアのパスポートの未使用台紙約１万１０００冊を入手していたと伝えた。ドイツ内務省の内部文書で判明したという。ＩＳ戦闘員が偽造旅券として使う可能性もあり、ドイツの治安当局は警戒を強めている。ＩＳは現在、拠点とするイラクやシリアで米軍などの攻撃を前に劣勢に追い込まれ、戦闘員の「拡散」が指摘されている。自国に帰還する外国人戦闘員も多く、ドイツ治安当局はこの未使用台紙に記された番号をチェックし、偽造旅券を使用する人物の有無を捜査している。ドイツの公安機関・憲法擁護庁によると、２０１６年までにドイツからは８９０人以上がイラクやシリアに渡ってＩＳなどの過激派に参加したという。イラク軍が今年７月にＩＳの最大拠点だった北部モスルを制圧した際には、民家の地下トンネルに隠れていた１６歳の少女らドイツ国籍のＩＳ参加者４人を拘束したと伝えられた。"
