"title","date","tags","article"
"エルサレム「首都」撤回決議案を否決　米が拒否権","2017年12月19日 02時56分","イスラエル,アメリカ,パレスチナ,北米,速報,国際,中東","【ニューヨーク國枝すみれ】国連安全保障理事会は１８日午後（日本時間１９日未明）、エルサレムをイスラエルの首都とするトランプ米大統領の６日の認定を無効とし撤回を求める決議案を否決した。常任理事国の米国が拒否権を行使したため。一方、米国以外の全ての理事国１４カ国が同案を支持し、この問題での米国の孤立ぶりが一層鮮明になった。安保理議長国の日本も賛成に回った。日本は北朝鮮の核・ミサイル問題で米国と連携する必要性などへの配慮から、首都認定問題の賛否をこれまでは表明していなかった。採決に先立ち、中東情勢を報告した国連のムラデノフ中東担当特使は米国の決定は過激派組織を拡大させ、イスラエルとパレスチナの紛争が拡大する「悪循環」を助長すると警告した。決議案は首都認定に反対するアラブ諸国の一つで非常任理事国のエジプトが作成した。毎日新聞が入手した決議案は、米国を名指ししてはいないが、「エルサレムの地位に関する最近の決定に深い遺憾の意を表明する」と明言した。その上で「エルサレムの性格や地位、人口構成を変更する目的でのいかなる決定や行為も、一切の法的効力がなく無効で、関連する安保理決議に基づき撤回されなければならない」と指摘。トランプ氏が首都認定と合わせて明らかにした、商都テルアビブからエルサレムへの米国大使館の移転計画に関連しても、「全ての国に対し、外交公館をエルサレムに設置することを控えるよう要請する」としている。トランプ氏の発表を受けた８日の安保理緊急会合では米国以外の１４理事国全てが異議を唱えた。東エルサレムを首都とした国家建設を目指すパレスチナ自治政府やアラブ諸国も強く反対し、各地で抗議デモが発生した。イスラエルは認定を歓迎している。"
"パレスチナ衝突４人死亡３００人負傷","2017年12月16日 10時38分","パレスチナ,アメリカ,イスラエル,北米,速報,国際,中東",""
"ＩＳ、米国をテロ攻撃すると警告","2017年12月15日 18時32分","イスラエル,アメリカ,中東,北米,速報,国際","【ニューヨーク國枝すみれ】過激派組織「イスラム国」（ＩＳ）は１４日、メッセージアプリ「テレグラム」で、トランプ米政権がエルサレムをイスラエルの首都と認定したことへの報復として、米国本土で「テロ攻撃を実行する」と警告した。ロイター通信によると、ＩＳは「お前がイラク、イエメン、リビア、シリア、アフガンで始めた戦争の炎で、お前を焼いてやる。待っていろ」とのメッセージを流した。ニューヨークでは１１日、ＩＳ信奉者がマンハッタン地区のタイムズスクエア付近で自爆テロを試みた。１０月３１日にも小型トラックで自転車専用路に突っ込むテロを起こしている。ニューヨークの日本総領事館は１４日、観光客が増える年末年始を控え、テロの標的になる可能性が高い人混みを避けるよう注意喚起した。テレグラムは情報を暗号化して交信することが可能なメッセージサービスで、テロ組織が利用することが多い。"
"中東訪問へ　大使館移転方針を説明","2017年12月15日 18時20分","イスラエル,アメリカ,エジプト,北米,速報,国際,アフリカ,中東","【ワシントン高本耕太】ペンス米副大統領は１９～２３日、エジプトとイスラエルなどを訪問する。ホワイトハウスが明らかにした。エルサレムをイスラエルの首都と認定、テルアビブの大使館を移転するトランプ政権の方針を説明したうえで、中東和平交渉に引き続き関与する姿勢を強調する。ペンス氏は２０日にエジプトのシシ大統領と会談。２１日にはイスラエルのネタニヤフ首相と会談するほか、イスラエル国会で演説する予定。２３日にドイツ経由で帰国する。パレスチナ自治政府のアッバス議長との会談も模索したが、首都認定方針に強く反発するパレスチナ側が拒否した。米上院では賛否同数となった場合、議長の副大統領が決裁票を投じる。ペンス氏は当初、１６日からの中東訪問を予定していたが、政権が推し進める税制改革法案採決に備え出発を延期していた。週明けとみられる投票がずれ込めば、訪問再延期の可能性もある。"
"深刻な食糧危機　国連、サウジに封鎖解除要請","2017年12月15日 18時14分","サウジアラビア,中東,速報,国際","【ワシントン会川晴之、カイロ篠田航一】内戦が続くイエメンが深刻な食糧危機に直面している。政府側を支援するサウジアラビアなどのアラブ諸国連合軍が、海上や空路の封鎖を強化しているためだ。国連人道問題調整事務所は「（国民の約３分の１に当たる）８５０万人が飢餓の危機にひんしている」と警鐘を鳴らし、封鎖の即時解除を求めている。「イエメンの飢餓は壊滅的だ」。今月５日、国連安全保障理事会でイエメンの現状報告を受けた後、安保理議長国・日本の別所浩郎国連大使は記者団に惨状を訴えた。空中給油や情報提供で連合軍を支援するトランプ米政権も６日、「人道援助や燃料油など生活必需品の搬入を認めよ」との声明を発表し、サウジに圧力をかけている。イエメンでは反政府勢力のイスラム教シーア派系武装組織フーシが首都サヌアを実効支配し、南部アデンを拠点とする政府側と戦闘を続けている。フーシはイランの支援を受けているとされ、イランと長年対立するサウジやアラブ首長国連邦（ＵＡＥ）などは２０１５年３月、サヌアなどへの空爆を開始。イランとサウジの代理戦争の様相を呈している。フーシ側も弾道ミサイルで反撃しており、１１月４日には約１０００キロ離れたサウジの首都リヤド近郊の国際空港付近にも撃ち込んだ。フーシは今月、サウジとの和平を模索したイエメンのサレハ前大統領を殺害するなど強硬姿勢を強めている。イエメンは旧ソ連や北朝鮮から射程約５００キロのスカッドミサイルをかつて調達していたが、今年２月以降は飛躍的に飛距離が伸びた。改造したり、新たなミサイルを国外から調達したりした可能性が高く、米国防総省は毎日新聞の取材に「イランが関与している」と回答した。ミサイルの追加搬入を恐れるサウジは、参戦時から主要港や空港で実施していた封鎖を拡大していった。イエメンは食糧の９割を輸入に頼るだけに影響は大きく、国連によるとこの１カ月で飢餓状態にある国民が１５０万人増えた。医療品不足も深刻で、人口約２７００万人のうち、２０００万人以上が食糧・医療など緊急の人道支援を必要としている。深い井戸から水をくみ上げるポンプに使う燃料油の輸入も止まった。清潔な水を確保できず、衛生状態の悪化から伝染病が流行し、今年４月以降、１００万人近くがコレラに罹患（りかん）し、２２００人以上が死亡している。ＮＧＯなどの援助団体はコレラ流行地域への立ち入りを試みているが、紛争当事者が妨害する場合も多いとされる。"
"「イラン武器、イエメンに」ミサイル残骸公開","2017年12月15日 10時52分","アメリカ,イラン,中東,北米,速報,国際","【ワシントン会川晴之】ヘイリー米国連大使は１４日、ワシントンで記者会見し、内戦が続くイエメンからサウジアラビアに撃ち込まれたミサイルの残骸を公開した。形状やイランの部品が使われていることを理由に「イラン製のミサイル」とした上で、イランが国連安全保障理事会決議に違反し、武器を輸出している証拠と主張。国際社会が団結してイラン包囲網を早急に築く必要があると訴えた。サウジ主導の連合軍は、イエメン反政府派のイスラム武装組織フーシが実効支配する首都サヌアなどへの空爆を継続。一方、イランの支援を受けるフーシは先月４日、リヤドの空港に弾道ミサイルを撃ち込んだ。ヘイリー氏は「（ワシントン郊外の）ダレスや（ニューヨークの）ＪＦＫ空港などを標的にしたのと同じ」と非難した。これに対して、イランの国連代表部は声明で「作り話であり、無責任かつ挑発的だ」と強く反発した。イエメン国内には旧ソ連や北朝鮮から調達した最大射程約５００キロのスカッドミサイル約３００発があるとされるが、このミサイルでは約１０００キロ離れたリヤドへの攻撃は不可能。米シンクタンクの湾岸情勢調査会のアリ・アルアーメド所長は毎日新聞の取材に「イランの技術指導を受け、イエメン国内でミサイルが改造され、飛距離を伸ばしたと分析している」と語った。安保理決議はイランに対し武器、ミサイルや関連部品の輸出や技術供与を禁じている。トランプ政権は今年１０月、イランが「核合意を順守していない」と表明し、理由として中東地域を不安定化させる活動をしていることを挙げた。ヘイリー氏の会見はこうした点を強調する狙いがあるとみられる。"
"パレスチナ人９１％「脅威」世論調査","2017年12月13日 18時47分","アメリカ,イスラエル,パレスチナ,ヨルダン,速報,国際,中東,北米","【ラマラ（パレスチナ自治区ヨルダン川西岸）賀有勇】エルサレムをイスラエルの首都とする米国の認定をパレスチナ人の９１％が「脅威」と見なしていることが、１２日発表の世論調査結果で明らかになった。パレスチナ国家樹立のため「暴力的抵抗が唯一の方法」との回答も、３５％だった前回調査から９ポイント増加し４４％になった。調査はシンクタンク・パレスチナ政策調査研究センターが実施。６日の認定発表後、パレスチナ自治区のヨルダン川西岸地区とガザ地区に住む１２７０人に受け止めを聞いた。調査によると、「アラブ諸国にとりパレスチナ問題は最優先課題ではなくなった」との回答も７６％に上った。同センターのハリル・シカキ代表は「交渉による中東和平の実現に対する諦めムードの広がりを示す危険な兆候」と分析。交渉の見通しについては「米国が主導することは変わらないが、パレスチナ側にも『うまみ』を与えなければ進展は望めない」と述べた。"
"パレスチナとエジプト拒絶","2017年12月12日 13時19分","アメリカ,エジプト,パレスチナ,北米,速報,国際,アフリカ,中東","【エルサレム高橋宗男】パレスチナ自治政府のアッバス議長は１１日、カイロでエジプトのシシ大統領と会談し、エルサレムをイスラエルの首都と認定した米国の決定への対応を協議した。エジプト大統領府が出した声明によると、両者は高いレベルで協調し続けるとともに、パレスチナ人の権利を守るために米国の決定を拒絶する姿勢を示していくことで一致した。またレバノンのイスラム教シーア派武装組織ヒズボラの指導者ナスララ師は１１日、ベイルート郊外での大規模抗議デモで「ヒズボラを含む抵抗の枢軸はきょう、最も重要な優先事項に立ち戻る」とビデオ演説した。"
"次は映画館解禁へ　経済・社会改革の一環","2017年12月12日 10時52分","国際,中東,速報","【カイロ篠田航一】イスラム教の厳格な習慣・戒律を重視する体制下、娯楽が制限されているサウジアラビアで、来年３月にも映画館の運営が解禁される見通しとなった。ロイター通信などが１１日報じた。サルマン国王（８１）の実子で「次期国王」と目されるムハンマド皇太子（３２）が主導する経済・社会改革の一環で、設置されれば約３５年ぶりという。サウジ文化情報省は「映画解禁は経済成長を促す」と強調した。上映内容については、イスラム的価値観からの逸脱の有無を事前検閲される見通し。サウジでは男女が同じ空間で長く過ごすことを保守的な宗教界が問題視したことから上映が禁じられた。娯楽を求める国民は頻繁にアラブ首長国連邦（ＵＡＥ）など近隣国に出かけ、巨額の消費が国外に落ちているのが実情だ。サウジは人口３２００万人のうち約６割が３０歳未満という「若い国」で、潜在的な娯楽市場は大きい。サウジは今年に入り、従来は男性のみに認められていた自動車の運転を来年６月ごろに女性にも解禁すると発表した。さらに運動競技場への女性の入場も来年から認めるなど、規制緩和を進めている。"
"「一匹オオカミ型」警戒　首都認定抗議か","2017年12月12日 01時48分","アメリカ,イスラエル,パレスチナ,ヨルダン,速報,国際,中東,北米","【エルサレム高橋宗男】エルサレムの中央バスステーションで１０日、パレスチナ人の男がイスラエル人男性警備員の胸をナイフで刺して逃走した。男性は重体。エルサレムをイスラエルの首都と認定した米国の決定後、刺傷事件は初めて。イスラエル当局は同様のローンウルフ（一匹オオカミ）型の攻撃を警戒している。通行人と警官が男を追いかけ、取り押さえた。イスラエルのハーレツ紙によると、男はヨルダン川西岸ナブルスに住む２４歳のパレスチナ人。事件前に「アラーの神と（エルサレム旧市街の聖地にあるモスク）アルアクサの名誉のために我々は血を流す」とフェイスブックに投稿しており、米国の決定に触発されて事件を起こした可能性が高い。米国の決定への抗議デモは西岸やガザ地区の各地で１０日も続いた。パレスチナ保健省はデモ隊とイスラエル軍との衝突で９日までに１２５０人以上が負傷し、このうち１５０人が実弾によって負傷したと明らかにした。赤新月社は１０日の抗議行動で約６０人が負傷したとしている。イスラエル軍は１０日、ガザ地区南部のハンユニスからイスラエル領内に掘られた完成前のトンネルを破壊した。軍報道官によると、トンネルはイスラム原理主義組織ハマスが建設していたもので、イスラエル領内に約１キロ延びていた。"
"両首脳が批判合戦","2017年12月11日 21時53分","アメリカ,イスラエル,イラン,トルコ,パレスチナ,国際,中東,北米,速報","【エルサレム高橋宗男】エルサレムをイスラエルの首都と認定した米国の決定を巡り、トルコのエルドアン大統領とイスラエルのネタニヤフ首相が１０日、舌戦を展開した。エルドアン氏がイスラエルを「テロ国家」と表現し、アラブ諸国の指導者に統一の立場を取るよう求めたのに対し、ネタニヤフ氏は「エルドアン氏は我々に講義をするような人物ではない」と反発した。トルコのヒュリエト・デーリー・ニューズ紙によると、エルドアン氏は１０日、トルコ中部シバス県で開かれた会合で演説し「イスラエルは占領国家であり、テロ国家だ」と強調。「パレスチナは虐げられた犠牲者。イスラエルは占領に関する決定、特に国際連合の決定を決して認めてこなかったし、これからも認めないだろう」とイスラエルを非難した。これに対し、ネタニヤフ氏は１０日、パリで開かれたマクロン仏大統領との共同記者会見で「国内のクルド人を攻撃し、ジャーナリストを投獄し、イランの制裁逃れを助け、ガザを含むテロリストを支援する指導者から倫理観について講義を受けることには慣れていない」と反論した。トルコの大統領報道官はネタニヤフ氏の発言に即座に反応し、「我が国と我々の指導者を非難する代わりに、イスラエルはパレスチナの占領をやめるべきだ」と強調した。"
"シリアの露軍訪問、撤退命令　作戦終了を宣言","2017年12月11日 21時49分","ロシア,シリア,中東,欧州,速報,国際","【モスクワ杉尾直哉】ロシアのプーチン大統領は１１日、ロシア軍が駐留するシリア西部のヘメイミーム空軍基地を予告なしに訪問した。軍部隊を前にした演説で、シリア空爆作戦の終了を宣言し、軍の撤退を命令した。ロシアが２０１５年９月末に開始したシリア空爆は「終了」という大きな節目を迎えた。ＡＰ通信によると、プーチン氏のシリア訪問は初めて。露国営テレビによると、プーチン氏は露政府専用機でヘメイミーム空軍基地に到着。タラップの下で待つアサド大統領に抱擁で迎えられた。演説でプーチン氏は同基地を拠点に２年余り続いたロシア部隊の派遣について「シリア軍と共に国際テロ組織を粉砕することができた。シリア国家の主権と独立を守ることができた」と意義を強調。「国連の下でシリアの正常化へ向かう条件が整えられた」などとシリア派遣部隊の撤退理由を語った。一方で、ソ連時代から露海軍が補給拠点として使用してきたシリア西部のタルトスに加え、今回のシリア空爆をきっかけに露軍が進出したヘメイミーム空軍基地を今後も「ロシア軍の常駐基地」として使用を継続する考えを示した。シリアを拠点に軍事的に中東全体ににらみをきかせる狙いとみられる。また、「テロリストが再度、浮上すれば、これまでにない規模の空爆を行う」とも述べ、今後も空爆作戦を実施する余地を残した。プーチン氏は１１月２０日に露南部ソチでアサド大統領と会談し、シリアでの軍事作戦を近く終了させる見通しを示していた。プーチン氏はアサド氏といつでも会談できる立場を利用し、今後のシリア正常化にも影響力を発揮する考えだ。プーチン氏は今月６日、「シリアでの軍事作戦は、テロリスト壊滅という完全勝利で終了した」と述べていた。現地の空軍基地を自ら電撃訪問し、改めて勝利を宣言することで、軍事作戦終了の歴史的な意義を内外に演出した。"
"エルサレム問題、議論は平行線","2017年12月11日 10時26分","イスラエル,フランス,パレスチナ,欧州,速報,国際,中東","【エルサレム賀有勇】フランスのマクロン大統領は１０日、パリのエリゼ宮（大統領府）でイスラエルのネタニヤフ首相と会談し、トランプ米大統領がイスラエルの首都と認定したエルサレムの問題を巡り話し合ったが、議論は平行線をたどった。会談後に開かれた記者会見でマクロン氏は、トランプ氏の首都認定宣言が「和平の動きを危険にさらす」と述べ、宣言を受け入れない姿勢を改めて示した。イスラエルに対しては、ユダヤ人入植地の建設凍結を求め、パレスチナとの対話による解決を促した。一方、トランプ氏の宣言を「歴史的」と評価してきたネタニヤフ氏は、エルサレムについて「常に我々（イスラエル）の首都であり続けてきた」と述べた上で、「パレスチナがより早く現実を受け止めることで、和平の実現に向けて前進できる」と譲らなかった。フランスは今年１月、パリで中東和平を巡る国際会議を開催。大統領就任を目前に控えていたトランプ氏を念頭に、イスラエルとパレスチナ双方が「首都」と主張するエルサレムに関して「一方的行動は控えるべきだ」とする共同宣言を採択し、米国やイスラエルをけん制していた。"
"アラブ連盟が撤回要求決議","2017年12月11日 10時21分","イスラエル,パレスチナ,中東,速報,国際","【カイロ篠田航一】アラブ連盟（２１カ国と１機構）は９日夜、エジプトの首都カイロで緊急の外相級会合を開催し、トランプ米政権がエルサレムをイスラエルの首都と認めた決定について「中東和平への努力を台無しにする危険な動き」と非難し、認定の撤回を求める決議を採択した。１０日未明にまでわたった議論では、レバノンのバシル外相が「米国に経済制裁を科すべきだ」と述べるなど一部加盟国から米国への具体的な報復措置を求める声も上がったが、決議文には盛り込まず、非難声明にとどめた。背景には、中東で影響力を拡大するイランの封じ込めやテロ組織掃討作戦などで、アラブ諸国が米国と連携を深めている現実がある。決議では米国を「和平の仲介者としての立場を放棄した」と非難する一方、具体的な対抗措置には踏み込まず、米国との対立を避けたい思惑も浮かび上がった。連盟は、首都認定について「法的拘束力がない」と強調。国連安全保障理事会に対し、トランプ政権の決定を国際法違反として非難する決議の採択も求めた。１１日にはロシアのプーチン大統領、パレスチナ自治政府のアッバス議長がカイロを訪問し、エジプトのシシ大統領と対応を協議する予定。１３日にはイランやトルコなど非アラブ圏のイスラム諸国も含むイスラム協力機構（ＯＩＣ）の緊急会合がトルコで開かれる。"
"イスラエル人刺され重体　首都認定後初の刺傷","2017年12月11日 10時06分","イスラエル,パレスチナ,中東,速報,国際","【エルサレム高橋宗男】エルサレムの中央バスステーションで１０日、パレスチナ人の男がイスラエル人男性警備員の胸をナイフで刺して逃走した。男は通行人らに取り押さえられた。男性警備員は重体。エルサレムをイスラエルの首都と認定した米国の決定後、刺傷事件は初めて。イスラエルのハーレツ紙によると、男はパレスチナ自治区ヨルダン川西岸に住む２４歳のパレスチナ人。事件前に「アラーの神と（エルサレム旧市街の聖地にあるモスク）アルアクサの名誉のために我々は血を流す」とフェイスブックに投稿していた。米国の決定後、イスラエル治安当局はナイフを使うローンウルフ（一匹オオカミ）型の攻撃を警戒していた。米国の決定を巡り、ヨルダン川西岸やパレスチナ自治区ガザ地区各地では１０日も抗議デモが続いた。パレスチナ保健省は、デモ隊とイスラエル軍との衝突で９日までに１２５０人以上が負傷したと明らかにした。このうち１５０人が実弾による負傷という。抗議行動は周辺アラブ諸国や北アフリカ、アジアなどのイスラム世界に広がっている。レバノンの首都ベイルートでは１０日、米国大使館近くでデモがあり、治安部隊が放水や催涙弾で鎮圧を図った。モロッコの首都ラバトでは数万人がデモ行進し、インドネシア・ジャカルタの米大使館前でも数千人が抗議の声を上げた。一方、イスラエル軍は１０日、ガザ地区南部のハンユニスからイスラエル領内に掘られた完成前のトンネルを破壊した。軍報道官によると、トンネルはガザ地区を実効支配してきたイスラム原理主義組織ハマスが建設していたもので、イスラエル領内に約１キロ延びていた。これまでのトンネルより頑丈で換気装置も備えていたという。"
