"title","date","tags","article"
"イスラエル首相と会談　イラン核合意で","2017年11月3日 21時23分","イスラエル,イギリス,イラン,欧州,速報,国際,中東","【ロンドン矢野純一、エルサレム高橋宗男】英国のメイ首相は２日、英首相官邸でイスラエルのネタニヤフ首相と会談した。トランプ米政権が「認めない」とするイラン核合意について、メイ氏は地域の安全保障にとって必要だとする考えを示した。ネタニヤフ氏は「イランは中東を支配しようとするばかりでなく、核兵器開発を決意している」と強調し、米国同様「合意の不備を修正しなければならない」と訴えた。一方、シリアやレバノンで活動するイスラム教シーア派武装組織ヒズボラへの支援など、イランが地域を不安定化させる活動に対抗するため両国が協力することでは合意。また、メイ氏はパレスチナ国家を樹立してイスラエルとの共存を目指す「２国家共存」への支持を改めて表明した。首脳会談はイスラエル建国につながった「バルフォア宣言」から１００年の節目を記念したもの。第一次世界大戦中の１９１７年１１月２日、バルフォア英外相がロスチャイルド英国シオニスト連盟会長に送った書簡の中で、ユダヤ人の民族的郷土をパレスチナにつくることを支持し、４８年の建国につながった。ネタニヤフ氏は「ユダヤ人の国家建設に道を開いた」と宣言をたたえ、メイ氏は「英国が果たした役割は誇りだ」と述べた。"
"核合意の維持で一致","2017年11月2日 21時13分","ロシア,アゼルバイジャン,イラン,欧州,速報,国際,中東","【モスクワ杉尾直哉】ロシアのプーチン大統領とアゼルバイジャンのアリエフ大統領は１日、訪問先のイランの首都テヘランでロウハニ大統領と会談した。タス通信などによるとイラン核合意の維持やシリア紛争終結へ向けた協力で一致した。イランが核開発を大幅に制限するかわりに米欧などが経済制裁を解除する２０１５年の核合意はトランプ米大統領が激しく批判し、ロシアや欧州連合（ＥＵ）が反発している。ロシアとイランは、欧米と関係が良い旧ソ連構成国アゼルバイジャンと連携し対米圧力を強めるねらいがある。ロシアは核合意の維持を前提に、イラン南部のブシェール原発の第２、３号機建設を進めている。３大統領は来年、モスクワで会談することを決めた。プーチン氏は、イランの最高指導者ハメネイ師とも別途、会談した。イランからの報道によると、ハメネイ師は米国がロシアとイランに科す制裁に対抗するため「米ドル決済の拒否」を提案した。"
"ハマスが境界検問所の管理を自治政府に移譲","2017年11月1日 20時36分","イスラエル,エジプト,ヨルダン,中東,速報,国際,アフリカ","【ラファ（パレスチナ自治区ガザ地区）高橋宗男】２００７年からパレスチナ自治区ガザ地区を実効支配してきたイスラム原理主義組織ハマスは１日、境界検問所の管理をパレスチナ自治政府に移譲した。パレスチナ自治区はヨルダン川西岸とガザ地区に分断されてきたが、１０月１２日に両者が和解合意を発表。１２月１日までの行政権限の完全移譲を目指している。検問所の管理が自治政府に移譲されたことを受け、エジプトとの境界にあるラファ検問所を今月１５日までに正常化するようエジプト当局と調整する。ハマスがガザ地区を制圧した０７年以降、エジプト政府は経済的な圧力をかけるためラファ検問所を一定期間を除いて封鎖してきた経緯がある。このためガザ地区住民は検問所の正常化による経済状況の改善を期待している。また、ガザ地区北部のエレツ検問所では、自治政府側に管理を一元化し、ハマスの警察部門による書類検査を廃止。南東部の商用に特化された検問所ではハマスが設立した関税業務に関する委員会を解体する。イスラエル軍は１０月３０日にガザ地区南部ハンユニスからイスラエル領内に延びる地下トンネルを爆破し、イスラム過激派「イスラム聖戦」やハマスの戦闘員少なくとも７人が死亡した。イスラエル側が報復攻撃への警戒を強める一方、ハマスの最高指導者ハニヤ氏は「この殺りくに対する返答は（ハマスと自治政府の）和解合意を履行していくことだ」と述べている。"
"イスラエル軍がトンネル爆破、ハマス７人死亡","2017年11月1日 11時17分","イスラエル,中東,速報,国際","【パレスチナ自治区ガザ地区・高橋宗男】イスラエル軍は１０月３０日、ガザ地区からイスラエル領内に伸びる地下トンネルを爆破した。現地での報道によると、イスラム過激派組織「イスラム聖戦」やイスラム原理主義組織「ハマス」の戦闘員ら少なくとも７人が死亡、１０人以上が負傷した。現地メディアは、爆破されたのはイスラム聖戦が掘削していたトンネルで、救助に向かったハマス戦闘員が崩落やけむりに巻き込まれたと伝えている。２００７年からガザ地区を実効支配してきたハマスは１０月中旬に、ヨルダン川西岸を統治するパレスチナ自治政府との和解合意を発表し、ガザ地区の権限移譲を進めている。イスラエル軍は今回のトンネル掘削について「ガザからの敵対行為はすべてハマスに責任がある」と非難した。"
"カブールで爆発、複数死亡か　ＩＳが犯行声明","2017年10月31日 22時17分","アフガニスタン,中東,速報,国際","アフガニスタンの首都カブール中心部で３１日、大規模な爆発があり、医療当局者によると３人が死亡し、１０人が負傷して搬送された。ロイター通信は８人の死亡を確認したと報じた。地元警察の報道担当者は、徒歩による自爆テロとみられるが、事前に仕掛けられた爆弾の可能性もあるとみて調べていると発表した。現場は外国の大使館や国防省施設など政府機関が集まる地域。過激派組織「イスラム国」（ＩＳ）が、影響下にあるニュースサイト「アーマク通信」を通じて犯行声明を出した。【武内彩】"
"捕虜交換など協議　ロシア主導で","2017年10月31日 19時54分","イラン,アメリカ,ロシア,トルコ,シリア,カザフスタン,中東,欧州,すべて表示する","【モスクワ杉尾直哉】ロシアが主導するシリア和平協議が３０、３１の両日、カザフスタンの首都アスタナで開かれた。今年１月に始まった協議は今回で７回目。タス通信によると、今回の協議では、捕虜の交換や死者の遺体の引き渡し、行方不明者の捜索などがテーマとなった。ロシアは、過激派組織「イスラム国」（ＩＳ）壊滅後を視野に入れ、正常化への道筋をつけようとしている。アスタナ協議は、アサド政権の後ろ盾となってきたロシアとイラン、反体制派を支援するトルコの３カ国が主導してきた。インタファクス通信によると、今回協議では、米露代表協議も行われた。シリアではＩＳが「首都」と称してきた北部ラッカが１０月２０日、米軍主導の有志国連合の支援を受けたクルド人主体の民兵組織「シリア民主軍」（ＳＤＦ）によって解放されたが、ＩＳ残党が逃げ込んだシリア東部などではアサド政権側と、米国の支援を受けた反体制派の間で衝突が起こる可能性もあり、ロシアは米側との協力を求めていた。"
"議長が辞意表明　住民投票後の混乱で引責","2017年10月30日 10時25分","イラク,中東,速報,国際","【カイロ篠田航一】イラク北部クルド自治政府トップのマスード・バルザニ議長は２９日、自治区の議会に対し、１１月１日に議長を退任する意向を表明し、議会は賛成多数で承認した。クルドのメディアが伝えた。バルザニ氏が主導したイラクからの独立の是非を問う住民投票後の混乱を受け、責任を取る形での辞任となる。住民投票後、独立に向けた国際的な支持は得られず、逆に自治政府が実効支配していた油田都市キルクークを中央政府に奪還されるなど支配地域を次々に失う事態に陥った。今月に入り、混乱を招いたバルザニ氏の責任を問う声が高まり、野党は辞任を求めていた。バルザニ氏は辞意表明後のテレビ演説で中央政府の攻勢について「計画されていたもので住民投票を口実にした」などと批判した。自治区では今年、１１月１日に議長選と議会選が予定されていたが議会は８カ月間の延期を決め、バルザニ氏は選挙実施まで続投するとみられていた。バルザニ氏は２００５年に議長に選出され、０９年に再選された。任期は４年だが、１３年以降は選挙は行われず、近年は過激派組織「イスラム国」（ＩＳ）との戦闘の指揮を理由に議長職にとどまっていた。"
"住民投票凍結のクルド提案拒否　無効化を要求","2017年10月28日 11時01分","国際,中東,速報","【カイロ篠田航一】イラク北部クルド自治政府が独立の是非を問う住民投票の結果を「凍結」する代わりに、イラク中央政府に対話を呼びかけたことについて、中央政府のアバディ首相は２６日、「投票の無効化しか受け入れない」との声明を出し、自治政府の提案を拒否した。一方、北部のクルド自治政府の治安部隊ペシュメルガに対する軍事作戦については２７日、２４時間停止することを命じた。独立問題では妥協しない姿勢を示しつつ、武力衝突を回避する狙いとみられる。住民投票の「無効」を求める首相声明は、クルド独立に関する住民投票の規定がないことを理由に「投票自体が違憲」として認めない従来の主張を繰り返した格好で、クルド側に妥協しない姿勢を強調した。今回の一時停戦は過激派組織「イスラム国」（ＩＳ）掃討作戦を進めている有志国連合の仲介で実現した。アバディ首相は「すべての係争地に中央政府軍部隊を配置するための時間」と説明している。一方、クルド系メディア「ルダウ」によると、サウジアラビア外務省は２７日、自治政府の住民投票結果を凍結した提案を歓迎し、「双方による対話を支持する」との声明を出した。サウジは最近、イラクの旧フセイン政権時代から続いた敵対関係を解消し、徐々にイラク中央政府に接近する一方、クルド自治政府とも良好な関係を保っている。イラク中央政府は、９月の投票強行後に報復として自治区内の国際線発着停止などの経済制裁を発動。また、クルド側の実効支配地域にイラク軍を派遣し、係争地の油田地帯キルクークを制圧するなど軍事的にも強硬な措置に出ていた。これに対し自治政府は２５日には投票結果の「凍結」を表明し、中央政府に軍事作戦の中止を要請。対話を始めるよう提案していた。"
"アサド政権がサリン使用　安保理調査団が報告","2017年10月27日 11時37分","アメリカ,中東,北米,速報,国際","【ニューヨーク國枝すみれ】シリア北西部イドリブ県で今年４月に起きた化学兵器使用疑惑で、国連安全保障理事会が設置した国連と化学兵器禁止機関（ＯＰＣＷ）による共同調査メカニズム（ＪＩＭ）は２６日、シリアのアサド政権が猛毒の神経ガス、サリンを使用したとする報告書を安保理に提出した。４月の使用疑惑では、約９０人が死亡したとされ、現場からサリンが検出された。米国は直後にアサド政権による攻撃と断定し、サリン攻撃を実行したシリア軍機が出撃したとされるシリア西部の空軍基地に向け、巡航ミサイル「トマホーク」で攻撃した。これに対し、アサド政権や、後ろ盾のロシアはサリンの使用を否定し、「国連憲章違反の侵略行為」と反発を強めていた。報告書は、収集した情報などの大半は欧米が主張している「サリンは空爆による」との説を裏付けていると指摘した。また報告書は、２０１６年９月１５、１６両日にシリア北部アレッポ県でマスタードガスが使用された攻撃は過激派組織「イスラム国」（ＩＳ）によるものとした。ＪＩＭは、化学兵器を使用したり攻撃を支援したりした個人や組織、政府機関を特定し、９０日以内に報告する。昨年はシリア政府が３件、ＩＳが１件の化学兵器攻撃を実行したと結論づけていた。ヘイリー米国連大使は、報告書を受けた声明で「報告書は、我々が長い間知っていたことを確認した」とする声明を発表した。"
"クルド主要境界を再開　投票結果「凍結」で軟化か","2017年10月26日 11時20分","イラク,中東,速報,国際","【カイロ篠田航一】イラク北部クルド自治政府が９月に実施したイラクからの独立の是非を問う住民投票に反発し、自治区との境界を閉鎖していた隣国イランは２５日、主要境界を再開した。イランのメディアが伝えた。自治政府が住民投票結果の「凍結」を２５日に提案し、イラク中央政府に対話を呼びかけたことを受け、中央政府に同調してきたイラン側が態度を軟化させた可能性がある。再開されたのは自治区東部スレイマニヤ県とイランの境界にある検問所。住民投票が強行された後に閉鎖されたが、クルド自治区は生活物資の多くをイランから輸入しており、住民からは再開を求める声が高まっていた。イラク中央政府は今月１６日以降、クルド側と管轄権を争う係争地の油田地帯キルクークにイラク軍を派遣して全域を制圧。その後もクルド側の実効支配下にあった地域を奪還した。自治政府は事実上の軍事的敗北に追い込まれ、住民投票結果の「凍結」を打ち出すなど、大幅な譲歩を迫られている。イラク同様に国内に多くのクルド人を抱えるイランは、独立を目指す動きが自国に波及する事態を懸念し、投票に反対していた。"
"インド外相と会談　アフガン戦争支援に感謝","2017年10月25日 20時16分","アメリカ,アフガニスタン,インド,パキスタン,速報,国際,中東,北米,すべて表示する","【ニューデリー金子淳】ティラーソン米国務長官は２５日、インドの首都ニューデリーでスワラジ外相と会談し、インドによるアフガニスタン戦争への支援に感謝を表明した。これに先立ち２４日に行われたパキスタンのアバシ首相との会談では、トランプ米大統領が８月に発表したアフガニスタン戦争への米軍増派を含む「新戦略」を説明し、パキスタンに潜伏する武装組織の掃討作戦を強めるよう求めた。印パへの対照的な対応は、トランプ政権のインド重視の姿勢を印象づけた。米国がインドを重視するのは、南アジアなどで存在感を増す中国が背景にある。長官は外遊前の１８日、ワシントンでの講演で、中国が南シナ海で「挑発的な行動」を取っていると指摘し、インドとの防衛協力を「劇的に深める」と語った。インドも今年、中国軍と２カ月にわたりにらみ合う国境摩擦を経験し、中国への警戒感を一気に高めている。米印は今後も海洋安全保障やアフガン戦争などで協力を深める方針だ。２５日の米印外相会談後の共同記者会見で長官は「米国はインドの指導力を支持する。インド太平洋地域で幅広い協力を期待する」と表明。来年初めにも外務・国防担当閣僚による２プラス２対話を開くと明らかにした。"
"住民投票結果「凍結」　イラクに対話呼びかけ","2017年10月25日 18時14分","イラク,中東,速報,国際","【カイロ篠田航一】イラク北部のクルド自治政府は、イラクからの独立賛成が９割を占めた９月の住民投票結果について「凍結」すると声明を出した。クルドのメディアが２５日伝えた。住民投票強行に反発するイラク中央政府との緊張激化を受け、クルド側が譲歩した格好で、中央政府に対話を呼びかけている。投票実施後、中央政府は報復として自治区内の国際線発着停止などの経済制裁を発動。今月にはイラク軍を展開させ、自治政府が実効支配していた油田都市キルクークを掌握するなど軍事的にも強硬な措置に出ていた。自治区との境界では小規模な衝突も発生した。声明で自治政府は、「戦争になればどちらも勝者になれない」と強調。中央政府に対し、全ての自治区内での軍事行動を中止したうえで自治政府と対話を始めるよう要請した。これに先立ちティラーソン米国務長官は２２、２３日にサウジアラビアとイラクを訪問した際、イラクのアバディ首相に「協議を始めてほしい」と伝え、衝突を回避するよう強く求めた。ティラーソン氏はまた、イランの強い影響下にあり、過激派組織「イスラム国」（ＩＳ）の拠点奪還に貢献したイスラム教シーア派主体の民兵組織のイラクでの活動を念頭に、「ＩＳとの戦闘がほぼ終局を迎えた今、イランの民兵はイラクを去るべきだ」と表明。イラク国内でのイランの影響力増大に懸念を示した。これに対しアバディ首相は「対ＩＳ戦では多大な犠牲を払った」としてシーア派民兵の重要性を強調。今後もイラク国内に必要との見解を示した。"
"タリバンとの和平協議　アフガン訪問","2017年10月24日 11時43分","アメリカ,アフガニスタン,中東,北米,速報,国際","【ニューデリー金子淳】ティラーソン米国務長官は２３日、予告なしにアフガニスタンの首都カブール郊外のバグラム空軍基地を訪れ、ガニ大統領と会談した。アフガンの治安情勢や旧支配勢力タリバンとの和平に向けた方策などを協議したとみられる。ティラーソン氏のアフガン訪問は初めて。ティラーソン氏は記者会見で「タリバンが軍事的勝利は不可能だと理解するまで、我々は戦い続ける」と強調。その上で、まずはタリバン内部の穏健派との和平交渉実現を目指す考えを示した。ただ、タリバンは駐留外国軍の撤退を条件に掲げており、交渉再開の糸口は見えていないのが現状だ。アフガンでは先週、カブールなどでテロや襲撃が相次ぎ２００人以上が死亡するなど、治安悪化が深刻化している。マティス米国防長官が９月にカブールを訪問した際もタリバンが空港にロケット弾を撃ち込み、「マティス氏の航空機を狙った」と犯行声明を出した。"
"またテロ　軍学校周辺、士官候補生１５人死亡","2017年10月21日 21時08分","アフガニスタン,中東,速報,国際","【ニューデリー金子淳】ＡＦＰ通信によると、アフガニスタンの首都カブールの軍学校周辺で２１日、自爆テロが発生し、士官候補生１５人が死亡した。アフガンでは前日にもカブールと中西部ゴール州のモスク（イスラム教礼拝堂）で相次いで爆発が起こり、合計８９人が殺害されたばかり。アフガン軍の報道担当者はＡＦＰ通信に対し、士官候補生を乗せたバスが２１日午後に軍学校を出ようとした際、自爆犯が爆発を起こし、死者１５人と負傷者４人を出したという。２０日夜にカブールのイスラム教少数派シーア派のモスクで起きた爆発では、死者が５６人に上り、後に過激派組織「イスラム国」（ＩＳ）が犯行声明を出した。３３人が死亡したゴール州の爆発では、地元指導者が狙われたとみられる。"
"モスクの自爆テロ　ＩＳが犯行声明","2017年10月21日 10時46分","アフガニスタン,中東,速報,国際","【ニューデリー金子淳】アフガニスタンの首都カブールと中西部ゴール州のモスク（イスラム教礼拝堂）で２０日相次いで発生した自爆テロとみられる爆発で、アフガン内務省などによると、２件の爆発の死者数は少なくとも計７２人に達した。ロイター通信によると、過激派組織「イスラム国」（ＩＳ）が２１日、カブールの爆発について犯行声明を出した。カブールではイスラム教少数派シーア派のモスクが標的となり、少なくとも３９人が死亡、４５人が負傷した。一方、ゴール州ではスンニ派モスク付近で爆発があり、３３人が死亡した。モスクを訪れていた地元政治指導者が狙われたとみられる。ゴール州の爆発では犯行声明が出ていない。２件の爆発を受け、ガニ大統領は２０日、「アフガン人を狙うテロリストは撲滅する」と事件を非難する声明を出した。アフガンでは１７～１９日、旧支配勢力タリバンが警察施設などを襲撃し約１２０人が死亡したばかりで、治安悪化が深刻化している。"
"トルコへの支援金削減　欧州委に検討求める","2017年10月21日 10時33分","トルコ,中東,速報,国際","【ブリュッセル八田浩輔】欧州連合（ＥＵ）は２０日に閉幕した首脳会議で、加盟候補国としてトルコに拠出する支援金について、削減を含めた検討を進めるよう欧州委員会に求めた。トゥスク欧州理事会常任議長（ＥＵ大統領）が会議後の記者会見で明らかにした。昨夏のクーデター未遂から悪化するトルコ欧州間の関係は改善の見通しがたたない。ＥＵは加盟候補国に財政支援を行い、トルコには２０１４～２０年に４４億ユーロ（約５８５０億円）の拠出を約束している。メルケル独首相は１９日夜、ドイツ人記者の拘束など強権化を進めるエルドアン政権の人権状況を「容認できない」と述べ、支援金を削減すべきだとの考えを示した。メルケル氏は独総選挙前の９月上旬、今回の首脳会議でトルコのＥＵ加盟交渉の「打ち切りを含めて」加盟国と協議する意向を示していたが、交渉中止は多くの加盟国が支持していないとして矛をおさめた。０５年に始まったトルコのＥＵ加盟交渉は事実上凍結されているが、シリア難民の水際対策でトルコに依存するＥＵは交渉を一方的に打ち切ることができないのが実情だ。"
