"title","date","tags","article"
"日本海側の降雪続く　１４日も東北など警戒を","2018年2月13日 18時26分","社会,気象・地震,速報","強い寒気と冬型の気圧配置の影響で、日本海側を中心に１３日も雪が続き、鉄道の運休が相次ぐなど交通に影響が出た。大雪はピークを過ぎたが、１４日は低気圧の影響で東北を中心に雪や雨になる見込みで、気象庁が注意を呼び掛けている。気象庁によると、１３日夕までの２４時間で、新潟県や福井県では４０～６０センチの雪が降った。大雪が続いた東北から中国の日本海側で平年の３～１０倍の積雪となり、北海道幌加内町の幌加内で２７９センチ、山形県大蔵村の肘折で４３８センチ、福井県越前市の武生で１３０センチなど、５カ所の観測点で観測史上最大を記録した。（共同）"
"長野南部で震度３　津波の心配なし","2018年2月13日 16時31分","社会,気象・地震,速報","１３日午後４時１７分ごろ、長野県南部で震度３の地震があった。気象庁によると、震源地は長野県南部で、震源の深さはごく浅く、地震の規模を示すマグニチュード（Ｍ）は３．３と推定される。この地震による津波の心配はないという。各地の主な震度は次の通り。震度３＝木曽町"
"長野で震度４　津波の心配なし","2018年2月13日 14時47分","社会,気象・地震,速報","１３日午後２時３９分ごろ、長野県南部で震度４を観測する地震があった。気象庁によると、震源地は長野県南部で、震源の深さはごく浅く、地震の規模を示すマグニチュード（Ｍ）は４．２と推定される。この地震による津波の心配はないという。各地の主な震度は次の通り。震度４＝長野県木曽町震度３＝長野県王滝村、上松町"
"山形で積雪４メートル　新幹線２本運休","2018年2月13日 11時10分","自然災害,気象・地震,速報,社会","ＪＲ東日本によると、山形新幹線は１３日、大雪の影響で、山形－新庄間の上下線２本が運休になった。山形地方気象台によると、午前９時現在、山形県大蔵村肘折で観測史上最大となる４メートル３２センチの積雪を記録した。今季、積雪が４メートルを超えるのは全国で初めて。山形県内は１４日午前６時までの２４時間に平地で３０センチ、山沿いで４０センチの降雪が予想されている。【的野暁】"
"九州北部や山口で断続的に雪","2018年2月13日 10時48分","自然災害,気象・地震,速報,社会","九州北部・山口地方は１３日午前、上空に強い寒気が流れ込んだ影響で断続的に雪が降り、交通機関に影響が出た。午後にかけて天気は回復する見込みで、１４日は高気圧に覆われて各地でおおむね晴れが予想されている。気象庁によると、１３日午前８時までの２４時間降雪量は▽山口市１０センチ▽佐賀市４センチ▽熊本県南阿蘇村３センチ。最低気温は、山口市で氷点下１．９度▽熊本市で同１．２度▽佐賀市で同０．１度－－を記録するなど各地で厳しい寒さが続いた。また、山陽新幹線は始発から新尾道－新下関間で一時速度を落として運転し、上下線４８本で最大１８分の遅れが発生。東九州道や西九州道の一部区間で通行止めになった他、北九州市と大分市を結ぶ高速バスなどで運転見合わせが相次いだ。【蓬田正志】"
"日本海側で大雪に警戒　強い冬型の気圧配置続く","2018年2月13日 08時43分","社会,めっちゃ関西,気象・地震,速報","上空の強い寒気の影響で、北日本から西日本では１３日、日本海側を中心に大雪となった。気象庁は北日本を中心に強い冬型の気圧配置が続くとして、１３日夜にかけて大雪への警戒を呼びかけた。気象庁によると、１３日は、北日本や北陸の上空約５千メートルに氷点下３６度以下の寒気が流れ込み、強い冬型の気圧配置が続く見込み。午前１０時までの積雪は福井市１０８センチ、富山市８４センチ、新潟市３２センチ。また山形県大蔵村の肘折で４３２センチ、福井県越前市の武生で１２９センチなど、計４カ所の観測点で観測史上最大の積雪となった。（共同）"
"滑って用水路に転落相次ぐ　２人が死亡","2018年2月12日 19時43分","自然災害,気象・地震,事件・事故・裁判,速報,社会","新潟県内では１２日、大雪の影響で用水路に転落したとみられる事故が相次ぎ、男女２人が死亡した。午前７時半ごろ、十日町市倉俣甲、農業、高野新平さん（９０）がいなくなったと家族から１１０番があった。消防などが捜索したところ、自宅そばの畑の脇にある幅約１．８メートル、高さ約２メートルの用水路に倒れているのを発見。死因は水死。県警十日町署は高野さんが滑って用水路に転落した可能性があるとみている。また同日午前９時半ごろ、長岡市宮沢の無職、小熊矢代江さん（６２）が自宅近くの用水路に沈んでいるのを消防が発見。死因は水死。１１日夕に雪かきのため外出後、行方が分からなくなっていた。県警与板署は、除雪中に誤って落ちたとみて調べている。【井口彩】"
"日本海側中心に再び大雪　１３日にかけて続く見込み","2018年2月12日 18時28分","自然災害,気象・地震,速報,社会","上空の強い寒気の影響で、日本列島は１２日、北日本から西日本の日本海側を中心に再び大雪となった。新潟県と宮城県、長野県で除雪作業中の事故などで少なくとも５人が死亡した。強い冬型の気圧配置は１３日にかけて続く見込み。気象庁は路面の凍結や雪崩、交通の乱れなどに注意するよう呼びかけている。１２日午後１０時現在の積雪の深さは、福井県大野市九頭竜２７１センチ▽滋賀県長浜市余呉町１５４センチ▽福井市９１センチ▽富山市６１センチ▽金沢市４４センチ▽兵庫県豊岡市２９センチ。１３日午後６時までの２４時間に予想される降雪量はいずれも多い所で、福井県で６０センチ、富山、石川両県で５０センチ。近畿でも北部の平野部で４０センチ、山間部で５０センチ程度の降雪が見込まれている。ＪＲ西日本金沢支社によると、１２日は特急サンダーバードが金沢－大阪間、特急しらさぎが金沢－名古屋間と金沢－米原間で終日運休となった。北陸線や氷見線の一部区間でも運転を見合わせた。同区間のサンダーバードとしらさぎは１３日も運休する。路面凍結により、大阪市阿倍野区天王寺町北１の大阪府道（天王寺バイパス）では、１２日午前５時４０分ごろから約３０分間に乗用車などが次々にスリップして衝突。府警阿倍野署によると、事故処理中のパトカーを含む計１４台が絡む事故になった。けが人はなかったが、現場付近は約５時間半にわたって通行止めになった。【椋田佳代、池田一生】"
"日本海側、１３日にかけ大雪警戒","2018年2月12日 17時59分","自然災害,気象・地震,速報,社会","強い冬型の気圧配置の影響で、日本列島は１２日、日本海側を中心に大雪となった。四国や九州の平地でも数センチの積雪があった。日本海側の大雪は１３日にかけて続く見通しで、気象庁は雪崩や交通障害、路面の凍結に注意するよう呼び掛けた。北日本（北海道、東北）と北陸の上空約５千メートルに強い寒気が流れ込み、冬型の気圧配置は１３日にかけて続く見込み。１３日午後６時までの２４時間予想降雪量は多い所で、北陸７０センチ、東北６０センチ、東海、近畿５０センチ、北海道、中国、四国４０センチ、関東甲信、九州北部３０センチ。（共同）"
"青森県の道路除排雪予算　８割使い「足らない」","2018年2月12日 10時14分","自然災害,青森県,気象・地震,速報,社会","青森県の今年度の道路除排雪予算が１月末時点で約８割、執行済みになっている。２月以降の積雪が例年並みでも足りなくなる見通しで、県は８日、約５億円を専決処分とし、除排雪費に追加した。今年度の除排雪費は約３７億５８００万円になった。昨年度から当初予算を例年より約１０億円上積みしていたが、今年度はさらに措置が必要となった。一方、青森市の今年度の道路除排雪予算も１月末時点で約２７億円のうち約８割が執行済みになっており、小野寺晃彦市長は５億円規模の補正予算を組む考えを示している。今後も降雪が見込まれることから、市は市民生活への影響を軽減するために２年ぶりに豪雪対策本部を設置した。青森市内では、除排雪パトロール班を増やして１４班で対応するほか、雪に関する相談窓口を駅前庁舎に新たに設置。市役所本庁舎と浪岡庁舎では電話による相談の受付時間を２時間延長する。また、町内会などが道路の排雪を行う場合の経費の補助割合を２分の１に引き上げる。市によると、昨年１２月１日～今年１月３１日に市民から寄せられた雪に関する相談は、雪が少なかった昨シーズンの約３倍となる３８１９件。半数以上が除排雪の要望だという。気象庁の２月１０日からの１カ月予報によると、日本海側を中心に、下北でも降雪量がかなり多くなる可能性があるという。【佐藤裕太、一宮俊介】"
"北日本から西日本の日本海側　気象庁が警戒呼び掛け","2018年2月12日 09時28分","社会,めっちゃ関西,気象・地震,速報","気象庁は１２日、強い冬型の気圧配置となる影響で、北日本から西日本の日本海側を中心に、１３日にかけて大雪への警戒を呼び掛けた。交通への影響や雪崩にも注意が必要で、北陸は高波、北海道は局地的に猛吹雪となる恐れもある。気象庁によると、北陸の上空約５千メートルに氷点下３６度以下、北日本の上空約５千メートルには同４２度以下の寒気が流れ込んだ。強い冬型の気圧配置は１３日にかけて続く見込み。１３日午前６時までの２４時間予想降雪量は、多い所で、北陸と東海７０センチ、東北６０センチ、近畿５０センチ、北海道と中国地方４０センチ、関東甲信と四国、九州北部３０センチ。（共同）"
"福岡でも雪　１３日にかけ大雪となる恐れ","2018年2月11日 23時24分","福岡県,山口県,気象・地震,速報,社会","九州北部・山口地方は１１日、上空に強い寒気が流れ込み、夜には福岡市の中心部など福岡県内の平野部でも雪が積もった。福岡と北九州の都市高速道路が全区間通行止めとなり、ＪＲ鹿児島県で運転見合わせが出るなど交通機関に影響も出た。福岡管区気象台は、路面凍結などに注意を呼び掛けている。同気象台によると、１３日にかけ大雪となる恐れがあり、１２日午後６時までの２４時間降雪量は、いずれも山間部の多い所で山口県３０センチ、福岡、佐賀両県２０センチと予想している。【佐野格】"
"死者５人に　雪下ろしの男性、屋根から転落死","2018年2月11日 19時12分","自然災害,福井県,気象・地震,速報,社会","福井県災害対策本部は１１日、大雪の影響で新たに２人が死亡したと発表した。６日以降の北陸豪雪による同県での死者は５人になった。災害対策本部によると、１０日午後４時５０分ごろ、同県越前市で自宅の雪下ろしをしていた男性（６８）が屋根から転落し、コンクリート製の塀で頭を強く打って死亡した。福井市大宮２の市道では同日午後８時４０分ごろ、市発注の除雪作業をしていた男性作業員（６６）が重機内で心肺停止状態で見つかり、病死と確認された。【高橋一隆】"
"捜索作業終える　不明の１人は死亡と判断","2018年2月11日 18時54分","台湾,中国,アジア・オセアニア,気象・地震,速報,国際","【上海・林哲平】台湾東部・花蓮県で６日深夜に発生した地震で、台湾当局は花蓮市のビルで行方不明になっている中国人観光客は既に死亡していると判断し、実質的な捜索作業を終えた。台湾メディアが伝えた。行方不明者２人のうち１人は１１日に遺体で発見され、１人とはまだ連絡が取れていない。死者は１６人、けが人は２８５人となった。最も被害の大きい雲門翠堤ビルでは捜索が続けられていたが、１１日に建物が倒壊する危険性が高まったとして作業を中止。部屋には生命反応がなく、家族の了承を得た上で作業の終了を決めたという。現場では追悼のサイレンが鳴り、救助隊員らが犠牲者に黙とうした。今後、建物を取り壊して遺体を運び出す。"
"日本海側中心に大雪恐れ　１３日にかけて強い冬型","2018年2月11日 08時51分","社会,気象・地震,速報","気象庁は１１日、日本付近は１３日ごろにかけて強い冬型の気圧配置となり、北日本から西日本の日本海側を中心に大雪になる恐れがあるとして、交通障害や路面凍結、雪崩、高波に警戒するよう呼び掛けた。気象庁によると、前線を伴った低気圧が関東地方南部の沿岸から東北東へ進み、さらに北日本の上空約５０００メートルに氷点下３６度以下の寒気が流入。１２日は氷点下４２度以下の寒気が流れ込む見通しだ。１２日午前６時までの２４時間に予想される降雪量は、いずれも多い所で、北陸６０センチ、東北５０センチ、北海道と近畿４０センチ、中国３５センチ、東海３０センチ。（共同）"
"再び大雪の恐れ　１１～１３日","2018年2月10日 20時15分","社会,めっちゃ関西,気象・地震,速報","記録的な豪雪に見舞われた北陸地方は、冬型の気圧配置の影響で、１１日午前から雪が降る見込み。雪解けが進む中、１３日ごろまでにかけて再び大雪となる恐れがあり、気象庁は立ち往生や路面凍結など交通への影響に注意を呼びかけている。同庁によると、北陸地方の上空５０００メートルに氷点下３６度以下の寒気が流れ込むとみられ、１１日午後６時までの２４時間に予想される降雪量は、富山、石川、福井の３県でいずれも多い所で３０センチ。近畿地方も多い所で２５センチの降雪が見込まれている。【畠山哲郎】"
"日本海側、大雪の恐れ　雨で増水、雪崩にも注意","2018年2月10日 11時15分","社会,気象・地震,速報","気象庁は１０日、１３日ごろにかけて強い冬型の気圧配置となり、北日本から西日本では日本海側を中心に大雪になる恐れがあるとして警戒を呼びかけた。１０日から１１日は雨が降るため、積雪の多い地域では雪解けによる河川の増水や雪崩にも注意が必要だとしている。気象庁によると、東シナ海で前線を伴った低気圧が発生。低気圧に向かって暖かい空気が流れ込み、北日本から西日本では１１日明け方にかけて広い範囲で気温が上がり、雨が降るという。また、北日本の上空に寒気が流れ込んで、日本付近は１３日ごろにかけて強い冬型の気圧配置となり、日本海側は大雪となる恐れがある。（共同）"
"福岡の空に蜃気楼　「冬将軍」も一休み","2018年2月10日 08時16分","社会,気象・地震,速報","福岡市の西の空に９日夕、太陽が二つ重なったように見える「だるま太陽」が現れた。蜃気楼（しんきろう）の一種で、大気と地表付近の温度差が大きい日に観測される。福岡管区気象台によると、市内の最高気温は１４．６度と３月中旬並みの暖かさ。上空には寒気が残っており、だるま太陽が出現しやすい気象条件だった。立春を過ぎ、各地に大雪を降らせた「冬将軍」も一休みだが、１１日以降は再び寒気が流入して寒くなる見込み。だるまのようにじっと耐える日が続きそう。【西嶋正法】"
"１０日は気温上昇、落雪注意　１１日から再び寒気","2018年2月9日 21時25分","自然災害,石川県,新潟県,気象・地震,速報,社会","北陸地方では９日に天候が回復し、６日から降り続いた豪雪が一段落した。しかし、気象庁によると１０日は気温が上昇し、昼過ぎから雨になる見込みで、雪が解けて雪崩や屋根からの落雪の恐れがある。さらに、１１日昼からは寒気が流れ込み再び雪となる予報で、路面凍結が予想される。行政や専門家は「頭上にも足元にも注意が必要」と引き続き警戒を呼びかけている。今後の天候について、石川県危機対策課は「雪解けで河川が増水する。危険な場所には近づかないでほしい」と気をもむ。屋根の雪下ろし中に足を滑らせる危険もあり、ヘルメットや命綱など安全対策の徹底を呼びかける。さらに注意を要するのは道路。国立研究開発法人・防災科学技術研究所雪氷防災研究センター（新潟県長岡市）の本吉弘岐・主任研究員は「気温の上昇とともに、圧雪状態だった部分の凹凸が顕著になるので、ハンドルを取られたり、タイヤが空転したりしやすくなる」と指摘する。１１日からの寒気もやっかいだ。本吉研究員によると、雨と新たな降雪で重みを増した雪の中に、さらに氷の層ができてスコップがうまくささらないなど、除雪にとって悪条件が重なるという。【石川将来】"
"損壊ビルから夫婦遺体　７２時間が経過","2018年2月9日 19時44分","台湾,カナダ,香港,気象・地震,速報,国際,北米,アジア・オセアニア","【花蓮（台湾東部）林哲平】台湾東部・花蓮県で６日深夜（日本時間７日未明）に発生した地震は９日深夜、生存可能性が大きく下がるとされる発生７２時間が経過した。いまだ５人が行方不明となっている花蓮市の雲門翠堤ビルでは９日も懸命の捜索が続いた。当局によると、この地震による死者は１２人となった。けが人は２７８人。ビルでは９人が死亡した。内訳は１、２階に入る宿泊施設を利用していた中国人４人、香港系カナダ人２人と上層階のマンションの住民ら３人。中国人家族５人の行方がわかっていない。９日午前、ビルの２階部分を捜索していた台湾と日本のチームが客室の中から生命反応を探知したとする情報が流れ、現場には希望が膨らんだ。救助隊は３階から穴を開けて部屋に入り、香港系カナダ人の夫婦を発見したが、後に死亡が確認された。救助隊員は記者団に建物が大きく傾き、動ける空間が非常に狭かったことなどを明かし、「助けられなくて残念だ」と言葉少なに語った。地震では大きな被害を受けた建物が老朽化しており、現在の耐震性能など建築基準を満たしていない可能性が指摘されている。１９９９年に中部・南投県で死者２４００人を超す被害を受けた大地震をきっかけに耐震基準の強化が進んだが、強化前の建物の多くは耐震化が進んでいない。台湾内政部（内務省）は９日、危険性が指摘される建物について、台北など他都市を含め年内に５００件の改築を急ぐ方針を発表した。"
"国道８号の立ち往生解消、通行止めも解除　北陸","2018年2月9日 11時38分","自然災害,めっちゃ関西,気象・地震,速報,社会","北陸地方の天気は９日に回復、６日から降り続いた豪雪は一段落した。一時１５００台以上の車が動けなくなった福井、石川両県の国道８号の立ち往生は９日午前１時に解消、約２７キロにわたった通行止めも同５時に解除された。物流が回復しつつある一方、福井県内などの生活道路や住宅の除雪は進んでおらず、住民らが雪かきに追われている。福井県内のコンビニやスーパーにはようやく商品が届き始めた。坂井市の国道８号沿いのコンビニ「ローソン丸岡一本田店」には８日夜、商品を積んだトラックが２日ぶりに到着。空っぽだった棚が商品で満たされた。男性店員（２０）は「これだけの商品が並んだのは久しぶり」。福井地方気象台によると、１０日は気温が上昇して雨が降る見込みだ。重さを増した雪による家屋倒壊のほか、河川の増水や排水不全による浸水の危険もある。そのため、福井市内では家族で屋根の雪下ろしをする姿も見られた。ＪＲ西日本金沢支社によると、ＪＲ北陸線は９日、６日から終日運休していた特急や金沢－福井間の普通の運行を再開した。金沢－大阪間の特急「サンダーバード」は午前中は臨時ダイヤで運行し、午後からはほぼ平常通りになる見通し。気象庁によると、９日正午現在の積雪の深さは▽福井市１２３センチ▽金沢市６６センチ▽富山市５１センチ－－で、いずれも平年比で２～６倍。１１日から１２日にかけて氷点下まで気温が下がり、再び大雪となる可能性もある。【立野将弘、大森治幸、岸川弘明、青木純】"
"国道８号の立ち往生解消","2018年2月9日 06時40分","自然災害,気象・地震,速報,社会","国土交通省は９日、北陸地方の大雪のため福井県の国道８号で続いていた車の立ち往生は同日午前１時に解消したと発表した。６日午前の発生から６０時間以上が経過した。県や各自治体は９日、混雑が激しくなっていた生活道路を中心に除雪作業を進めた。福井地方気象台によると、１１日から１２日にかけて再び雪が強まる見通しで、全面復旧に向け作業を急ぐ。同県坂井市で、雪に埋もれた車中で男性が死亡しているのが７日に見つかり、一酸化炭素（ＣＯ）中毒死だったことが８日に判明。大雪による死者は、新潟県と北陸で計８人となった。（共同）"
"迫る７２時間、懸命の捜索　日本派遣の専門家も","2018年2月8日 21時36分","台湾,アジア・オセアニア,気象・地震,速報,国際",""
