"title","date","tags","article"
"噴出物、マグマ含まず　水蒸気噴火か","2018年1月24日 19時16分","自然災害,科学・技術,気象・地震,速報,サイエンス,社会","草津白根山の本白根山（群馬県、標高２１７１メートル）で発生した噴火について、気象庁は２４日、噴出物に地下のマグマ成分が含まれないことから、水蒸気噴火の可能性が高いと発表した。一方、現地で観測を続ける東京工業大チームは、噴火は複数の場所で起こり、最大で１メートル程度の噴石があったことを明らかにした。火山活動は活発な状態が続いており、気象庁は引き続き鏡池から２キロの範囲では大きな噴石などへの警戒が必要としている。産業技術総合研究所と防災科学技術研究所が火山灰を分析した結果、約８割が山を構成する粒子で占められていた。２４日、群馬県草津町で記者会見した野上健治・東京工業大教授は、マグマが上がってきたわけではなく、マグマから分離した高温のガスによって地下水が熱せられて起きた水蒸気噴火との見方を示した。今後、マグマ噴火など、より大規模な噴火につながる可能性について、気象庁の小久保一哉・火山活動評価解析官は「現時点でその兆候はないが、噴火を繰り返す中で次第に変わっていく可能性はある」と述べた。また、同庁は２４日午前１０時台と午後２時台にそれぞれ２回ずつ、火山性微動を観測した。微動の発生に伴って、地殻変動を示す傾斜計にも変化があった。火山性微動は最も長いもので４分程度継続したが、２３日の噴火時に発生した火山性微動と比べると、振幅は１０分の１以下と小さかったという。今回の噴火を受け、同庁は２６日午前に火山研究者で構成する火山噴火予知連絡会拡大幹事会を臨時で開くことを決めた。草津白根山の観測態勢の強化などについて検討する予定だ。【飯田和樹、山本有紀】"
"死亡は４９歳陸曹長","2018年1月24日 19時14分","自然災害,気象・地震,速報,社会","草津白根山の噴火で、訓練中に死亡した陸上自衛隊員の男性は、第１２旅団第１２ヘリコプター隊所属の陸曹長、伊沢隆行さん（４９）であることが２４日、関係者への取材で判明した。"
"日本海側中心に暴風雪、路面凍結に警戒","2018年1月24日 18時40分","社会,気象・地震,速報","気象庁は２４日、強い冬型の気圧配置が２７日ごろにかけて続くことから、日本海側を中心に大雪や暴風雪、路面凍結などに警戒するよう呼びかけた。数年に１度のレベルの非常に強い寒気が流れ込んでおり、普段から雪の少ない地域でも積雪となる所があるとしている。大阪管区気象台によると、関東に大雪をもたらした低気圧が発達しながら北東に進み、西高東低の気圧配置が強まった。２４日朝には石川県輪島市の上空５０００メートルで氷点下３８．９度を観測した。２５日午後６時までに予想される降雪量は、多い所で北陸１００センチ▽東北、関東甲信７０センチ▽近畿、東海５０センチ▽北海道、中国４０センチ▽四国１５センチ。日本海側では最大瞬間風速３５メートルの暴風も予想される。雪は２６日にかけて降り続くとみられる。すでに近畿北部も大雪となっており、２４日午後４時現在の積雪は京都府京丹後市３３センチ、兵庫県香美町４３センチなど。２５日朝には広い範囲で氷点下の冷え込みが予想される。【池田知広】"
"火山性微動で捜索を中止","2018年1月24日 13時07分","自然災害,気象・地震,速報,社会","草津白根山の噴火から一夜明けた２４日、１２人が死傷した群馬県草津町の草津国際スキー場では、群馬県警と吾妻広域消防本部などが午前１０時すぎから行方不明者の有無を調べるため捜索活動を始めた。しかし、午前１０時５０分ごろ、火山性微動が観測されたため、捜索を中止した。この日は猛吹雪に見舞われた。捜索隊はロープウエーの山麓（さんろく）駅に集合。周囲に硫黄臭が漂う中、午前１０時すぎ、先発隊１５人がヘルメットとゴーグルを身につけ、雪よけの盾を持ち、雪上車やスノーモービルに乗り込んでゲレンデに向かった。中止後は山麓駅に戻った。また、国土交通省はこの日、専門家３人を派遣、降灰の範囲などについて上空からヘリコプターで調査した。一方、陸上自衛隊によると、重体だった隊員２人は２３日夜に入院先で手術を受け、現在は経過観察中という。【神内亜実】"
"福岡・山口も平野部に雪　各地で氷点下","2018年1月24日 12時25分","社会,気象・地震,速報","九州北部の上空に強い寒気が流れ込んだ２４日、福岡、山口両県を中心に平野部でも雪が積もるなど厳しい寒さに見舞われた。雪のために北九州市の都市高速の全線通行止めが続くなど交通機関にも乱れが出た。気象庁によると、午前９時時点の各地の積雪は山口県下関市で２センチ、山口市で１センチを観測。北九州市などでも２３日夜から断続的に雪が降った。最低気温は山口県萩市で氷点下３．１度と今季最低を記録。北九州市で同０．４度、福岡県八女市でも同２．５度と各地で氷点下を観測した。福岡北九州高速道路公社によると、北九州市の都市高速が２４日午前０時半から雪のため全線で通行止めとなった。【吉住遊、柿崎誠】"
"地元に広がる動揺　スキー客まばら","2018年1月24日 11時34分","自然災害,気象・地震,速報,社会","草津白根山（群馬、長野県境）の本白根山の噴火から一夜明けた２４日。多数の死傷者が出た草津国際スキー場（群馬県草津町）は、被害がなかったふもとのゲレンデは通常通り営業し、午前８時半からリフトも動き始めた。ただ、スキー客の姿はまばらだった。全国有数の温泉地でもある地元の草津町は、昨年６月に白根山の「湯釜」付近の噴火警戒レベルが「２」から「１」に下がった直後の噴火活動に驚きと戸惑いを隠せず、観光への影響を危惧する。「普段と比べたらオープン時の客が全然いない。ちょっと悲しい」。草津町の会社員、山田春貴さん（３０）は２４日午前９時ごろ、草津国際スキー場のふもとのゲレンデで寂しげな表情を浮かべた。週１回のペースで同スキー場に来ているという山田さんは「ほかのスキー場にみんな行ってしまうのではないか。草津離れが多くなるのでは……」と残念そうだ。２３日の噴火時はふもとにいて難を逃れた千葉市の早川実さん（７０）は、草津町にマンションを購入し、冬の期間は計約７０日間、妻とともに草津に滞在する。早川さんは「土地勘はあるが、本白根山の噴火はノーマークだった。ただ、スキー場も開放しているし、下方なら大丈夫だろうと思って今日も来た」と話した。「一番怖いのは風評被害」。草津温泉街の中心「湯畑」近くにある老舗ホテル「一井（いちい）」は、２３日に約１００件の問い合わせがあり対応に追われた。噴火した付近からは離れているので安心だと説明した。おかみの市川薫さん（７１）は「キャンセルが相次ぐのかと心配したが、今のところは特に影響は出ていない」とひとまずはホッとした様子。ただ「噴火警戒レベルが下がって喜んでいたのに……」と肩を落とした。草津町総務課によると、２３日の噴火以降、「行っても大丈夫か」といった問い合わせが数十件入った。「温泉街周辺は安全です」と答えているという。町総務課の篠原誠課長補佐は「噴火警戒レベルが１になった時は観光客が増えるという期待があったが、今回の噴火でスキー客が減少するのは仕方ない」と分析する。そのうえで「（山頂に通じる道路の）冬季閉鎖が終わるのは４月中旬。まだ時間はあるので本白根の状況を確認して対策を考えたい」と話した。草津町は、黒岩信忠町長が「草津温泉で食っている」と言うように観光業中心の町。草津温泉観光協会の担当者も、噴火によって観光に悪影響を及ぼす風評被害を懸念する。温泉街はここ数年、インバウンドが急増している。２３日は米国や台湾など世界各国から取材があったという。「レベル３の警戒区域は火口から２キロ以内に噴石が飛散する。７キロも離れている温泉街が安全であることを説明した。ホームページにも今朝から『被害がない』ことについて説明する内容を掲載した」と語った。草津温泉観光協会の別の担当者は「噴火の一報を聞いた時、目の前が真っ暗になった。一夜明けて、今のところ温泉街には大きな影響はないのでほっとしている。だが、噴火は観光に間違いなく影響を及ぼす。決して楽観はできない。我々がまずやるべきことは、正確な情報の発信を続けていくことしかない」と唇をかんだ。草津国際スキー場を運営する草津観光公社の長井英二社長は２４日、報道陣の取材に「風評被害については想像がつかない。２月はトップシーズンだが、相当お客さんは減るのではないか」と危惧した。「ロープウエーから上（のゲレンデ）は今シーズンの営業は無理だと思う。ファミリーのためのコースは楽しめるが、上級者向けのコースが楽しめないスキー場になってしまうかもしれない」と見通しを語った。同社の関口英男営業課長（４７）は「いつもだったら、ふもとのレンタルショップは行列ができていて、スキー客でにぎわっているが、２４日は全然人がいない。こんなに人がいないのは東日本大震災以来だ」と話した。【島袋太輔、吉田勝、山本有紀、西銘研志郎】"
"死傷者の氏名公表せず","2018年1月24日 11時30分","自然災害,気象・地震,速報,社会","本白根山の噴火で災害対策本部を設置した群馬県は２４日午前の時点で、死傷者の氏名を公表していない。その理由について、県の担当者は「自然災害の被災者の氏名は従来も公表していない」と説明した。ただ、「関係機関と話し合って検討したい」と今後公表する可能性も示唆した。２０１４年９月に御嶽山（長野、岐阜県境）の噴火で死者５８人、行方不明５人が出た際は、長野県警が氏名を公表した。【杉直樹】"
"地吹雪で決死の救助　「２次災害を懸念」","2018年1月24日 11時28分","自然災害,気象・地震,速報,社会","草津白根山（群馬、長野県境）の本（もと）白根山の噴火で、噴石による死傷者が出た草津国際スキー場（群馬県草津町）での救助活動に当たった吾妻広域消防本部（群馬県東吾妻町）が２３日夜、記者会見し、「一番恐れたのは２次災害。噴火・噴石による被災を懸念した。山頂付近は地吹雪で周りが見えない『ホワイトアウト』の状態になることもあった」と過酷な状況での活動を振り返った。【山本佳孝、西銘研志郎】同消防本部によると、スキー場のふもとと山頂を結ぶロープウエーの山麓（さんろく）駅では、スキー滑走中に噴石が当たるなどしてけがをした１０人を確認。いずれも意識があり、優先順位をつけて順次病院に搬送した。噴石で送電線が切断され、ロープウエーは停電していた。噴石はゴンドラや山頂駅も直撃し、山頂駅には台湾や英国からのスキー客を含む約８０人が取り残されていた。同消防本部の隊員らは地上からスノーモービルや雪上車で山頂に向かい、自衛隊のヘリコプターなどと共同で救出することを決めた。「ゲレンデの斜面は噴石で雪にスポット（穴）ができており、火山灰が積もっていてスキーで滑れる状態ではなかった」からだ。山頂駅は停電で暖房が切れていたことから、雪上車には積めるだけの毛布を積んだ。山頂駅のレストハウスで待機していた人たちは「取り乱してはおらず、落ち着いた様子だった」。山頂駅からの救出作業は噴火から約５時間後の午後３時ごろに始まった。けが人や女性、子供を優先し、ヘリやスノーモービルに乗せていった。スノーモービルは救助者を２人ずつ乗せてゲレンデの斜面を下りた。何度も往復し、全員の救出作業が終わったのは午後６時２０分ごろだった。同消防本部に当初もたらされた情報は「雪崩に巻き込まれ４人のうち１人が埋まっている」だった。だが、現場で確認すると噴石によるけがで、隊員らは「とまどった」という。情報が混乱する中での活動という難しさもあった。"
"雪山、泥流に警戒　噴火活動が続く恐れ","2018年1月24日 11時19分","自然災害,気象・地震,速報,社会","草津白根山（群馬、長野県境）の本（もと）白根山で発生した噴火について、気象庁は２４日、新たな噴火は確認されていないものの、同日午前０時から同１１時までに火山性微動を２回観測するとともに、今後も噴火活動が続く恐れがあるとの見通しを示した。より大規模の噴火が発生した場合、高温の噴出物が積雪を溶かして起こる「融雪型火山泥流」が発生する可能性もあるとして、警戒を呼びかけている。小久保一哉・火山活動評価解析官は「（一般的に）噴火活動が１回で終わることは珍しい。ある期間継続して活動すると考えるべきだ」と述べた。気象庁によると、火山性微動は２４日午前１０時１５分と同５０分ごろの２回観測され、現地に設置している傾斜計にわずかな変化が確認された。噴火があった２３日午前１０時ごろにも１回（約８分間）観測されている。火山性微動は地下のマグマやガス、熱水などの流体の移動などに伴う震動。火山性地震と異なり長時間継続する特徴があり、噴火に伴って発生することがある。火山性微動の発生を受け、群馬県警と消防は２４日午前、山頂付近での捜索活動を中止した。一方、地下で岩盤が割れるなどして起こる火山性地震は２４日午前０～１１時に計５回観測された。噴火当日の２３日は６２８回で、減少傾向を示している。噴火活動の長期化が懸念される中、今後は「融雪型火山泥流」への備えも重要になる。火砕流など高温の噴出物で溶けた雪が土砂を巻き込んでふもとに流れ落ちる現象で、今回は噴火の規模が小さいことなどから発生の可能性は少ないとみられるが、過去には小規模な場合でも多数の人的被害が出たケースもある。泥流は雪解け水の影響で土石流などと比べると速度が速く、時速６０キロを超えることもある。谷や沢に沿って一気に落下する特徴があり、被害が広範囲に、かつ遠方に及ぶ恐れがある。国内では、１９２６年５月の北海道・十勝岳の噴火によって発生した「大正泥流」が、最大規模の被害を出したとされる。積雪が少なく、水蒸気爆発の規模も大きくなかったが、残雪を溶かした泥流が川に沿ってふもとへ一気に流れ込み、死者・行方不明者は約１４０人に達した。十勝岳から２５キロ離れた地点での被害が多かったという。東京工業大火山流体研究センター・草津白根火山観測所長の小川康雄教授は「噴火の詳細は分かっていないが、泥流については引き続き警戒する必要がある」と指摘している。【飯田和樹、五十嵐和大】"
"不明者の有無を調査　県警と消防","2018年1月24日 11時09分","自然災害,気象・地震,速報,社会","草津白根山の噴火から一夜明けた２４日、１２人が死傷した群馬県草津町の草津国際スキー場では、群馬県警と吾妻広域消防本部などが午前１０時すぎから行方不明者の有無を調べるため捜索活動を始めた。しかし、午前１０時５０分ごろ、火山性微動が観測されたため、捜索を中断した。この日のスキー場は猛吹雪に見舞われた。捜索隊はロープウエーの山麓（さんろく）駅に集合。周囲に硫黄臭が漂う中、午前１０時すぎ、先発隊１５人が白いヘルメットとゴーグルを身につけ、雪よけの盾を持ち、雪上車やスノーモービルに乗り込んでゲレンデに向かった。また、国土交通省はこの日、専門家３人を派遣し、降灰の範囲などについて上空からヘリコプターで調査した。【杉直樹、神内亜実】"
"気象庁ノーマーク　まさに寝耳に水…","2018年1月24日 06時30分","自然災害,社会一般,気象・地震,速報,社会","２３日に噴火した群馬・長野県境の草津白根山の火口は、従来警戒を強めていた「湯釜」ではなく、気象庁が３０００年間も噴火していないとみている２キロ南の「鏡池」付近だったと考えられる。火山活動の高まりを示す事前の現象もなく、まさに寝耳に水の災害。噴火警戒レベルは５段階で最も低い１（活火山であることに留意）としていた。それだけに気象庁も驚きを隠せない。死者・行方不明者６３人という戦後最大の火山災害となった２０１４年９月の御嶽山（長野・岐阜県境）の噴火を契機に、「噴火速報」が導入されていたが発表できず、改めて火山監視の難しさを突きつけられた。【飯田和樹、荒木涼子、岡田英、千葉紀和】「草津白根山が噴火した」との情報は最初、群馬県草津町から寄せられた。記者会見した気象庁の斎藤誠火山課長は「噴火の前に火山活動の高まりを示すような観測データは見られなかった」と釈明した。気象庁は草津白根山と呼ばれる山域のうち、「湯釜」という白根山の山頂火口付近の浅い場所で地震活動が高まるなどした場合、住民らに発表する噴火警戒レベルを１から２（火口周辺規制）に引き上げるという基準を設けていた。だが、レベルを上げる根拠とするような変化はなかった。斎藤課長は「噴火前に警報のレベルを上げて被害を未然に防ぐという努力はしていきたいが、今回の観測データでは困難だった」と説明する。噴火の確認も後手に回った。草津町から、本白根山の山頂に煙が上がっているとの通報を受けてデータを確認すると、火山性微動の波形が認められた。そこでレベルを２に引き上げたが、既に噴火から１時間以上も経過した午前１１時５分になっていた。さらにレベル３に引き上げたのは、鏡池から１キロ以上離れたロープウエーの山頂駅付近まで噴石が飛んでいるという報告を、現地を観測している東京工業大から受けた後の同１１時５０分だった。噴火に関する判断の端緒が外部からの連絡頼みになったことが気象庁の対応を遅らせ、入山者らへ迅速に知らせる「噴火速報」を発表することもできなかった。噴火速報の対象は、日本全国の活火山１１１のうち、特に警戒が必要な「常時観測」火山５０。草津白根山もその一つで、気象庁などは地震計▽マグマの上昇を山の膨張などから調べる傾斜計▽噴火に伴う爆発の規模を調べる空振計▽監視カメラ－－などを設置し、国内有数の観測網を敷いてきたが、重点は白根山側だった。噴火速報は１５年８月に導入され、これまで阿蘇山で２回、桜島で１回発表されているのに、今回はタイミングをつかめなかった。斎藤課長は「観測された火山性微動が噴火に伴うものか即座に判断できなかった。残念ながら速報が出せなかった」と悔やむ。気象庁の担当者も「データの蓄積がなく、噴火経験の少ない所だから難しかった。遠くから目視で噴煙なども確認できなかったので、噴火したかどうか判断が難しい状態のまま速報は出せない」としている。現地で観測している東工大の野上健治教授（地球化学）も「今回のような水蒸気噴火の予知がいかに難しいか痛感した。あそこで起こるとは思わなかった」と話した。気象庁は２３日、現地に火山機動観測班を派遣した。噴火の規模や種類、噴石飛散の範囲などを調べている。今後、鏡池がある本白根山を監視するためのカメラを設置するなど、監視態勢を強化する。草津白根山は「白根山」や「本白根山」など火山活動でできた山々の総称だ。１８００年以降、小～中規模の水蒸気噴火が１０回以上記録されているのは、いずれも「湯釜」を中心とした白根山山頂火口周辺だ。近年は目立った活動がない本白根山側に対して警戒感が薄まるのは避けられないとしても、地形が示すように、有史以前は草津白根山のあちこちで今回より大きな噴火が起きたことは明らかだ。本白根山の山頂周辺にも大小１５以上の火口があり、過去に繰り返し噴火したことを証明している。さらに、気象庁は本白根山の前回の噴火は３０００年前としているが、石崎泰男・富山大准教授（火山地質学）らはもっと新しい１５００～１２００年前の痕跡を確認したという。「それ以降も小規模噴火が何回も起きた可能性はある。見落としてきた噴火を調べることが、今回と同じ小規模噴火への備えになる」と語る。斎藤火山課長は２３日の記者会見で「本白根山で噴火が起きないとは思っていないが、白根山の方が危険だと思っていた」と明かした。宮下誠・気象庁火山課長補佐は「本白根山の観測態勢は薄かった」と認める。火山噴火には３種類あり、今回は水蒸気噴火とみられる。マグマの熱で温められた地下水が水蒸気となり、出口を求めて火口から噴き出すケースだ。比較的小規模になる場合が多いが、噴石を飛ばすこともある。１４年の御嶽山もそうだった。石崎准教授は「噴火の特徴をとらえるため、噴石や火山灰の解析が必要だ」と指摘する。このほか、地下から上昇したマグマが直接地上に噴き出すのが「マグマ噴火」で、桜島（鹿児島県）や雲仙普賢岳（長崎県）が有名だ。水蒸気噴火とは違い、マグマと地下水が接触し、水が急膨張して火口から爆発的に噴き出すタイプは「マグマ水蒸気噴火」だ。"
"防衛省「陸自隊員被害は雪崩でなく噴石」","2018年1月23日 23時12分","自然災害,社会一般,気象・地震,速報,社会","草津白根山（群馬、長野県境）の本（もと）白根山の噴火で、防衛省は発生直後の２３日午前、現場報告に基づき「隊員６人が雪崩に巻き込まれた」と発表したが、その後の調査で被害が雪崩ではなく噴石によるものと判明。隊員に軽傷者が新たに２人いることも分かり、同日夕に「噴石による死傷者が８人」と訂正した。小野寺五典防衛相は「急に噴石が飛んできたり、噴石によって雪が雪崩のように落ちてきたりしたため、最初の報告が雪崩になったと思う」と話した。"
