"title","date","tags","article"
"石川県能登で震度３　津波の心配なし","2018年1月5日 11時32分","富山県,石川県,気象・地震,速報,社会","５日午前１１時２分ごろ、石川県能登で震度３の地震があった。気象庁によると、震源地は富山県西部で、震源の深さは約２０キロ、地震の規模を示すマグニチュード（Ｍ）は３．９と推定される。この地震による津波の心配はないという。各地の主な震度は次の通り。▽震度３＝石川県中能登町、七尾市"
"茨城県南部で震度３　津波の心配なし","2018年1月5日 11時10分","茨城県,気象・地震,速報,社会","５日午前１１時２分ごろ、茨城県南部で震度３の地震があった。気象庁によると、震源地は茨城県沖で、震源の深さは約４０キロ、地震の規模を示すマグニチュード（Ｍ）は４．４と推定される。この地震による津波の心配はないという。各地の主な震度は次の通り。震度３＝神栖市"
"１３００人今も自宅帰れず　きょう半年","2018年1月5日 08時30分","自然災害,福岡県,話題,気象・地震,速報,社会","関連死１人を含め４０人が犠牲となった九州北部豪雨では、福岡、大分両県で約１３００人が自宅外生活を強いられている。そのうち自治体が民間賃貸住宅を借り上げたみなし仮設住宅には約８００人が入居。地元を離れた周辺自治体に点在するみなし仮設には約３８０人が暮らし、被災者の孤立が懸念される。豪雨発生から５日で半年。みなし仮設の女性は、古里に戻れる日を信じて新年を迎えた。福岡県うきは市の集合住宅で暮らす松岡サチエさん（８０）は、昨年末から風邪を引き、正月も体調が優れずに寝込んでしまった。避難所からみなし仮設の集合住宅に移って約３カ月。「こんなに熱が長引くなんてなかったんだけど。豪雨からの疲れもあると思う」あの日、同県朝倉市杷木（はき）寒水（そうず）の自宅は濁流に囲まれた。長年、美容師の仕事を続けて子ども２人を一人で育て上げ、十数年前に購入した家だった。容赦なく濁流は迫り、玄関から水が入り出した。道を隔てて少し高台にある近所の家に身を寄せて、一晩明かした。近くの中学校での避難所暮らしを経て、昨年１０月に朝倉市に隣接するうきは市内のみなし仮設に移った。見慣れない風景に戸惑う日々が続く。買い物や銀行などの用事は「どこに何が置いてあるか分かるから」と自宅近くの店舗や銀行まで自ら車を走らせてしまう。昨年末、高齢の被災世帯を支援するグリーンコープ生協ふくおか（本部・福岡市）が正月用の餅を持って訪ねた。「何もするまいと思っていたけど、ありがとう」とほほ笑むも「家の再建を考えると不安で夜中に目が覚める」とも打ち明けた。自宅は大規模半壊の判定を受けた。取り壊しは、業者の人手不足などで３～４月にずれ込む見通しだ。福岡市内と東京で暮らす子どもたちからは同居の提案もあるが「元気なうちは迷惑をかけたくない」と断っている。豪雨当日に頼った近所の住民と励まし合った。避難所でも同年代の女性と親しくなり、女性が移った仮設団地で髪をカットしたこともある。そんなつながりが心を支える。「プレハブでも一間でもいいから、元の場所に家を建てて住みたい」と語った。【青木絵美】九州北部豪雨で被害が大きかった福岡県朝倉市は、被災者の生活再建に向けた相談窓口「地域支え合いセンター」を今月中にも開設予定で、みなし仮設住宅を訪問するなど課題の把握に力を入れる。みなし仮設は被災者が利便性の高さなどから住む場所を自分で選べる利点があり、応急仮設住宅よりも希望者が多くなる。しかし、点在してしまうために孤立化が心配される。朝倉市の介護サービス課によると、みなし仮設入居世帯の約４分の１が６５歳以上の世帯という。地元の地域包括支援センターによると、みなし仮設入居後に足腰が弱るなどしたため、それまで利用しなかったデイサービスなどの介護サービスを申請する高齢者が相次いでいるという。被災者が集団で暮らす応急仮設住宅では催しなどの地域活動が計画される一方、みなし仮設入居者は活動量が減ってしまいがちで、支援センターの関係者は「みなしに入った途端、畑仕事など自分の役目を失った高齢者は少なくない」と話す。東日本大震災で被災者の健康調査などに携わった東北大の辻一郎教授（公衆衛生学）は「被災者の自立や復興には人のつながりが欠かせない。新設されるセンターでは、個別のニーズを満たすだけでなく、住民がもう一度支え合っていけるようなネットワーク作りを助けることが必要だ」と指摘した。"
"関連死３割が車中泊　「健康確認、態勢確立を」","2018年1月4日 08時30分","自然災害,気象・地震,速報,社会","２０１６年４月の熊本地震で震災関連死に認定された２００人のうち、３割にあたる５９人が車中泊を経験していたことが、熊本、大分両県の関係市町村への取材で分かった。専門家は、大規模災害時の車中泊者の健康チェック態勢を確立すべきだと訴えている。最大震度７を２回記録した熊本地震の被災地では、建物の倒壊を恐れて車中泊する避難者が続出した。３日現在、熊本県で１９７人、大分県で３人の計２００人が震災関連死に認定され、直接死（５０人）の４倍に達した。毎日新聞は昨年１２月上旬、震災関連死を認定した熊本県１９市町村と大分県１市の計２０市町村に、認定者の車中泊経験の有無などを取材した。車中泊の経験があった５９人は男性３１人、女性２８人。年代別では、８０代が最多の１９人に上り、７０代以上が４０人と７割弱を占めた。２００人全員の死因は明らかではないが、熊本県が１７年８月末に関連死した被災者の死因を調べたところ、呼吸器系疾患５３人▽循環器系疾患５０人▽突然死など２８人－－が目立った。車中泊と関連死の因果関係は不明だが、狭い車内で長時間同じ姿勢を強いられるため、下半身にできた血の塊（血栓）が肺の血管を詰まらせるエコノミークラス症候群を誘発することが指摘されている。震災関連死に詳しい神戸協同病院（神戸市）の上田耕蔵院長は「狭い車内で十分な休息を取れず、体調を悪化させて亡くなった人もいるだろう。車中泊した被災者の中でも特に健康状態が悪い人を継続的にチェックすることが重要で、行政やボランティアが車中泊者と接触する機会を増やす必要がある」と話している。【中里顕】建物倒壊による圧死や津波による水死など直接的な原因による死亡ではなく、被災による急激な環境変化に伴うストレスなどで持病や体調が悪化して死亡したケースを指す。遺族の申請を受けて、自治体が設置した医師や弁護士などで構成する審査委員会が災害との因果関係を調査。自治体が関連死と認定すれば、生計維持者の場合は５００万円、他の人の場合は２５０万円の災害弔慰金が遺族に支給される。熊本市中央区の津崎操さん（当時８９歳）も一時車中に避難して、震災関連死に認定された。当時操さんと車で過ごした長女の冨永真由美さん（５８）は「車内で寝泊まりすることが大きな負担になることは、母のそばで痛感した」と振り返る。冨永さんは、夫と操さんとの３人暮らしだった。操さんは体が弱り、地震の半年ほど前から寝たきりだった。４月１４日の前震で木造２階建ての自宅は激しく揺れた。介護が必要な母を車椅子に乗せて連れて行ける避難所が近くになく、犬も飼っていたため車中泊を選んだ。近くの大型店の駐車場には他にもペットを連れた近所の人が車中泊していた。４人乗りの軽乗用車の助手席を倒して母を寝かせたが、上半身がやや起きた状態。普段はたんが絡まると、冨永さんが寝たきりの母の体を横向きにしてたんを出していたが、助手席を倒した状態では出しにくかった。翌１５日に一度自宅に戻ったが、１６日の本震で再び車中泊を余儀なくされた。母は次第に呼吸が浅くなり、夜明けとともに急いで病院に連れて行ったが、息を引き取った。母が避難して休める場所を車で探すにも、通行止めなど道路事情が悪く、移動自体が困難だった。冨永さんは「当時を振り返ると、今も車中泊しか選べなかったと思っている」と唇をかみしめた。"
"届け先不明はがきは「漂流郵便局」まで","2018年1月4日 08時00分","自然災害,社会一般,めっちゃ関西,気象・地震,速報,社会","届け先が分からないはがきを受け付ける私設の郵便局がある。瀬戸内海・粟島の「漂流郵便局」（香川県三豊市）だ。兵庫県川西市の契約社員、大西正則さん（６６）は、阪神大震災直後の１９９５年２月に亡くなった次男浩太さん（当時１１歳）に、はがきを送り続けている。「お父さんは君に便りを何通も何通も出してきましたね。そうしたら君はお父さんの心の中に住みついてくれました」（２０１７年１１月５日付）。悲しみと寂しさ、命の重み。息子との“対話”はもうすぐ２００通を数える。【道岡美波、待鳥航志】浩太さんは８３年９月２５日、体重２９００グラムで生まれた。直後に心臓病が判明し、生後１９日でバイパス手術。その後も治療と手術が続いた。９５年１月１７日の阪神大震災当日、自宅２階で寝ていた浩太さんは、タンスの下敷きに。けがはなかったが、その日から急に元気をなくした。通い慣れた神戸市須磨区の病院で受けた定期検診の帰り道、普段はおしゃべりな浩太さんが、車の窓から傷ついた神戸の街を黙って見つめていた。「この世界にお別れをしようとしていたんじゃないか」と大西さんは振り返る。約１カ月後、浩太さんは早朝、水槽の魚を見に行った玄関先で「お母さん」と言い残して倒れた。病院でも明確な死因は不明。「震災が浩太の命を縮めてしまったのでは」との思いが残った。１４年６月、テレビで漂流郵便局の存在を知った。亡くなった人や昔の恋人などに宛てたものなど、さまざまなはがきを預かってくれる。「これでようやく君への思いを届けることができます」。浩太さんが亡くなって１９年。１通目をしたため、「対話」が始まった。通勤電車の中で浩太さんを思うと、書きたいことがあふれた。一緒に訪れた場所、好きだった食べ物、家族の近況－－。手帳に書き留めた。はがきを送れば会える気がした。「時計の針が少しずつだけど動き始めたんです。うれしい。君と一緒に生きていけるんです」（１５年２月１６日付）初めは月４、５通送り、夢の中で浩太さんが登場した時の様子などをつづった。最近は２カ月に１通くらい。悲しい思い出さえも、消えてほしくないと願うようになった。大西さんは毎年、妻妃登美（ひとみ）さん（６３）と阪神大震災の犠牲者の鎮魂を祈る「神戸ルミナリエ」に足を運ぶ。浩太さんへの思いを確かめるためだ。１７年は１２月１１日に訪れた。「去年より豪華だね」と妃登美さん。大西さんの目がうっすら涙でぬれていた。「震災の混乱やストレスがなければ、浩太はもっと長く生きられたんじゃないか」１年ほど前から物忘れが増えた。浩太さんへの思いを忘れないよう、記憶を深く刻むためにペンを握る。冷え込んだ年の瀬の午後、浩太さんに宛てた１９８通目のはがきを手に、自宅近くの郵便局に向かった。はがきにはローストチキンやショートケーキの写真。「浩太、元気ですか。クリスマスカードは届いていますか。（写真は）どれもこれも君の大好物。お腹（なか）いっぱい食べてください」瀬戸内国際芸術祭で２０１３年、アーティストの久保田沙耶さんが旧粟島郵便局を利用して手がけたプロジェクト。宛先の分からない人や物、出来事へのはがきを受け付ける。届いたはがきは私書箱に収められ、いつか相手に届くまで「漂わせて」預かってくれる。管理・運営は、元粟島郵便局長の中田勝久さんに委ねられ、訪れた人が自由に読むことができる。開局は第２、４土曜の午後１～４時。・はがきを読んでくれましたか。そして、お父さんのことを思い出してくれましたか。お父さんは君のことをみんな覚えています。会いたい、会いたい、会いたい。（３通目）・１、２月は心が重たい日々です。阪神大震災、そのあとすぐの浩太との突然の別れ。心穏やかに浩太を思い、心静かに過ごしましょう。（５８通目）・今夜、涙が止まらなくなりました。突然です。浩太との別れは納得できていたはずなのに。テレビで東日本大震災の映像を見過ぎたから。わからない。浩太、どうしたらいいんだろう。どうかお父さんに涙の止め方を教えて下さい。（１５年３月１２日、７６通目）・浩太への思いと懐かしさのあまり、一度だけ、（当時通院していた）病院へ行きました。あの頃は不安から心がなえていましたが、病院の玄関をくぐるたびにお父さんとお母さんは強くなっていきました。今でも赤ちゃんを抱き、涙をためた親たちが玄関に消えていきます。思わず叫んでいました。「きっと強くなれる。がんばれ」（１５年５月２８日、９７通目）・君と別れてから２１回目の神戸ルミナリエ。一つ一つの小さな灯火。お父さんには命の輝きに見えました。君の光はどこにあるのだろうか。（１５年１２月５日、１１９通目）・団地のベンチに座り（浩太さんへの）思いをつづっていると、老眼鏡にポタリポタリと涙が落ちてきて、ノートが見えなくなってしまいました。やっぱりいつまでたっても悲しいよ。悔しいよ。（１７年２月１８日、１７４通目）"
"被災した古里　自宅で避難者年越し　福岡・朝倉","2018年1月1日 07時45分","自然災害,福岡県,九州北部豪雨,気象・地震,速報,社会","昨年７月に福岡、大分両県を襲った九州北部豪雨の被災地はいまだ復興の途上で、仮設住宅など自宅外で避難生活を送る被災者は約１３００人に上る。福岡県朝倉市杷木松末では３１日、市外のみなし仮設住宅で暮らす井手巽さん（７５）一家３人が住み慣れた自宅で正月を過ごしたいと、豪雨の爪痕が生々しい古里に戻ってきた。大みそかの３１日、昨年７月の九州北部豪雨で大きな被害を受けた福岡県朝倉市杷木松末の乙石集落に井手巽さん（７５）の姿があった。同県久留米市のみなし仮設住宅で避難生活を続けるが、「せめて新年は自宅で迎えたい」と一時的に帰宅した。乙石集落は被災地で最も復旧が遅れた地域だが、古里の再生を願って傷んだ自宅に明かりをともした。井手さんは自宅で妻アイコさん（７３）と長男保典さん（５０）の３人暮らしだった。青果商を営みながら子供２人を育て上げ、最近は自宅近くの約０．５ヘクタールの田畑を保典さんと耕す日々を送っていた。豪雨当日は濁流が自宅を襲い、帰省していた長女明子さん（４７）も含めた４人で家の中にいて周囲の家が次々と流されていくのを見て死を覚悟した。自宅はかろうじて残ったものの敷地の一部が崩落し、豪雨の２日後にヘリコプターで救出された。自宅は大規模半壊の判定を受け、避難所を経て久留米市内のみなし仮設住宅で生活を始めた。豪雨から約２カ月後に集落へ通じる道路が仮復旧すると、でこぼこ道をたどって自宅に通い始めた。「（仮設住宅の入居期限の）２年先まで構わんでおいたら、本当に住まれんようになってしまう」。災害ボランティアの力も借り、自宅で泥出しなどを進めた。乙石集落は犠牲者が集中した赤谷川の支流の乙石川沿いにある。今も集落の多くが土砂に埋まったままで、住民はちりぢりになった。井手さんは「小さな集落。みんな家族みたいな存在だった」と目を伏せる。集落への送電は約半月前、水道も数日前から使えるようになったばかりだ。３１日、井手さん一家３人は自宅の周りを掃除したり、神棚に供え物をしたりして新年の準備を進めた。集落には、井手さんの他にも家屋の修繕のために未舗装の道を上がってくる人たちがいる。「自分たちがここにいたら、みんなもホッとしてまた戻ってきてくれるんじゃないかと思う」豪雨前の昨年３月、母キクエさん（当時１０３歳）を亡くした。母がいない初めての正月。近所の人にもらった年越しそばを湯がいて仏壇に供え、語り掛けた。「母ちゃん、必ず戻ってくるけんね」。井手さんはそう誓って手を合わせた。【青木絵美、下原知広】"
"３０年以内発生確率「７０～８０％」に","2017年12月28日 19時17分","社会,科学・技術,気象・地震,速報,サイエンス","政府の地震調査委員会は、関東から九州・沖縄地方までの広い範囲で被害が想定される南海トラフ巨大地震について、来年１月時点での３０年以内の発生確率を現在の「７０％程度」から「７０～８０％」に引き上げることを決めた。調査委が来月１日を算定基準日として再計算した結果で、来月中旬に公表する。南海トラフ巨大地震はマグニチュード（Ｍ）８～９級と想定されており、発生確率は南海地震（１９４６年）を基準に、平均発生間隔を約９０年として算出している。地震は一定の周期で発生するとの前提で計算しているため、想定した地震が発生しなければ発生確率は時間の経過とともに増加する仕組みだ。地震調査委員長の平田直・東京大教授は「年が変わって急に地震が発生しやすくなるわけではないが、刻一刻と次の巨大地震が迫っている表れでもある。いつ起きてもいいように備えてほしい」と話している。【飯田和樹】"
"初の関連死認定　車中泊で体調悪化","2017年12月28日 11時48分","自然災害,福岡県,気象・地震,速報,社会","今年７月の九州北部豪雨で、福岡県朝倉市は、同市内に住んでいた男性（８０）を災害関連死と認定した。男性は被災後の車中泊で体調が悪化したという。九州北部豪雨で災害関連死が認定されるのは初めて。豪雨による犠牲者は４０人となった。認定は２７日付。市福祉事務所によると、豪雨当日の７月５日、男性は妻とともに市内の病院から帰る途中に豪雨に遭い、渋滞などで同市松末地区の自宅に帰れず、市内のスーパー駐車場で車中泊した。翌６日朝、体調が悪化し、市内の病院に緊急入院したが、同日中に死亡が確認された。死因は血液などがたまって心臓を圧迫する「心タンポナーデ」だった。男性の妻から市に災害弔慰金の申請があった。男性の住民票が市外にあったため、市は親族に問い合わせるなどして松末地区に居住実態があったことを確認。市は豪雨に伴う車中泊が体調悪化の原因だったと結論付けた。男性は元々持病があり、通院していた。災害関連死に認定されれば、遺族には災害弔慰金が支給される。九州北部豪雨では２８日現在、福岡、大分両県で死者が３９人で、朝倉市の２人が行方不明のままだ。昨年４月の熊本地震では１１月末時点、両県で災害関連死が２００人に上っている。【山下俊輔】"
"神奈川、埼玉で震度３　津波の心配なし","2017年12月27日 22時13分","社会,気象・地震,速報","２７日午後１０時５分ごろ、神奈川県、埼玉県で震度３の地震があった。気象庁によると、震源地は千葉県北西部で、震源の深さは約８０キロ、地震の規模を示すマグニチュード（Ｍ）は４．５と推定される。この地震による津波の心配はないという。各地の主な震度は次の通り。震度３＝横浜市港北区、保土ケ谷区、埼玉県草加市"
"ゆかた店コラボ　日田杉のげたで大分支援","2017年12月27日 18時42分","自然災害,話題,気象・地震,速報,社会","兵庫県豊岡市城崎町のゆかた店「いろは」が、７月の九州北部豪雨で被災した大分県日田市のげた職人らと協力し、日田杉のげた「ニノジ・ゲタン」の販売を始めた。品名は俳句「雪の朝　二のじ二のじの　下駄のあと」にちなむ。和装の縁で同店はげた産地の日田市と交流があり、「復興につなげたい」と商品化にこぎ着けた。杉の一枚板で耐久性が高く、鼻緒には丹後ちりめんを使う。価格は２万３６００円。問い合わせはいろは（０７９６・３２・０１６８）。関係者は「城崎と日田のご縁が続くよう鼻緒を結びました」。【柴崎達矢】"
"東海地方に雪　岐阜で積雪４センチ","2017年12月27日 11時59分","社会,気象・地震,速報","日本列島付近は強い冬型の気圧配置となり、東海地方の平野部でも２７日未明から朝にかけて雪が降った。岐阜市内では午前９時現在、積雪４センチを記録。名古屋駅付近では通勤・通学の時間帯に傘を差し、急ぎ足で歩く人たちが見られた。名古屋地方気象台などによると、２７日昼過ぎにかけて、東海地方には日本海から雪雲が流れ込む。２８日午前６時までの降雪量は愛知県の山地では多くて３センチ、三重県北部でも５センチと予想している。積雪や路面凍結などによるスリップへの注意を呼びかけている。【岡村恵子】"
