"title","date","tags","article"
"今週末、列島に近づく可能性","2017年10月16日 19時35分","自然災害,台風災害,気象・地震,速報,社会","１６日未明、西太平洋のカロリン諸島付近で台風２１号が発生した。気象庁によると、同日午後９時ごろには、フィリピンの東の海上を時速１５キロで西に進んでおり、衆院選が投開票される今週末にかけて日本列島に近づく可能性があるという。台風の中心気圧は９９４ヘクトパスカルで、中心付近の最大風速は２０メートル、最大瞬間風速は３０メートル。気象庁の担当者は「台風の進路はまだ定まっていないが、北上すると停滞している前線に湿った空気が流れ込み、風雨が強まる可能性もあるので注意してほしい」と呼びかけている。【金森崇之】"
"レベル３を維持　引き続き警戒呼び掛け","2017年10月16日 18時55分","自然災害,鹿児島県,気象・地震,速報,社会","宮崎と鹿児島県境の霧島連山・新燃岳（しんもえだけ）は１６日も噴火活動が続き、気象庁は噴火警戒レベル３（入山規制）を維持し、引き続き火口から３キロの範囲で大きな噴石と火砕流への警戒を呼び掛けている。福岡管区気象台によると、１６日の現地調査の結果、火山ガス（二酸化硫黄）の放出量は１日当たり５００トンで、１５日の１万１０００トンから大幅に減少した。しかし、気象台は「噴火活動によって増減を繰り返している。調査時に少なかっただけで、安心はできない」としている。また、火山性微動の振幅は次第に小さくなっているが、依然継続している。１６日未明には噴煙の高さが約６００メートルに上がったのが確認された。一方、九州大の調査で新燃岳の南西側斜面の数カ所で新たに噴気が上がっているのが確認されたという。新燃岳は１１日の噴火で噴火警戒レベルが２（火口周辺規制）から３に引き上げられた。さらに火山ガスの放出量が１万１０００トンに急増したことから１５日、警戒範囲が火口から２キロから３キロに拡大された。【山下俊輔】"
"時経ても君を忘れぬ　南阿蘇土砂崩れ現場","2017年10月16日 13時13分","熊本県,気象・地震,速報,社会","熊本地震の本震から１年半となった１６日、熊本県南阿蘇村立野の新所集落を襲った土砂崩れ現場では、地元の住民らが犠牲となった夫婦の冥福を祈り、花を手向けた。昨年４月１６日午前１時２５分に本震が起き、新所集落の上に位置する九州電力の水力発電所「黒川第１発電所」の貯水施設が決壊。推定約１万トンの水が流れだし、土砂崩れで片島信夫さん（当時６９歳）と妻利栄子さん（同６１歳）が亡くなった。新所区長の江藤俊雄さん（６７）と本震当時の区長、山内博史さん（６３）が、片島さん夫婦の自宅跡を訪ね、小さな石の祭壇に花をささげて黙とうした。江藤さんは「敷地に草が生えている光景を見ると月日のたつ早さを感じる。だが、地震を忘れることはできない。今日は２人に地区の復興状況を報告した」と話した。３５７世帯８７７人が住んでいた立野地区は、被災者生活支援法により長期避難地区に指定されているが、同村は指定解除を近く県に申請する。【杉山恵一】"
"火山ガス放出量が急増　続く入山規制","2017年10月16日 11時15分","自然災害,鹿児島県,気象・地震,速報,社会","宮崎と鹿児島県境の霧島連山・新燃岳では１６日も噴火活動が続き、気象庁は噴火警戒レベル３（入山規制）を維持したまま、引き続き火口から３キロの範囲で大きな噴石や火砕流への警戒を呼び掛けている。福岡管区気象台によると、監視カメラの映像で１６日未明に噴煙の高さは約６００メートルに上っているのが確認された。火山性微動の振幅は１５日に比べ小さくなっているものの、噴火活動は今後も活発化する恐れがある。風下側では火山灰だけではなく、風に流される小さな噴石や火山ガスにも注意するよう促している。１３日に１４００トンだった火山ガス放出量が１５日に１万１０００トンに急増し、気象庁は同日に警戒範囲を２キロから３キロに拡大。火山ガスが１万トンを超えるのは本格的なマグマ噴火が発生した２０１１年１月以来。噴火が続いており、両県は警戒を強めている。新燃岳東側に位置する宮崎県高原町では１５日夜に、住民の自主避難場所として町総合保健福祉センター「ほほえみ館」を開放した。１６日午前１１時時点では避難した住民はいない。同町は１５日夜と１６日朝に臨時課長会を開き、噴火に備えて対応を確認。高妻経信町長は記者会見で「人的被害がでないよう町民の生命財産を守ることを最優先に、防災に尽力する」と話した。３キロ圏内に霧島市がある鹿児島県は１５日、圏内を通る県道１０４号約６・８キロを通行止めにしたほか、三つの登山道を立ち入り禁止にした。また霧島市内では、同市の呼びかけを受けて国民宿舎など宿泊施設２軒で宿泊客と従業員計１１人が１５日夜に他の宿泊施設などへ避難した。【山下俊輔、重春次男、林壮一郎】"
"「爆発的噴火の恐れ」警戒範囲３キロに拡大","2017年10月15日 20時49分","自然災害,鹿児島県,気象・地震,速報,社会","噴火活動が続いている宮崎、鹿児島県境の霧島連山・新燃岳（しんもえだけ）について、気象庁は１５日午後７時、「火山ガスが急増し、爆発的噴火の恐れが出ている」として、火口から２キロの警戒範囲を同３キロに拡大した。噴石や火砕流への警戒を呼びかけている。噴火警戒レベルは３（入山規制）のまま。気象庁によると、１５日の現地調査で、火山ガス（二酸化硫黄）の放出量が１日当たり１万１０００トン（前回１３日調査時１４００トン）に急増したことが確認された。１万トンを超えるのは２０１１年１月の本格的なマグマ噴火時以来。火山性微動も継続しており、１５日午後からは振幅も大きくなっている。噴火時には、風下側で灰だけでなく小さな噴石が風に流されて降る恐れがあるほか、火山ガスにも注意が必要という。警戒範囲の拡大を受け、鹿児島県霧島市は、３キロ圏内にある宿泊施設２軒に対し、従業員と宿泊客を避難させるよう呼びかけた。人家はないという。同県は３キロ圏の県道約６．８キロを通行止めにした。新燃岳は１１年１月１９日に小規模噴火をした後、同２７日に爆発的噴火を起こした。同日の火山ガスの放出量は１日当たり約１万２０００トンだった。【中村敦茂、田中韻】"
"若者の感性　益城に　倉木麻衣さん迎えイベント","2017年10月15日 11時30分","熊本県,気象・地震,速報,社会","熊本地震で震度７の激震に２度見舞われた熊本県益城町で１４日、若者たちが町を盛り上げるためにできることを語り合う「未来トーーク」があり、ＩＴ技術を使った活性化の知恵を出し合った。若者の感性を復興に生かそうと町が開催。高校生から３０代までの３０人と、特別ゲストとして歌手の倉木麻衣さん（３４）が参加した。熊本県でＩＴ技術を使った地域活性化事業に取り組む予定の「日本ユニシス」の平岡昭良社長がＩＴ技術の具体例を紹介し、倉木さんは「歌を通じて応援する」と表明。五つのグループに分かれ、町の名所に行けばスマートフォンで被災前や未来の映像が見られるようにするなどのプロジェクト案をまとめた。インターネットを使ったカフェでの遠隔授業案をまとめた同県山都町出身の福岡県職員、大林紅葉（かえで）さん（２５）は「ＩＴ技術という要素を加えると発想の幅が広がる。来春には熊本県庁に転職して帰郷するので、実現に向けて取り組みたい」と語った。【福岡賢正】"
"孫と盆正月ゆっくりしたい　復興住宅心待ち","2017年10月15日 11時00分","熊本県,気象・地震,速報,社会","１４日で発生から１年半を迎えた熊本地震の被災地では、今も多くの被災者が仮設住宅やみなし仮設住宅で避難生活を送っている。１２日には政府の閣議決定を受けて熊本地震の仮設入居期限を１年延長する政令が施行されたが、熊本県内では仮設退去後の住まいとなる災害公営住宅（復興住宅）が依然として着工に至っていない。安堵（あんど）と不安が交錯する仮設で暮らす被災者たちは一日も早い暮らし再建を待ち望んでいる。熊本県西原村小森の仮設住宅に住む坂本チズルさん（７６）は１０年ほど前に夫を亡くしてからは村内で１人暮らしだったが、地震で自宅は半壊。しばらくは県内や福岡県に住む３人の息子の家に避難していたが、昨年７月に仮設住宅に入居した。地震前は盆や正月になると８人の孫が家に泊まりに来てにぎやかだったが、昨年と今年は孫たちは日帰りせざるを得なかった。仮設住宅は１ＤＫで孫たちと落ち着いて話せるスペースはない。エアコンはあるものの、壁が薄くて隣家の声が聞こえ、生活音で迷惑をかけないよう気を使う。熊本地震の被災者で仮設住宅やみなし仮設住宅に避難しているのは９月末現在で４万４９８６人。このうち西原村では仮設住宅に２８７世帯７６２人、みなし仮設住宅に１７２世帯４８４人が避難生活を続けている。村は復興住宅の建設予定戸数を仮申請があった５７戸としており、来年には本申請を受けて戸数を確定する予定。入居できるのは早くて来年夏ごろになるという。坂本さんは自宅を再建する経済的余力はなく、復興住宅への入居を希望している。仮設の入居期限は１年延長されたことで再来年６月以降になり、坂本さんは「スムーズに復興住宅に移り住みたい」と願う。いつかまた孫たちとの盆や正月を復興住宅で迎えられる日を心待ちにしている。【野呂賢治】"
"仮設退去「原則２年では困難」首長アンケート","2017年10月15日 08時30分","熊本県,気象・地震,速報,社会","熊本地震で住宅５０棟以上が全半壊した熊本県内２１市町村のうち被害が大きかった阿蘇市や益城（ましき）町など５市町の首長が、仮設住宅や民間賃貸住宅を借り上げた「みなし仮設住宅」での避難生活の解消まで「あと２年以上かかる」と考えていることが毎日新聞のアンケートで分かった。熊本地震の仮設入居期間は今月６日の閣議決定で１年延長されたため、１年半後の２０１９年４月以降に順次期限を迎えるが、今後さらに延長を求める自治体も出そうだ。熊本地震は１４日で発生から１年半を迎えた。県によると、住宅被害は、全壊８６４９棟▽半壊３万４２３５棟▽一部損壊１５万３８９８棟（１３日現在）。仮設住宅やみなし仮設住宅への避難者は９月末現在で４万４９８６人に上る。災害救助法は入居期限を原則２年以内と定めるが、政府は仮設退去後の住まいとなる災害公営住宅（復興住宅）の建設の遅れなどを理由に熊本地震の仮設入居期限の１年延長を閣議決定した。アンケートは８月に２１市町村にメール送信し、今月６日に回答が出そろった。仮設とみなし仮設について「（原則の）２年以内に避難解消できるか」と聞いたところ「できる」は２人。「難しい」は１９人に上り、地震発生から１年での同様アンケートの回答（１３人）より６人増え、この半年間で解消の見通しが厳しくなったことがうかがえた。「難しい」の１９人に必要な入居期間を聞くと「（回答時から）あと１年前後必要」が６人、仮設住宅入居からほぼ３年となる「１９年夏ごろまでかかる」が４人いて、これらの自治体は期間延長後の入居期限内での解消を目指す。一方で阿蘇市、益城、大津、玉東、氷川町の首長５人は「あと２年以上かかる」と回答。残る４人は「未定」などとした。また２１市町村のうち、１２市町村が復興住宅の建設を計画しているが、６市町村が用地確保の難しさなどを理由に「（建設が）想定より遅れている」と答えた。塩崎賢明・立命館大特別招聘（しょうへい）教授（都市計画）は「２年間で全員が新たな住まいを見つけるのは難しく、原則２年の入居期間自体が実態と合っていない。１年ごとの延長も被災者の心理的なストレスにつながる。国は期限を撤廃するか、もっと余裕のある期限を設定すべきだ」と指摘する。【中里顕、遠山和宏】"
"９０キロ離れた日向市など９市町村で降灰　再噴火","2017年10月14日 20時29分","自然災害,鹿児島県,宮崎県,気象・地震,速報,社会","１４日午前８時２３分、宮崎と鹿児島県境の霧島連山・新燃岳（しんもえだけ＝１４２１メートル）が再噴火し、噴煙が一時、火口から約２３００メートルまで上がった。気象庁は１３日に火山性微動の振幅が小さくなったなどとして「連続噴火は停止したと思われる」と発表していた。噴火警戒レベルは３（入山規制）のままで、気象庁は今後も噴火を繰り返す可能性があるとして警戒を呼びかけている。気象庁によると、１４日午前８時２３分に再開した噴火は午後２時２０分に一旦停止したが、午後３時５分に再噴火して噴煙は火口から約１０００メートルまで上がった。その後も火山性微動は続いており、降灰は火口から約９０キロ離れた宮崎県日向市など９市町村で確認された。宮崎県高原町では火山灰が降ったり、積もった灰が風で舞い上がったりするため、屋外に洗濯物が干せない状況が続く。コインランドリーには１４日も洗濯物を抱えた住民が次々に訪れて乾燥機で衣類を乾かした。看護師の女性（５９）は「室内では乾きにくいので自宅で洗って乾かしに来ている。早く噴火がおさまってほしい」。自営業の女性（６１）は「噴火が止まったと聞いてホッとしていたら再噴火して驚いた。大きな噴火があるのではと不安で落ち着かない。早く静まってほしい」と顔を曇らせた。【下原知広、重春次男】"
"古里への思い込め「最後のナシ」ケーキ","2017年10月14日 17時15分","自然災害,東日本大震災,食,気象・地震,速報,ライフ,社会","福島第１原発事故で福島県大熊町から避難し、千葉県香取市でナシを栽培していた関本信行さんの「最後のナシ」を使ったケーキが１５日、福島県広野町で開かれる国際フォーラムの会場で販売される。ナシが特産品だった大熊町は今も全町避難が続く。関本さんは「どこで作ってもうちのナシは大熊産」と古里の味を守り続けてきたが、８月に５５歳で病気で亡くなった。知らせを聞いた福島県立ふたば未来学園高（広野町）の生徒が関本さんのナシを譲り受け、果肉入りケーキに仕立てた。ポスターには「あなたの思い出に残りたい」の文字。高校生たちが、関本さんの古里への思いをくるんで販売する。【乾達】"
"１年半で追悼　ブロック塀の下敷き事故現場","2017年10月14日 10時50分","自然災害,気象・地震,速報,社会","昨年４月の熊本地震の発生から１４日で１年半になった。熊本市東区の坂本龍也さん（当時２９歳）が１４日の前震で倒壊したブロック塀の下敷きになって死亡した熊本県益城（ましき）町の事故現場には、坂本さんをしのんで花を供える人の姿があった。被災時に一緒に下敷きになり、左脚の骨折による後遺症がある益城町の本村春子さん（５８）。坂本さんは本村さんが勤めていた弁当店の店長だった。ブロック塀は本村さん宅と隣の病院の境界にあった。「暗闇の中、あっという間にブロック塀が落ちてきた。真横にいた店長のおかげで隙間（すきま）ができたが、店長がいなければ私は生きていなかったと思う」と涙ながらに話した。本村さんと坂本さんの母（６０）は、約２メートルの高さの擁壁上に立てられたブロック塀について「危険な工作物であり、小規模な揺れでも倒壊することが予想できた」として、ブロック塀の所有者だった社会医療法人理事長を近く過失致死傷容疑で県警に告訴する意向。本村さんは「病院からは何の謝罪も説明もない。今後同じような事態が発生しないためにも責任の所在をはっきりさせたい」と話し、ビールと花を供えて手を合わせた。熊本県のまとめによると、県内の住宅被害は全壊８６４９棟▽半壊３万４２３５棟▽一部損壊１５万３８９８棟（１３日現在）。仮設住宅や民間賃貸住宅を借り上げた「みなし仮設住宅」への避難者は４万４９８６人（９月末現在）。【野呂賢治】"
"新燃岳が再噴火　噴煙２３００ｍ","2017年10月14日 10時34分","自然災害,気象・地震,速報,社会","１４日午前８時２３分、宮崎と鹿児島県境の霧島連山・新燃岳（しんもえだけ、１４２１メートル）が再噴火した。噴煙は火口から約２３００メートルまで上がり、６年ぶりに噴火した１１日以降で最も高くなった。噴石や負傷者は確認されていない。気象庁は宮崎県小林市、鹿児島県霧島市で視界不良となる多量の灰が降ると予想している。新燃岳は１１日の噴火で噴火警戒レベルが２（火口周辺規制）から３（入山規制）に引き上げられ、気象庁が火口から半径約２キロ内で噴石や火砕流への警戒を呼びかけている。気象庁は１３日、火山性微動が小さくなったことなどから「連続噴火は停止したと思われる」と発表していた。【蓬田正志】"
"塀倒壊で下敷き死　遺族、所有者を刑事告訴へ","2017年10月14日 07時00分","自然災害,宮城県,熊本県,東京都,速報,社会,気象・地震,事件・事故・裁判","昨年４月の熊本地震で、倒壊したブロック塀の下敷きになり死亡した熊本市東区の坂本龍也さん（当時２９歳）の遺族が、塀の所有者だった熊本県益城（ましき）町の社会医療法人理事長を過失致死容疑で熊本県警に告訴する方針を固めた。月内にも告訴する。熊本地震は１４日で発生から１年半となるが、倒壊した工作物を巡って刑事責任を問うケースは初めて。遺族代理人の今村一彦弁護士は「ブロック塀は基礎工事がされておらず、倒壊が予見できた」と主張する。告訴状などによると、坂本さんは前震があった昨年４月１４日夜、益城町内にある職場の同僚宅敷地内にいた。隣の病院との境界には、病院が高さ約２メートルのコンクリート擁壁の上に長さ約１５・６メートル、高さ約２メートルのブロック塀を設置。そのブロック塀が崩れて下にいた坂本さんが死亡した。同僚の本村春子さん（５８）も下敷きとなって左脚を粉砕骨折しており、告訴する意向。ブロック塀を含むコンクリート建造物の耐震基準は、１９７８年の宮城県沖地震を受けて８１年に「震度６強～７程度の大地震でも倒壊しない」強さにするよう定められた。日本建築学会は、高さ１メートル以上の擁壁の上にブロック塀を設置する場合は、高さ１・２メートル以下を推奨している。病院側の説明や謝罪はないといい、坂本さんの母（６０）は「息子の人生はこれからだった。ブロック塀の耐震化をよりしっかりして、悲しい思いをする遺族がでないようにしてほしい」と話す。社会医療法人は「ご冥福をお祈りする。大災害の中での事故という認識で、説明ができなかったのは情報が不足していたからだ」と話している。東日本大震災では東京都内の駐車場スロープが崩落して８人が死傷した事故があり、構造設計担当者ら４人が書類送検され、うち１人が業務上過失致死傷罪で在宅起訴された。１審は有罪だったが、控訴審は「担当者としての義務は尽くされている」として逆転無罪となり確定した。【野呂賢治】"
"噴煙一時７００メートル　火山活動強まる恐れも","2017年10月11日 19時17分","自然災害,気象・地震,速報,社会","１１日午前５時３４分、宮崎、鹿児島県境の霧島連山・新燃岳（しんもえだけ）（１４２１メートル）が２０１１年９月７日以来約６年ぶりに噴火し、気象庁が４年ぶりに噴火警戒レベルを２（火口周辺規制）から３（入山規制）に引き上げた。噴火後も火山性微動や山体膨張が継続しているため、火山活動がさらに活発になる可能性があるという。気象庁によると、噴煙は一時、火口から高さ約７００メートルまで上がった。噴石の飛散は確認されていないが、東側の宮崎市や宮崎県都城市、小林市、高原町で降灰があった。人的被害の情報は入っていない。気象庁は火口から２キロの範囲で大きな噴石の飛散や火砕流に警戒するよう呼びかけている。午後６時現在も小規模な噴火が続いている。気象庁は「風下側は火山灰だけではなく、小さな噴石が風に流され飛んでくることもある」と注意を促している。新燃岳は１１年１月２６日、約３００年ぶりの本格的なマグマ噴火が観測された。その１週間前の１９日には小規模噴火が起きていた。気象庁は噴火警戒レベルを３に引き上げ、１３年１０月まで継続した。その後、火山活動が低下したとして、今年５月に７年ぶりにレベル１（活火山であることに留意）に引き下げたが、９月２３日ごろから火山性地震が増加。このため今月５日、再びレベル２に引き上げていた。【遠山和宏、山下俊輔】"
