"title","date","tags","article"
"「釣り記事」対策着手　読者行動パターンで判別","2017年4月28日 19時33分","デジタル,スタートアップ,話題,速報,ライフ,社会","ニュースアプリを運営するグノシー（東京都港区）は２８日、大げさな見出しで読者を引きつけるなどの「クリックベイト（釣り記事）」対策に乗り出したと発表した。見出しをクリックした後、記事本文を読んだ読者の行動パターンから「釣り記事」か否かの判別を試みる、利用者の行動ベースの技術的アプローチとなっている。グノシー社の共同創業者・関喜史氏が同日、「釣り記事」排除に向けた対策の現状と目指している方向性について、報道陣に詳細を説明した。釣り記事とは、記事本体はさして読者を引きつける内容ではないのに、ウェブの検索結果やアプリ画面で、見出しやサムネイル画像を大げさに表示したりするもの。記事がユーザーの関心ある内容と誤解させることを狙うものもある。ネットメディアのウェブでの収益は、記事の閲覧数（ＰＶ）が大きく影響する広告収入に依存していることが多いため、「釣り」問題が生じている。グノシーは、新聞社、通信社、雑誌社、ウェブメディアなど６００を超えるメディアから記事の提供を受け、自社のＡＩ（人工知能）に基づく独自アルゴリズム（記事の重要度から表示順序などを決める仕組み）によって、アプリに掲載する記事を選択している。しかし、現状ではアプリに「釣り記事」的なコンテンツが表示されることもあり、読者の満足感を損ねないため、釣り記事を表示させないアルゴリズムの研究に乗り出したという。対策としては、見出しやサムネイル画像と、それを読者がクリックして読む記事本体の中身の客観的な「差異」に着目し、その程度が大きいモノを「釣り」と判断して表示順位を落とすなどの方法も考えられる。しかし、関氏は、タイトルやサムネイル写真と記事本体の内容を比較して、釣り記事か否かを判断することは技術的に難しいと指摘。グノシーでは「釣り記事かどうかは、それを読んだユーザーの行動で決めるべきだ」との考えのもと、実際に記事を読んだ読者の滞在時間やスクロール速度、ＳＮＳ（ソーシャル・ネットワーキング・サービス）での拡散ぶりなどから、総合的に「釣り記事」を判別するアプローチを採用していることを明らかにした。ただし、例えば、グノシーが重視する滞在時間ひとつをとっても、ユーザーが記事のページにとどまる理由はさまざまだ。単に滞在時間が短いだけで「釣り記事」要素が大きいとは言えないだろう。グノシーは、これまで、滞在時間が一定時間未満だった記事について「ユーザーは不快に感じた」と判断し、表示されにくくするテストを行ったが、満足度が逆に下がったユーザーも一部にいたという。このため、同社は、記事を読んだユーザーの満足度について、いくつかの選択肢から報告できる機能もテスト。例えば、この選択肢の中に「だまされたと感じる」などを含めれば「釣り記事」と判断しやすくなる可能性があるという。このフィードバック機能は、今年６月をめどに本格導入を目指している。「釣り記事」をなくすには、自社で記事を作成しているメディアでは、記者や見出しを付ける編集者がルールをしっかり守るのが一番効果的だ。また、グノシーのように他メディアから記事の配信を受けているサービスでも、テクノロジーではなく、編集者が危うそうな見出しや画像の付いた記事は内容を確認し、適切でなければはじくことも考えられる。だが、関氏は「リテラシーのある編集者を育成し、（チェックのために）２４時間（業務に）はりつけるのは難しい」と指摘。グノシーが設立当初から、編集者の目ではなく、記事の滞在時間や読了率などのデータに基づいて読まれる記事を表示することを志向してきたため、「人力」で釣り記事を判別する仕組みの導入には否定的な考えを示した。【尾村洋介／統合デジタル取材センター】"
"ＡＩ技術者を１０００人養成へ","2017年4月19日 20時54分","経済,スタートアップ,めっちゃ関西,最新の経済ニュース,企業・産業,速報","パナソニックは１９日、５年間で１０００人規模の人工知能（ＡＩ）関連の技術者を養成すると発表した。社内に新組織を設けて、ＡＩや、あらゆるものがインターネットにつながるＩｏＴを使った新規事業の創出に力を入れる。技術者は、パナソニックが昨年、大阪大に設けたＡＩの講座を受講させ養成する。今春入社組からはＡＩの特別枠も設けた。今年度新設した新組織はビジネスイノベーション本部で、社内ベンチャーの育成にも取り組む。副本部長には独ソフトウエア大手幹部から移籍した馬場渉氏が就いた。馬場氏は米シリコンバレーを拠点に活動し「ベンチャー企業などの知り合いも多い。（有望な企業への投資などの）橋渡しもしたい」と語った。ビジネスイノベーション本部の宮部義幸本部長は「（パナソニックは）規模が大きくなり、やや創業意欲が希薄になった。次の１００年に、創業意欲を持った人をたくさん育成する必要がある」と述べた。【釣田祐喜】"
"福岡空港で手荷物搬送ロボ実験","2017年4月19日 20時24分","経済,スタートアップ,最新の経済ニュース,企業・産業,速報","日本航空は１９日、福岡空港で人工知能（ＡＩ）を搭載した自動搬送ロボットを活用して乗客の手荷物を運ぶ実証実験を報道陣に公開した。利用対象は支援が必要な車椅子利用者やベビーカーを使う客など。実験は１７日から始めており、２８日まで効果や課題を検証し、将来的な導入を目指す。ロボットはオムロンが今年２月に発売した工場内で使う部品搬送用。二輪駆動で、箱のような形（長さ約８０センチ、幅約５０センチ、高さ約４０センチ）をしている。最大６０キロ積載でき、センサーで障害物を避けながら効率的なルートを考えて人の歩く程度のスピードで走行する。利用者には地上スタッフも付き添い、到着ロビーの手荷物受取場で荷物をロボットに載せて最寄りの空港ビル出口まで搬送する。通常は地上スタッフが車椅子を押しながら荷物も運んでおり、ロボットを活用できれば負担を軽減できる。日航によると、福岡空港は１日当たり車椅子利用客が約１０人、ベビーカー利用客は１便当たり２～４人。高齢化もあり、車椅子の利用客は増加傾向だという。同社は「安全で快適な旅を楽しんでもらう新たなサービスにしたい」と話している。【石田宗久】"
"開幕　ＳＵＶ中心に最新モデル競う","2017年4月19日 10時35分","中国,スタートアップ,最新の経済ニュース,企業・産業,速報,経済","【上海・赤間清広】中国最大級の自動車見本市、上海国際自動車ショーが１９日、開幕した。中国の２０１６年の新車販売台数は約２８００万台と世界トップを独走する。特に中国市場で人気が高いスポーツタイプ多目的車（ＳＵＶ）を中心に、各メーカーが最新モデルを出展した。２８日まで。１８カ国・地域から自動車、部品メーカーなど１０００社以上が参加。世界初公開となる１１３台を含め、ニューモデル約１４００台が最先端の技術とデザインを競っている。日本勢では、トヨタ自動車が高級ブランド「レクサス」で展開するＳＵＶ「ＮＸ」のマイナーチェンジモデルを世界初公開した。日産自動車はピックアップトラック「ナバラ」、マツダは新型コンパクトＳＵＶ「ＣＸ－３」をそれぞれ中国初公開するなど、中国市場攻略に向けた戦略モデルを投入した。中国で急速に普及が進む電気自動車（ＥＶ）、プラグインハイブリッド車（ＰＨＶ）など「新エネルギー車」の出展も目立ち、ホンダは運転手の感情を理解する人工知能（ＡＩ）を搭載したコンセプトＥＶ「ＮｅｕＶ（ニューヴィー）」を中国で初公開し、自動運転も可能な次世代技術をアピールした。"
"自動運転車開発が明るみに　加州で公道試験へ","2017年4月15日 10時48分","アメリカ,スタートアップ,最新の経済ニュース,企業・産業,速報,経済","【ワシントン清水憲司】米アップルが米西部カリフォルニア州政府から自動運転車の公道試験に必要な認可を得たことが１４日、州当局の公表資料で分かった。アップルは自動運転車開発を公式には認めておらず、開発状況は秘密のベールに包まれている。今回の認可で公道試験の段階まで開発が進んでいることが判明した。米メディアによると、車両はトヨタ自動車の高級ブランド「レクサス」のスポーツタイプ多目的車（ＳＵＶ）をベースにし、監視役の運転手が同乗する形で試験を実施する。アップルは数年前に「タイタン」と呼ばれる秘密の開発チームをつくったとされる。昨年１１月、連邦交通規制当局に宛てた書簡で「運送の自動化」に関心があることは公になっていた。今後は試験の様子が多くの人の目に触れ、州当局に事故報告なども行う必要があるため、次第に実態が明らかになりそうだ。自動運転車開発は、米グーグルが先行する形で、主要自動車メーカーとしのぎを削っている。アップルの同州での認可取得は３０社目。ただ、アップルが自前で車両開発まで手がけるか、人工知能など自動運転に必要なソフトウエアの提供にとどめるかは明らかになっていない。"
"AIが可能にする新時代の営業スタイル――営業支援ツール・Sensesは「いつメールを送るべきか？」まで教えてくれる（GetNavi web）","2017年4月14日 11時00分","スタートアップ",""
"ＥＶのコンセプトカー開発　ＧＬＭと共同","2017年4月13日 20時52分","経済,スタートアップ,最新の経済ニュース,企業・産業,速報","旭化成は１３日、電気自動車（ＥＶ）のベンチャー企業「ＧＬＭ」（京都市）と共同で、旭化成の自動車関連部材を搭載したＥＶのコンセプトカーを開発していると発表した。５月２４～２６日に横浜市で開かれる展示会で披露して、ＥＶ関連市場に売り込む。旭化成は、プラスチックやゴム、人工皮革といった部材を自動車部品メーカーに納入している。コンセプトカーは、こうした部材を多く使っており、技術力をアピールすると共に企業イメージを高める狙いもある。ＧＬＭは、京都大の大学院生だった小間裕康さん（３９）が２０１０年に設立。１５年からＥＶスポーツカー「トミーカイラＺＺ」を生産している。コンセプトカーはトミーカイラＺＺの車体をベースとしており、旭化成は「実際に走行も可能。プロモーションに活用し、事業拡大につなげたい」としている。【釣田祐喜】"
"遠隔操作公道実験へ基準　クリアなら警察庁許可","2017年4月13日 11時10分","社会,スタートアップ,話題,速報","警察庁は１３日、遠隔操作で走る自動運転車について、新たに定めた道路使用許可の審査基準を満たせば公道での実証実験を許可することを明らかにした。無人の車が公道を走るのは初めてとなる。政府は地域の人手不足や移動弱者を解消するため、東京五輪・パラリンピックが開催される２０２０年までに、運転手が乗車しない自動走行の実現を目標に掲げている。警察が公道での実験を認めることで、実用化に向けた動きが加速しそうだ。警察庁は審査基準の内容について、１４日から来月７日まで国民から意見を募り、その結果を踏まえ正式決定する。その後、各都道府県の公安委員会規則を改正し、今年夏には実験走行の申請が可能になる見通しで、最長６カ月間の実験を認める。審査基準では、車を遠隔操作する人を「道路交通法上の運転者」と位置づけ、同法に課せられた義務を負うとした。運転免許がなければ遠隔操作はできず、車内にも免許の写しを置くことを求めた。その上で、遠隔操作する「操作者」には、緊急時に車両を停止させられることや、モニター画面などで通常の車の運転者と同程度に周囲の状況を把握できるようにすることも求めている。車が制御不能になった場合などを想定し、あらかじめ安全対策を策定することも要求している。また、１台ずつの申請が必要だが、１人の操作者が複数の車を遠隔操作することも認めた。操作者は複数のモニターを監視しながら、同時に複数の車を走らせることが可能になる。事故があった場合、操作者に過失があれば道路交通法の責任を負う。遠隔操作システムに不備があることが分かれば、一般車の事故と同様に、開発者に責任が及ぶ可能性がある。警察庁は「事故責任のあり方は、通常の事故の扱いと同じになる」と説明している。審査にあたっては、実験走行する区間で警察官が同乗し、安全に遠隔操作できるか事前に確認する。日本が加盟する道路交通に関するジュネーブ条約は、「車両には運転者がいなければならない」と定めている。しかし、１６年３月に開かれた国際連合欧州経済委員会の作業部会で、走行実験であれば無人車を認めるとの見解が示されたため、遠隔操作が可能になった。【川上晃弘】カメラやセンサーで周囲の状況を把握し、人工知能などを駆使して、適切なアクセル、ハンドル、ブレーキの操作を行う。日本政府の定義では、自動化の度合いに応じ、三つの操作のうちどれかを自動化した「レベル１」▽複数を行う「レベル２」▽三つの操作を自動で行いながらも必要な時は運転手が関与する「レベル３」▽乗る人が運転に全く関与しない「レベル４」がある。警察庁は今回の遠隔操作による公道実験は「レベル２」に当たると説明している。日本政府は２０２０年代に「レベル３」の実用化、２０年代後半以降に「レベル４」の試用を目指す。"
"「リアルに再現」阪大グループ開発","2017年4月4日 20時24分","動画配信記事,社会,毎日動画,科学・技術,話題,速報,スタートアップ,サイエンス","大阪大の大須賀公一教授（制御工学）らの研究グループが、本物のムカデのように地面をはい回るロボットを開発した。人工知能（ＡＩ）などの高度な技術を一切使っておらず、「シンプルな構造でも、生き物の動きをリアルに再現できることを示せた」と自賛している。ロボットは全長１．３メートル。ミニ四駆用の市販のモーター６個を動力源に、３２本の足を動かして進む。コンピューターやセンサーは使っていないため、障害物を察知したり、進むべき進路を判断したりすることはできない。ところが、雑木林に解き放つと、目の前に現れた地面の凹凸や石などの形に合わせて、１６の体節に分かれた柔軟な体をくねらせて乗り越えていく。この様子が本物のムカデのように見える。大須賀教授は「ムカデ型ロボットが本物っぽく見えるのは、自然にある障害物のおかげだ。生き物の動きは周りの環境があって初めて生き生きと見えるのではないか」と話す。【大久保昂】"
"金魚をタブレットで誘導!? 国際スタートアップイベント「Slush Tokyo 2017」でデジタルライターが驚いた！（GetNavi web）","2017年4月2日 20時02分","ライフ,スタートアップ",""
"全国初、ロボット英語授業　学生評価も　神戸学院大","2017年3月30日 19時00分","社会,スタートアップ,速報,教育","神戸学院大（神戸市）は４月から、グローバル・コミュニケーション学部の英語コースで、人工知能（ＡＩ）を搭載したロボット「Ｍｕｓｉｏ（ミュージオ）」を使った実験授業を始める。米ＡＫＡ社が英会話学習用に開発。話し掛けるとインターネット上の知識を駆使して返答し、学生の能力評価に役立つ優れもの。大学の授業への導入は全国初という。３０日に試用した１年の川口桃香さん（１９）は「外国人と話す時は聞き返されるだけで緊張するが、ロボットは話しやすい」と会話を楽しんだ様子。物おじしないぶん、上達も早い？【松本杏】"
"一力七段、ソフトに２連敗　第５回電聖戦","2017年3月26日 18時26分","社会,スタートアップ,速報,カルチャー","囲碁ソフトと棋士が対局する第５回電聖戦（電気通信大エンターテイメントと認知科学研究ステーション主催）が２６日、東京都内で打たれ、一力遼七段（１９）が２局とも敗れた。１８、１９両日開催のＵＥＣ杯コンピュータ囲碁大会で優勝した中国ＩＴ大手、騰訊（テンセント）が開発した「絶芸」、準優勝した日本の「ＤｅｅｐＺｅｎＧｏ」と、それぞれ持ち時間１時間、３０分の早碁で対局した。前回までソフトが石を置くハンディをもらい棋士と対局していたが、人工知能（ＡＩ）に革新をもたらした深層学習の導入で急激に実力が向上。今回はハンディなしで行われた。一力は竜星戦優勝などの実績を持ち、本因坊文裕（井山裕太九段）を追う若手の筆頭格で、国際棋戦でも活躍するトップ棋士。電聖戦は、ハンディなしで棋士と戦うという目標の一つが達成されたとして、今回で終了する。一力は「二つのＡＩとも、トッププロとほとんど同じくらいの実力。今後どんどん強いＡＩが出てくると思う。いろいろな新しい考え方を吸収できれば」と語った。【最上聡】"
"ついに登場した全自動洗濯物たたみマシン「ランドロイド」とは？（GetNavi web）","2017年3月26日 15時00分","ライフ,スタートアップ,企業・産業",""
"介護者に代わり異変検知　”見守り”３Ｄカメラ開発","2017年3月25日 10時00分","介護・福祉,東京都,ライフスタイル,速報,ライフ,スタートアップ,経済,すべて表示する","人工知能（ＡＩ）を用いて、介護が必要な高齢者らの異変を検知するカメラを、ベンチャーのアースアイズ（東京都中央区）が開発した。転倒などの「いつもと違う動き」をＡＩが判断し、家族らのスマートフォンに通知する仕組みで、開発者は「見守りで２４時間気が抜けない家族らの負担を減らせる」と意義を語る。社名と同名のカメラ「アースアイズ」は、高さ１４センチ、幅１９センチ、重さ８７６グラム。設置位置から半径８メートルの撮影範囲内の異変を検知する。予定価格は本体９万８０００円（税別）、月額使用料は介護サービス法人向けで２３５０円。家庭用は今夏発売予定。カメラ搭載のＡＩは、歩いていた人が突然しゃがんだり、一定時間動かなかったりすると「異変」と判断して、事前に設定した人のスマホに通知する。カメラに搭載したスピーカーから自動音声で「大丈夫ですか」と問いかけることもできる。しゃがんだ後に動けば「異変ではない」と判断する。最大の特徴は、映像を立体的に把握できることだ。通常のカメラの映像は赤、緑、青（ＲＧＢ）の画素を並べて二次元で表現する。これに加えアースアイズは奥行きを把握する３Ｄ（三次元）センサーを搭載しているので、人物の重なりや物体の移動などをＡＩが判断できる。アースアイズはこのほか、悲鳴など「異常な音」も検知でき、防犯用として店舗や住宅、工場での利用も想定している。つきまといや万引き常習者の写真をカメラに認識させれば、接近をスマホに通知したり、「何かご用ですか」といった音声をカメラから流したりすることも可能という。同社の山内三郎社長（５１）は「人間は何が異変かを五感で総合判断する。『目』『耳』の他、ガス漏れなどのにおいを検知する『鼻』機能を持たせる予定だ」と話している。【中野彩子】"
"井山、ＡＩにも負ける　韓国の朴九段が優勝","2017年3月23日 19時50分","囲碁,韓国,中国,速報,カルチャー,社会,スタートアップ,話題","日中韓３カ国のトップ棋士とＡＩ（人工知能）ソフトの４者が争う囲碁の世界戦「ワールド碁チャンピオンシップ」は３日目の２３日、大阪市北区の日本棋院関西総本部で第３局２試合があった。連勝同士の対戦となった韓国の朴廷桓（パク・ジョンファン）九段（２４）対中国の羋※廷（み・いくてい）九段（２１）戦は、朴が１９０手で白番中押し勝ちし、３戦全勝で優勝した。羋は２勝１敗で準優勝。一方、本因坊文裕（もんゆう）（２７）＝井山裕太九段＝と「ＤｅｅｐＺｅｎＧｏ」の対戦はＺｅｎが２３５手で黒番中押し勝ちした。Ｚｅｎは１勝２敗で３位、井山は３戦全敗で４位に終わった。井山は「負けた碁もチャンスはあったが生かし切れなかった。今回の経験を生かして、次の世界戦も頑張りたい」、Ｚｅｎ開発チーム代表の加藤英樹さんは「短時間で強くなり、自信になった」と話した。優勝した朴は「Ｚｅｎが一番苦戦した。ＡＩと人間が一緒に戦えるのはあと５年ぐらいだろう」とＡＩの進化を認めていた。【新土居仁昌】※は「日」の下に「立」"
"井山とＡＩ連敗、優勝消える","2017年3月22日 20時41分","囲碁,スタートアップ,速報,カルチャー,社会","日中韓３カ国のトップ棋士とＡＩ（人工知能）ソフトの４者が争う囲碁の世界戦「ワールド碁チャンピオンシップ」は２日目の２２日、大阪市北区の日本棋院関西総本部で第２局２試合があり、中国の羋※廷（み・いくてい）九段（２１）が本因坊文裕（もんゆう）（２７）＝井山裕太九段＝に２８４手で白番２目半勝ちし、韓国の朴廷桓（パク・ジョンファン）九段（２４）が「ＤｅｅｐＺｅｎＧｏ」に３４７手で黒番中押し勝ちした。（※は日の下に立）この結果、羋と朴が２勝０敗、井山とＺｅｎが０勝２敗となり、井山とＺｅｎの優勝はなくなった。井山もＺｅｎもリードした場面があったが逆転負け。井山は「２日間、ベストを尽くしたが、力が及ばなかった」、Ｚｅｎ開発チーム代表の加藤英樹さんは「（終盤の）学習不足です」と話した。２３日は羋と朴が優勝をかけて戦い、井山はＺｅｎと初めて対戦する。【新土居仁昌】※は「日」の下に「立」"
