"title","date","tags","article"
"開発者らが語る思い出と次のゲーム","2016年11月4日 18時10分","東京都,スタートアップ,話題,速報,社会","旧ソ連（現ロシア）発祥で、今も世界的な人気を誇るパズルゲーム「テトリス」。開発者のアレクセイ・パジトノフさん（６１）がこのほど来日し、「ザ・テトリス・カンパニー」を創業しテトリスの権利をパジトノフさんと共同所有するヘンク・ブラウアー・ロジャースさん（６２）とともに、毎日新聞の取材に応じた。２人は、ゲーム制作時の思い出や、最新のテクノロジーを使った新たなテトリスの展望について語った。【大村健一／デジタル報道センター】テトリスは画面の上から落ちてくる四つの正方形を組み合わせた「テトリミノ」と呼ばれるブロックを並べ、横の列をそろえるとブロックが消えるゲーム。７日まで明治神宮外苑（東京都新宿区）で開催中の「東京デザインウィーク２０１６」で、「新たなテトリス」をテーマに、日本の伝統工芸や現代アートとテトリミノを融合させた作品や商品が展示されており、パジトノフさんは、それを受けて約１２年ぶりに来日した。「日本のものづくりは、細部までこだわっている。テトリスのグッズはシンプルだけど、すごくこだわって作られていたし、これからも楽しみ」「テトリミノ」の形の氷が作れる製氷器や、木工のタイピンやカフスボタンなどが会場限定で販売されている。他のゲームのようにキャラクターがいないため、グッズは「テトリミノ」が主役。それでも一目で伝わる点が「テトリスの最大の強み」と胸を張った。テトリスは１９８４年６月、ソ連の連邦科学アカデミーでプログラマーとして人工知能や自動音声認識に取り組んでいたパジトノフさんが、仕事の一環ではなく、趣味として開発した。「元々、パズルが大好きで、自分のためのコンピューターを手に入れた時、個人で楽しむために作ったゲームの一つがテトリスでした。参考にしたのは『ペントミノ』というパズルです。五つの正方形で作ったさまざまな形のブロックを組み合わせて長方形の箱に収めるパズルですが、五つの正方形の組み合わせだとブロックの種類が多くなります。そこで、テトリスでは四つにし、横一列がそろうと消滅する仕組みを加えました。テトリスの語源はギリシャ語の４（テトラ）です」できあがったゲームは、まだ対戦機能などはなかったものの、パジトノフさん自身が「プレーをやめられない」ほど夢中になり、周囲に知られるようになった。しかし、すぐに世界に広がったわけではない。当時、社会主義国家だったソ連にソフトウエアの市場が無かったからだ。口コミの評判で、プログラムが徐々にコピーされる形で、ゆっくりと東欧など国外にも広がった。その後、製造、販売のライセンスを巡る二転三転もあった。ライセンス管理はソ連当局の外国貿易協会（ＥＬＯＲＧ）が窓口となり、ハンガリーの会社が権利を得て、その権利がさまざまなゲーム会社を経由しつつ、世界各国で販売されていた。日本でもゲームセンターで使われるようなゲーム機（アーケードゲーム）は既に普及していた。しかし、ＥＬＯＲＧが与えた元々のライセンスの中の「コンピューター」に、一般的な「パソコン」は含まれていないことが後に判明。米国のゲーム展示会で見つけた「テトリス」に早くから目を付け、当時は日本でゲームソフト会社「ＢＰＳ」（０１年に解散）を経営していたロジャースさんは「社会主義国家のソ連に『パーソナル（個人の）』という考え方はなく、実際に認められていたのは（当時代表的だった）ＩＢＭパソコン互換機のみだった。それを多くの会社が勘違いした」と話した。当然、アーケードゲームや家庭用ゲーム機向けのライセンスもソ連当局は認めていなかった。ロジャースさんが中心となってＥＬＯＲＧと直接交渉し、任天堂にゲーム機向けに正式なライセンスが認められたのは１９８９年３月。当時発売したばかりの任天堂の携帯型ゲーム機「ゲームボーイ」用のソフトが同年６月に販売され、世界累計で３５００万本を超える大ヒットを記録。現在、携帯電話、スマートフォンなどのモバイルゲームは有料のものだけで世界中で５億回以上のダウンロード数を記録している。パジトノフさんはその後、米国に移住し、マイクロソフト社でゲームデザインを手がけた。現在はシアトルに住み、「自分の生活を楽しむことがメイン」としつつ、テトリスの新展開などでロジャースさんの相談に乗り、テトリスのブランド価値をさらに高めることにも力を注いでいる。現在、ゲーム業界でソニーの「プレイステーションＶＲ」などのＶＲ（仮想現実）や、ＡＲ（拡張現実）を駆使した「ポケモンＧＯ」が世界で流行する中、シンプルなパズルゲームのテトリスはどのような将来を描いているのか。ロジャースさんはテトリスの今後について、こう話した。「これまでテトリスは、あらゆるデバイスでさまざまな形で流通してきた。スクリーンさえあれば、テトリスはそこにある。どんなに新しいバージョンになっても、世界中で言葉を超えて楽しめるものにする。テクノロジーは進歩しても、チェスや囲碁のように、ゲーム自体は続いていくだろう。詳しくはこれからだが、ＶＲについても原型はできているので、楽しみにしてほしい」将来的には、コンピューターゲームをスポーツとして捉える「ｅ－ｓｐｏｒｔｓ」の競技としていくことも視野に入れている。また、公開時期など詳細は未定だが、映画の制作も発表しており、パズルゲームをどのように映画に落とし込むのか、ファンの間で話題となっている。"
"人工知能が記事書いた！　過去の数万文基に","2016年11月1日 22時28分","社会,スタートアップ,話題,速報","日刊紙を発行する中部経済新聞社（名古屋市）は１日、人工知能（ＡＩ）が記者に代わって書いた新聞記事を同紙創刊７０年の記念企画として朝刊紙面に掲載した。記事は２１字詰め３２行で、同社の歴史や中部地域の経済の動向がテーマ。「『中部経済新聞』は昭和二十一年十一月一日、焦土とかした市街地にはなお瓦嘩の山がうず高く残る名古屋市内で創刊いたしました」との書き出しで始まる。不正確な表記もそのまま残した。ＡＩの技術を提供したデータ解析会社「データセクション」（東京都）によると、過去の記事からテーマに関連する記事数万文をＡＩに読み込ませ、テーマに沿ったキーワードを入力し、ＡＩに執筆を指示したという。米国では昨年ごろからＡＩによるスポーツや経済記事が掲載されていた。中部経済新聞社は「ＡＩによる新聞記事は国内初。ＡＩ活用で記者の負担が減れば、新聞に新たな価値が生まれるかもしれない」と期待を寄せている。【林奈緒美】"
"若者ＳＮＳに敗れたバイク文化","2016年10月23日","経済,スタートアップ,企業・産業,速報","国内原付きバイクの市場のほとんどのシェアを占めるホンダとヤマハ発動機が、排気量５０ＣＣ以下原付きバイクなどの生産・開発で提携することになった。かつて大幅値引きで張り合う「ＨＹ戦争」と呼ばれるほどの激しい販売合戦を展開してきた２社が手を組まざるを得ないほど追い込んだ若者のバイク離れはなぜ起こったのか。そこには２大メーカーの販売努力であらがうのは不可能なほど様変わりしたライフスタイルの変化があった。【永井大介】原付きバイクの販売がピークを迎えたのは、年間約２００万台近くが売れた１９８０年代前半だ。その後、市場は縮小を続けて２０１５年は１９万３８４２台まで低迷するなど年間販売台数は１０分の１になった。価格が１５万〜２０万円が主流の原付きバイクは、１台あたりの利益が少なく、さらに近年は排出ガスの規制や安全基準が厳しくなった。その対策費がかさみ、単独メーカーで事業を維持するのは難しくなっていた。では、なぜ市場は縮小したのか。バイクが売れた７０〜８０年代、若者にとってバイクは憧憬（しょうけい）の対象だった。その「入門編」でもある原付きバイクも免許取得が容易なこともあって飛ぶように売れた。一方で、「バイクブーム」は若者の交通事故の増加や社会問題化した暴走族の増加も招いた。こうした問題を受け、全国高校ＰＴＡ連合会を中心に高校生のバイクの運転を禁止させるため、「免許を取らせない」「買わせない」「運転させない」という「三ない運動」を展開。警察の取り締まりや学校での指導も強化され、二輪車の売れ行きは頭打ちになった。さらにパソコンやスマホの登場が、「原付きバイク市場の縮小を決定づけた」（二輪メーカー関係者）。９５年からの１０年間で、９０万台近くあった年間販売台数が一気に５０万台程度まで減少。９５年から００年は、就職活動などで使うため、大学生がパソコンを購入するようになった時期と重なる。原付きバイクの価格は１５万円前後の車種が多く、ノートパソコンもほぼ同じ価格帯だ。また、それまで学生が就職活動の際に、志望動機などを手書きしていたが、インターネット上で受け付ける企業が増えたのもこのころだ。パソコンとインターネットによるメールやチャット、さらに携帯電話の普及などで若者のコミュニケーションツールも多様化した。ここ数年はフェイスブックやラインなどソーシャル・ネットワーキング・サービス（ＳＮＳ）が浸透し、友人間の連絡はさらに容易になった。本人と直接話をしなくとも、近況もある程度は把握できる。二輪メーカー関係者も「『ちょっと原付きで友人に会いに行く』、そんな若者文化はなくなったのでは」とお手上げ状態だ。メインユーザーだった若者のバイク離れで、５０ＣＣバイクの販売台数の下落傾向に歯止めをかけることができず、ホンダとヤマハ発は手を組む必要に迫られた。国内二輪市場はホンダ、ヤマハの２社に加えて、スズキや川崎重工の４社でほとんどのシェアを占める。二輪全体でみれば、女性ライダーの増加など明るい材料もあるが、原付きバイク市場の先行きを見通すことは難しい。地方都市での移動手段は軽自動車が主流で、子育て世代には「電動アシスト自転車」が人気を集めていて、原付きバイクの居場所はますます失われつつあるためだ。また、５０ＣＣ規格は販売が国内のみの「ガラパゴス車種」であり、世界の二輪市場の売れ筋が１２５ＣＣクラスが中心の海外では展開しづらいこともメーカーにとっては悩みの種だ。欧州や新興国では大型バイクに人気が集まっていて、国内メーカーの中にもこうした市場を強化するため販売戦略を見直す動きもある。ヤマハが今回、原付きから事実上の撤退を決めたのも、こうした世界市場の動向を見据えたものでもある。とはいえ、原付きバイクはさらに排気量の大きなオートバイへの「入り口」としての役割もあるため、原付きが国内市場からなくなればバイク市場全体をさらに縮小することにもつながりかねない。ライバル２社の提携は、先細りを続ける二輪市場の灯を消さないための苦渋の決断だったといえそうだ。"
"来春の入試、合格ライン算定にＡＩを試験導入","2016年10月21日 10時42分","社会,スタートアップ,話題,速報","国学院大学（東京都渋谷区）は、来春の入学試験の合格ライン算定に人工知能（ＡＩ）を試験導入する。国学院大によると、入試の合格ライン設定でＡＩを活用するのは国内初。大学入試は近年、複数の形態や日程で実施されるなど多様化している。更に今年度、入学定員を超過した大都市圏の私立大学への補助金交付を文部科学省が厳格化したため、大学にとっては入学者が定員を超過しても、大きく下回っても経営に影響する事態になり、合格ラインの設定が難しくなっている。国学院大は今年６月、ＩＴ（情報技術）企業とともに合格ライン設定にＡＩを導入する共同研究を始めた。過去５年間の入試データを基に、受験生の出身高校や併願大学、科目ごとの得点などの個人データと、実際に入学した学生のデータを照合して分析するシステムを構築。最適な入学者数を確保できる合格ラインを、人が設定するより高い精度で判定できるようになったという。来春の入試の合格ラインについては、ＡＩの判定を担当者が更に検討し、最終判断を出す予定だ。国学院大入学課は「これまで勘と経験に頼ってきた合格ライン設定を科学的にすることで、安定した入学者の確保ができる」と期待している。【上杉恵子】"
"１０兆円ファンド設立　自らも２兆円超拠出","2016年10月14日 11時00分","経済一般,スタートアップ,最新の経済ニュース,速報,経済","ソフトバンクグループは１４日、世界のハイテク分野に投資するためのファンドを設立すると発表した。同社は今後５年間で２５０億ドル（約２．６兆円）をファンドに拠出。サウジアラビアの政府系ファンドも最大４５０億ドル（約４．７兆円）の拠出を検討するといい、ファンドの規模は総額１０００億ドル（約１０兆円）に上る可能性がある。ソフトバンクが設立するのは「ソフトバンク・ビジョン・ファンド（仮称）」で、同社子会社が英国で運営を予定している。同社は１２日、サウジアラビア政府系の「公共投資ファンド（ＰＩＦ）」が、主要な出資者になることについて覚書を交わした。このほか、世界で複数の大手投資家とファンドへの出資について協議中で、ソフトバンクは過去最大級の規模を目指すとしている。ファンドは世界各国のハイテク関連の企業や事業に投資し、ソフトバンクのノウハウを活用するなどして支援する方針。投資先の詳細は明らかにしていないが、人工知能（ＡＩ）やロボットなどの先端技術を想定しているとみられる。ソフトバンクは９月に英半導体開発大手のアーム（ＡＲＭ）・ホールディングスを約３．３兆円で買収するなど、買収や投資を積極化している。孫正義社長は１４日の声明でファンド設立について、「今後１０年でテクノロジー分野において最大級のプレーヤーになる」と意欲を示した。【田口雅士】"
"ＡＩで融資審査　ソフトバンクと提携","2016年9月16日 00時07分","経済,スタートアップ,最新の経済ニュース,企業・産業,速報","みずほ銀行とソフトバンクは１５日、人工知能（ＡＩ）を使った個人向け融資事業を始めると発表した。利用者がスマートフォンで申し込むと、ＡＩが審査し、利用者が将来稼ぐお金などを予測して貸し出す。こうした情報技術（ＩＴ）を活用した新たな金融サービスは「フィンテック」と呼ばれ、大手同士の提携で金融とＩＴの融合が進む可能性がある。両社は、融資を行う会社を１１月に設立し、来年前半に事業を始める予定。新会社は資本金５０億円で、両社が半分ずつ出資する。利用者はスマホの専用アプリに個人情報を入力し、インターネットで融資を申し込む。情報は年齢や職業、年収、家族構成などが検討されている。担保は不要。情報をＡＩが分析・審査し、最短で３０分以内に口座振り込みが完了する。審査は基本的にＡＩに委ねる。みずほは顧客への融資、ソフトバンクは携帯電話料金の支払いなどで大量のデータを蓄積している。こうしたビッグデータを匿名化してＡＩの審査に活用。将来の収入や融資が焦げ付く恐れを予測し、融資額や金利をはじき出す。若者が結婚や留学の資金を賄うケースなどが念頭にある。情報を裏付けたり、本人確認したりする手法は今後検討する。みずほやソフトバンクを使ってきた利用者なら、利用者の同意を前提に口座履歴などの情報が活用でき、審査も速くなる可能性がある。新会社は店舗が要らないため、コストが抑えられ、低金利での融資が可能。記者会見したみずほフィナンシャルグループ（ＦＧ）の佐藤康博社長は「日本の金融機関として初めてのサービス」と強調。ソフトバンクグループの孫正義社長は「従来の消費者ローンとは全く次元の違うものになる」と述べた。融資や決済、送金などは銀行がほぼ独占していたが、米国ではフィンテックを提供するＩＴ関連企業が台頭。低コストを生かして手数料を安くするなどして急成長している。日本は取り組みが遅れていたが、最近になって大手銀行が相次いで参入。三菱東京ＵＦＪ銀は今年３月、顧客の問い合わせにＡＩが音声で対応するサービスを導入した。ＡＩを活用した機器システム全体の国内市場規模は現在の３．８兆円から２０２０年に２３兆円に達するとの試算もある。先進的なサービスを開発するには、銀行とＩＴ企業がノウハウを持ち寄ることが必要。金融庁は銀行とＩＴ企業が連携しやすくする規制緩和に着手しており、みずほとソフトバンクの提携はこうした流れを加速しそうだ。フィンテックが活発化すると、利用者の利便性が高まる効果が期待できる。一方、口座情報がネットに流出したり、不正送金に利用されたりする恐れもあり、対策が必要だ。【安藤大介、田口雅士】英語の「Ｆｉｎａｎｃｅ（ファイナンス＝金融）」と「Ｔｅｃｈｎｏｌｏｇｙ（テクノロジー＝技術）」を組み合わせた造語。ＩＴを活用した先進的な金融サービスを指す。具体的には、スマートフォンによるインターネット上の決済▽銀行口座やクレジットカードの利用履歴をまとめた家計簿ソフト▽ＡＩを活用した資産運用アドバイス▽ネット上の売買に使える「仮想通貨」−−などがある。"
"ＡＩロボで在庫管理　国内初開発へ","2016年9月14日 07時50分","経済,スタートアップ,最新の経済ニュース,企業・産業,速報","ＩＴシステム専業大手の日本ユニシスが、小売店の売り場を巡回して棚にどれだけの在庫があるかを把握し、売り場担当者に発注や棚の見直しを助言する「棚卸しロボット」を開発していることが分かった。こうしたロボ開発が明らかになるのは国内初。少子高齢化で人手不足が深刻化している小売業界の業務支援策として、今年度内にも国内の小売店で実証実験に入る。【宮島寛】平岡昭良社長が毎日新聞のインタビューで明らかにした。平岡社長は「単なる話題づくりでなく、実用性を伴ったものだ」と強調した上で、「ロボット技術は社会課題解決のために活用できる段階に入った」との認識を示した。棚卸しロボットは米ベンチャー企業が売り場案内用に設計した自律走行ロボットに、日本ユニシスが独自開発した人工知能（ＡＩ）を組み込む形で運用する。閉店後の夜間などに店内を自動巡回させ、内蔵センサーを通じてどの棚にどんな商品があり、どれだけの空きスペースがあるかを認識。１品当たりの大きさと棚の埋まり具合から在庫がどの程度あるのかをＡＩが割り出し、「間もなく欠品するので追加発注した方が良い」「この商品は週末によく売れるので目立つ棚へ移動を」などとアドバイスする。商品の陳列位置を変えた場合も、ロボットが日々の巡回で売り場の変化を自動認識するため、特段のプログラム変更は不要という。在庫管理の手法としては、商品にＩＣタグを付けて１品単位で把握する方法もある。しかし、タグの設置や管理などに多額の費用がかかるため、多くの小売店は人による棚卸しを続けている。ロボットによる在庫把握はＡＩを用いた「推論」で多少の誤差は生じるものの、「傾向さえ分かれば販売戦略を立てられる場合も多い。人手不足で店を増やそうにも増やせないチェーン店などにとって有効なお助けロボットになる」（平岡社長）としている。日本ユニシスはロボットを顧客の売り場案内に活用する実験も進めており、営業中は「案内係」、閉店後は「棚卸し係」と１台に２役を任せることも視野に入れる。平岡社長は「ＡＩをもっと発達させられれば顧客と雑談できるようにもなる」と指摘。「生身の店員には知られたくないこともロボットには気軽に相談できるかもしれない。雑談の中から（高級宿泊施設の）リッツ・カールトンや加賀屋のように、本当の顧客のニーズや困りごとを引き出せれば接客も変わる」と述べた。商品などの在庫数や価格を調べること。多くの小売店はレジで会計する際、バーコードを使った「ＰＯＳ（ポス）」と呼ばれるシステムで、何がどれだけ売れたかを把握している。しかし、実際の在庫は不良品や期限切れ商品の撤去、万引き被害などによって異なってくる。スーパーマーケットなどでは同じ商品を複数の棚に分けて陳列したり、特売に合わせて価格を変えたりすることも多く、在庫を正確に把握するのは難しい。そこで、帳簿上の在庫と実際の在庫をそろえるため、決算日などの節目に合わせて棚卸しを実施。商品数が多い店の場合、従業員が総出で行っても作業は半日から１日になることもざらで大きな負担になっている。"
