"title","date","tags","article"
"真っ暗闇でカラー撮影　産総研ベンチャーが普及へ","2017年2月25日 09時00分","茨城県,スタートアップ,話題,速報,社会","茨城県つくば市のベンチャー企業「ナノルクス」（祖父江基史社長）が、真っ暗闇でも実際に近い色で再現してカラー動画を撮影できる技術を実用化した。２月下旬には高速道路に設置したカメラによる夜間撮影の実証実験がスタート。ストロボが無くてもカラー撮影ができることから、スマートフォンなどへの採用など身近な技術として広まることも期待される。暗闇での撮影はこれまで、モノクロか単色、あるいは特定の色を当てはめた疑似カラーでしか表現できなかった。今年秋にはフルハイビジョンのイメージセンサーを完成させ、２０１８年から量産化する予定で、防犯カメラや車載カメラ、医療・介護向け見守りカメラなど幅広い分野への普及を狙っている。「カラー暗視撮影」の技術は、国立研究開発法人「産業技術総合研究所」（産総研、つくば市）が開発し、実用化のために「ナノルクス」を設立した。開発を担当した産総研の永宗靖主任研究員が、同社の技術担当取締役を務めている。人間は「光の三原色」の赤、緑、青の３色を感じることで、色を識別している。可視光線の波長は約４００～７００ナノメートル（ナノは１０億分の１を表す単位）で、例えば青なら約４５０ナノメートルと、色ごとに波長が決まっている。「カラー暗視撮影」は、赤外線を物体に当てた場合にも色ごとに反射される波長が異なることを発見し、それを応用することで実現した。近赤外線の波長約７００～１１００ナノメートルのうち、三原色それぞれについて反射率の範囲を特定。可視光線と近赤外線の波長の相関関係を明らかにして、実際に近い色を再現することに成功した。これまでも、暗い中でカラー撮影ができるものとしては超高感度カメラがあるが、これも光を利用したものなので完全な「暗闇」では撮影はできず、動画も苦手だ。一方、赤外線カラー暗視カメラなら、暗闇でも、速い動きをなめらかな動画として撮影できる。考えられる用途はさまざまだ。モノクロに比べてカラーは情報量が多く、物を識別しやすくなる。防犯カメラなら容疑者の姿や持ち物、車載カメラなら車線や標識の色を識別することで、人物の特定や交通安全に役立てることにつながる。人間が現場まで足を運んで確認しないと分からなかったようなトンネルの天井の劣化も、カメラで捉えられる可能性がある。病院の入院患者や介護が必要な人への夜間見守りも、眠りの妨げとなる光を使う必要がない。将来的には、開発が進む自動車の自動運転技術にも役立ちそうだ。量産化すれば、通常のカメラのイメージセンサーと同じ程度の価格で販売が可能という。祖父江社長は「カラー暗視カメラを使うことで、防犯や社会インフラ整備など、社会の安全・安心に貢献したい」と話している。【相良美成】"
"スマホで購入、駅の自販機で受け取る新サービス","2017年2月23日 07時00分","東京都,スタートアップ,最新の経済ニュース,企業・産業,速報,経済","ＪＲ東日本の駅構内で飲料自販機ビジネスなどを展開するＪＲ東日本ウォータービジネス（東京都渋谷区）は、頭打ちになっている自販機市場を活性化するため、スマートフォンアプリと連動して「人と人を結び付ける」新型自販機を３月１４日から導入する。同社は「自販機を使った新たな体験を提供し、利用者の拡大に結び付けたい」としている。具体的には、アプリで商品を選択し、ＪＲ東日本の乗車券にもなる電子マネー「Ｓｕｉｃａ（スイカ）」やクレジットカードなどで購入する。買った商品の情報は二次元コードになり、読み取り機能が付いた新型自販機で受け取る仕組みだ。二次元コードはソーシャル・ネットワーキング・サービス（ＳＮＳ）を通じて、友人や家族にプレゼントをすることもできる。開発チーム責任者の飯島俊介さんは「自販機で人と人を結び付けることができないかとの思いで開発した。残業時に子供から『お父さん、お疲れ様！』とコードを送ってもらうといった、自販機を通じていろいろな物語が生まれてくれればうれしい」と話す。アプリにはまとめ買い機能もあり、一定数購入すると割引になる仕組みを導入するほか、時間を決めて値引きする「タイムセール」の実施も今後検討する。同社は駅の商業スペース「エキナカ」などで飲料自販機を展開。清涼飲料市場は拡大し、自販機の売り上げは２００５年に比べて約１.６倍に拡大しているものの、１４年の消費増税後はスーパーでの値引き販売やコンビニエンスストアでの食品とのセット販売に押され、伸び悩み状態が続いていた。駅などに設置された自販機で飲料水を買うときは、のどが渇いている時にたまたま自販機を見つけたなど「衝動」で購入するケースが多いという。同社はアプリ対応自販機の導入で自販機に行く「目的」を利用者に持ってもらうことで、売り上げの拡大を図りたい考えだ。アプリはデジタル技術を駆使した「デジタルアート」の先がけとして知られるチームラボ（東京都文京区）が開発した。専用の自販機２０台は３月１４日から東京、新宿、池袋、横浜など首都圏のターミナル駅に設置する。１７年度内に数百台の既存の自販機にも同様の機能を持たせたい考えだ。将来的には、ほかの飲料水メーカーなどと提携し、ＪＲの「エキナカ」以外でも商品を受け取る仕組みも検討していく。飯島さんは「利用者の反応を見ながら、新たな展開を検討していく。人々の消費に対する考えが多様化する中、新たな価値を提供する自販機の開発を今後も進めていきたい」と話している。【永井大介】"
"ＡＩで商品発注　業務省力化、在庫減少へ","2017年2月22日 07時40分","福岡県,スタートアップ,最新の経済ニュース,企業・産業,速報,経済","ホームセンターのグッデイ（福岡県那珂川町）は２１日、年内に人工知能（ＡＩ）を商品発注業務に活用する方針を明らかにした。販売実績や気温などを機械学習し、商品ごとに１日単位の売れ行きを予測する仕組み。発注の精度を高めて在庫管理することで高利益を確保し、従業員の業務省力化で接客サービス向上を狙う。ホームセンターの業界団体「日本ドゥ・イット・ユアセルフ協会」（東京）によると、先進的な取り組みだという。活用するＡＩ技術は、ベンチャー企業のグルーヴノーツ（福岡市）が昨年開発した機械学習サービス。ＡＩ活用は段階的に進める見通しで、最終的に約６万点に及ぶ全商品に適用できるようにする。グッデイが過去３年分の使い捨てカイロの店舗販売データを利用して売れ行きをＡＩで予測した結果、実売数との平均的な誤差は１店舗当たり１、２個で「予測精度が高く信頼できた」（柳瀬隆志社長）。商品発注は各店舗の発注担当者らが定期的に実施し、１回で２、３時間かかっている。過去の販売データを基に在庫数を確認しながら発注するが、現場の感覚に頼ることもあって在庫を多く抱えてしまう恐れがある。在庫が増えると、品質劣化が懸念される商品などは値下げ販売するケースもあった。柳瀬社長は「ＡＩ導入で業務を効率化し、実店舗ならではの丁寧な接客に努め、従業員がやりがいを持って働ける環境を整備したい」としている。【浅川大樹】【ことば】グッデイ１９４９年２月に福岡県飯塚市でアマチュア無線の部品販売店などを展開する「嘉穂無線」として創業。７８年にホームセンターのグッデイ１号店を同県大野城市でオープンし、２０１６年９月に社名もグッデイに変更した。現在は北部九州を中心に６３店を展開している。１６年３月期の単独売上高は３２４億円で、従業員数は約１５００人。"
"ロボット「ペッパー」は落語の師匠","2017年2月6日 10時13分","社会,スタートアップ,めっちゃ関西,話題,速報","大阪府池田市は４月から、市内の小中学校でソフトバンクの人型ロボット「ペッパー」を使って落語の語りや所作のプログラムを組み立てる教育を始める。池田市は古典落語の舞台にもなった「落語のまち」。市内在住の落語家、桂文枝さんの協力も得ながら、“ＡＩ（人工知能）落語”で子どもたちのＩＴ（情報技術）スキル向上を目指す。ペッパーは高さ約１．２メートル。センサーで相手の位置を認識し、音声による問いかけに身ぶり手ぶりを交えて答えることができる。プログラムを書き換えることでさまざまな動きも可能だ。ソフトバンクは社会貢献として、全国の小中学校のプログラミング教育を支援するためペッパーを２０１７年度から３年間、無償貸与することを決め、池田市を含む１７自治体が選ばれた。池田市は「池田の猪（しし）買い」など四つの落語の舞台で、上方落語資料展示館もある。倉田薫市長によると、今回、知人でもある文枝さんに相談したところ「私が子どもたちに落語を教えましょう」と快諾されたという。市はペッパー１００台を導入し、小学校の情報・科学や中学の技術の授業でプログラミング教育に活用。要望に応じて、生徒らが落語の語り方や所作を学んだ後、落語のプログラミングに挑戦する。【米山淳】"
"「バーチャン・リアリティ」で孤食解決に挑む","2017年2月4日 09時00分","社会一般,兵庫県,スタートアップ,速報,社会","バーチャルリアリティー（ＶＲ＝仮想現実）を利用し、あたかも故郷でおばあちゃんと食卓を囲んでいるような気分になる動画「バーチャン・リアリティ」を兵庫県南あわじ市が制作し、インターネット上で話題を集めている。市は「動画で田舎の温かみを知ってもらい、実際に足を運ぶきっかけになってもらえれば」と話している。【永井大介】都会で孤食が問題となる中で、同市の食の拠点推進課は「南あわじ市などの田舎やそこに住む高齢者が、社会のいやしを担っていけるのではと考えて動画を作った」と話す。おばあちゃんと朝食を取る「朝ごはん」、家族や地元住民らも交えてにぎやかな時を過ごす「夜ごはん」の２編構成で、帰郷の雰囲気を演出した動画は、自治体のプロモーション動画としては１６万回超と異例の視聴回数となっている。「朝ごはん」の動画は３分。おにぎりや地元食材で作った「シャキシャキレタスのおみそ汁」「おろしたまねぎのちりめん和え」などの料理が並ぶ食卓を前に、おばあちゃんが「よう寝れたか？　ぎょうさんおあがりや」「都会ではインスタントばっかり食べてるん違うの？　生野菜もしっかりおあがりや」と優しく声をかける。「じいちゃんもな、ほんまに楽しみにしてたんやで。なあじいちゃん」とおばあちゃんの目線の先にスマートフォンを振ると縁側で碁を打つおじいちゃんが「よう帰ってきてくれた」と笑顔で帰省を喜んでくれる。また、４分５０秒の「晩ごはん」では、タマネギのステーキや淡路ビーフステーキ、「淡路島３年とらふぐ」の刺身などの特産品が並ぶ食卓を親戚やご近所さん総勢約２０人で囲む。おばあちゃんは「仕事はどうなんや？　体を大事にして頑張ってなあ～」とここでも優しく声をかけてくれる。疑似体験動画は、南あわじ市が国の地方創生加速化交付金２０００万円を投入して作った。一人で食事する都会の「孤食」の人たちに、優しいおばあちゃんと食卓を囲みながら淡路島のおいしい「食」を味わってもらう内容の動画で、「孤食」の解消と市の特産品をＰＲしよう企画した。スマートフォンを専用キットに装着し、付属のゴーグルで動画を再生して使う仕組みだ。ＶＲ動画は、朝ごはん編と夜ごはん編のほか、淡路島の渦潮を楽しめる「うずしおクルーズ」、淡路人形浄瑠璃を取り上げた「淡路人形座」の計４本ある。特設サイトには動画に登場した料理のレシピも掲載している。同市へのふるさと納税の寄付者（１万円以上）のうち、希望する先着２００人にＶＲの視聴キットを贈る。担当の同市食の拠点推進課は「南あわじにはおいしい特産品がたくさんあるが東京など全国での知名度はなかなか上がらなかった。動画を通じて豊かさに気付いてもらえれば」と話している。"
"元ブラック企業部長が実現した残業ゼロ施策","2017年1月23日 09時00分","経済,スタートアップ,最新の経済ニュース,企業・産業,速報","女性新入社員が過労自殺した広告最大手・電通の問題を契機に、改めて「長時間労働」に注目が集まっているが、業績を維持するため、「長時間労働」の慣行を変えられない企業は多い。では稼ぎながら労働時間を減らすにはどうすればいいのか。午後５時にほぼ全社員が退社しながら、設立から１０年連続増収を達成している化粧品販売・開発会社のランクアップ（東京都中央区）の「攻めの残業ゼロ施策」の経営から探ってみた。【永井大介】ランクアップは従業員数４５人のほとんどが女性だ。しかも岩崎裕美子社長（４８）も含めて半数は子育て中で、就業時間は午前８時半から午後５時半だが「午後５時退社ＯＫ」を社内のルールにしている。オリジナルブランド「マナラ」を展開し、２０１６年９月期の売上高は約９０億円を誇る。同社では午後５時には社員が帰り支度を開始する。保育園への子供の出迎えや趣味の習い事、社外の人脈拡大などアフターファイブの過ごし方は自由だ。０５年の会社設立時から、残業を減らすことを目指し、就業時間は午前９時～午後６時に設定。残業しても午後８時には全員が退社していた。残業を減らすことを目標にしただけでは、どこの会社もやっていることかもしれない。だが、同社はそれよりも一歩進んだ「定時帰り」を実践している。きっかけになったのが１１年３月の東日本大震災だった。震災直後、節電のためのサマータイム制として就業時間を３０分前倒しした際に、「帰り道が心配だから、仕事が終わったら午後５時に帰ってもいい」という暫定ルールを作った。「社員が少しでも早く帰るために集中して仕事をすれば業績も伸びるのではないか」。岩崎社長の狙いは的中した。３カ月後に社員から５時帰りの継続を求める声があがり、「業績が下がれば、いつでも廃止する」との約束のもと、ルールは今も継続している。現在は「定時帰り」の定着している同社だが、設立当初は定時の６時から１時間程度の残業を前提にしていた。そこから残業撲滅に踏み切った背景には、岩崎社長の出産があった。出産からわずか３カ月で職場復帰を果たしたものの、当時、システムトラブルを抱えた社内は創業以来初めての深夜残業に追われていた。岩崎社長は子供を保育園に迎えに行くために午後７時には退社しなければならず、「自分の会社なのに頑張っている社員を残して帰るのはつらく、『お先に失礼します』がすごく言いづらかった」一方で母親としても子供と真正面から向き合えないことに悩みを抱えていた。「子供に口癖のように『早く早く』とせかしていた」と語る岩崎社長は、仕事へのストレスと夜泣きによる睡眠不足がたたり、大きなめまいを感じるほど体調も悪化した。「残業を減らすだけでは不十分なことに自分の出産で気付かされた」（岩崎社長）。当時の社内で出産は岩崎社長が初めてだった。「時短勤務ではママ社員は引け目を感じる。将来、社員が出産しても、お払い箱にならない会社にしたい」と、定時帰りの取り組みに挑戦することを決めた。まず始めたのは、仕事量を減らす「業務の棚卸し」だ。「突然『定時に帰りましょう』といっても、業務量が多ければ定時には帰れないから」と岩崎社長。理由もなく続けていた仕事や、自社でやらなくてもいいような仕事を徹底的に見直した。「システム化」「外部委託」「他の社員にお願いする」「やめる」などに振り分けていった。同時に委託先と会社の理念や方向性を共有し、トラブルを少なくすることで製品開発や広告宣伝など、自社の専門分野に集中できる環境を整えた。さらに社内の無駄と思う慣例を徹底的にやめた。（１）社内資料は作りこまない（２）会議は３０分（３）社内メールで「お疲れ様です」は使わない（４）社内のスケジュールは勝手に入れる（５）担当部署が明確でない仕事は少数精鋭のプロジェクト化で効率化（６）企画段階のヒアリングを徹底することで致命的な問題の事前把握－－の六つのルールを徹底した。「定時帰り」は社員に「甘い」会社のようにも見えるが、実際はその逆だ。「限られた時間の中で無駄な仕事はできない。今ある仕事が常に必要かを考えながら、アイデアと成果を出してもらう。就業時間中に漫然と会社にいるだけでいいというのではダメなんです」と岩崎社長は指摘する。社員が残業をしなくなりプライベートの時間が増えたことが、新商品開発にもつながっている。昨年秋に限定発売した「キッズバブルバス」は、ママ社員が生み出した新商品だ。使うと泡風呂になるだけでなく、入浴しただけで体を洗うことにもなる商品だ。保湿効果や無添加へのこだわりなど、子供の安全面に最大の配慮を加えた。キッズバブルバスは「子育て中の母親は、子供が早く風呂から出たがったり、子供の世話でゆっくりと風呂に入れなかったりする」と６歳児を子育て中の社員の実体験から生まれた。岩崎社長は「生活の中で子供とじっくりと向き合う時間がなければ生まれなかった商品。プライベートでインプットしたことを仕事でアウトプットするいい循環がうちの会社には生まれている」と定時帰りが持つ効果を説明する。一方で、一般的に難しいとされる「能力」に対する評価は、どのように行っているのだろうか。ランクアップではキャリアアップ基準表（能力評価表）を使い、細かく具体的な評価項目を用いることで、自分は達成できているかを行動面から数値的に評価している。具体的には、社内の等級を「Ｓ１～３、Ｌ１、Ｍ１～２」の６段階に分け、等級ごとに「求められる仕事レベル」を明記した。一番下の段階のＳ１は「第三者の支援を受けながら業務を遂行する」、次の段階のＳ２なら「自立的に業務を遂行・改善する」といった具合だ。さらに、それぞれの等級に求められるスキルも、具体的に記入されている。例えば広報部のＳ１は「上司の指導のもと、プレスリリースを書ける」と明記され、Ｓ２は「一人でプレスリリースを書ける」といった項目がある。等級ごとのスキルを見れば、社員も会社側がどう成長してもらいたいかがわかり、キャリアビジョンも描きやすくなっている。能力評価表には「成果」「能力」「情意」という３大項目を設け、「能力」「情意」の項目には全社共通の目標を記載し、「成果」の項目には部署ごとに異なる目標を設定している。この評価表を基に半期に１回、項目別に「Ｓ、Ａ、Ｂ」の３段階で判定する。評価表をもとに、担当上司と１人３０分から１時間程度の面談をして評価結果を伝え、同時に今後のキャリアについてじっくり話し合うことにしている。さらに特徴的なのは人事評価システムの作成のほか、評価点数の計算、面談のシナリオなど運用全てを外部委託していることだ。岩崎社長は「漫然と面談をするよりも、プロのシナリオに従った方が、部下の考えていることなどの取りこぼしが少ない」と利点を強調する。岩崎社長自身、ランクアップを起業する前は広告代理店の営業本部長として、終電で帰宅する日々を送っていた。社長以外は女性ばかりの会社でやりがいは感じていたが、部下の退職も相次いだ。「結婚したいし子供もほしい。みんな、この会社ではそんなことは無理だと辞めていった」。３年以上続く社員がおらず、仕事のやり方を効率重視に変えるよう提案したが、認められなかった。社員がすべて入れ替わるほどのブラックな環境。気がつけば、自分の肌もボロボロだった。３５歳を過ぎて「このままでは結婚も出産もできない人生になる」との焦りも感じた。「会社が変われないならば、自分で理想の会社をつくろう」とランクアップを設立した。電通、三菱電機と大手企業を中心に、労働時間に関する問題が次々と浮上する。攻めの定時帰りを実践する岩崎社長は「男性は会社に時間をひたすら奉仕する働き方は可能だが、家事も育児もしなければならない女性はその働き方は無理。就業時間内で最大限の能力を提供する働き方ならば女性も働けるし、本来、『働く』とはそういうことではないでしょうか」と指摘している。"
"アイデア商品を見つけられる! アマゾンがスタートアップ企業を支援する新サービス「Amazon Launchpad」始動（GetNavi web）","2017年1月20日 14時02分","ライフ,スタートアップ",""
"「有機EL」「AIとロボット」「ハイレゾ」――2017年のキーワードがわかるCESまとめ（GetNavi web）","2017年1月16日 15時00分","ライフ,スタートアップ",""
