"title","date","tags","article"
"フランス「徴兵制」復活案　拡大望む左派、反対した右派","2018年2月11日15時13分","国際,ヨーロッパ,有料会員限定記事","大野博人（編集委員）フランスは「徴兵制」に何を期待しているのだろう。マクロン大統領は先月、実施に向けて作業グループを立ち上げたと発表した。４月に結論をまとめさせるという。同国では兵役義務は２００１年に廃止されており、その復活に見える。昨年の大統領選挙ですでに公約として掲げていた方針である。男でも女でも１８歳から２１歳までの間に一度必ず防衛、治安を担う場所で任務に就かせるという構想だった。パリなどでテロが続き、治安に不安を感じる人は少なくない。こうした発想が出てくる背景はたしかにある。ただ当時、不思議に感じたことがいくつかあった。ひとつは提案している兵役期間だ。たった１カ月。初心者が入れ代わり立ち代わり頻繁に任務を交代してどれほど治安の強化につながるのか。選挙期間中、主要な争点になっていなかったことも意外だった。ほかの候補も似た考えを打ち出していたのだ。右翼のルペン氏だけでない。グローバル化や欧州統合に批判的で若者の支持も高い左派のメランション氏は、１カ月どころか９カ月の防衛や環境保全などの任務を課すと訴えていた。廃止のときは、大革命期以来の歴史的な転換といわれた。それをまたひっくり返そうというのに異論が目立たない。◇とはいえ大統領選で接戦を演じた４候補の中に１人だけ反対した人がいた。それもまたちょっと不思議なことだった。なぜなら、その人が元首相のフィヨン氏だったからだ。保守の主流、共和党の候補でタカ派といわれていた。振り返ってみれば廃止を決めたのもやはり保守の大統領だったシラク氏だ。軍をプロフェッショナル化する必要がある、という理由だった。その流れからすると驚くに当たらないのかもしれない。高度に専門化が進んだ現代の軍に素人の出る幕はないというわけだ。そのフィヨン氏が昨年、仏メディアの取材で徴兵制復活を批判したときの言葉遣いがおもしろかった。「軍は野外の託児施設ではない」実はマクロン氏の考えには国防や治安の枠に収まらない狙いも込められていた。生まれ育った環境が異なる若者に同じ仕事をさせ、国民という共通した帰属意識を育む機会に、という狙いだ。仏社会は分断に苦しんでいる。テロが強めるイスラム系市民への偏見。経済的不平等への不満。人々をエリートと非エリートに分断する教育への失望感……。フィヨン氏の物言いには、そんな問題の解決は軍ではなく国民教育省などの仕事だろうといういらだちがにじむ。加えて軍関係者や専門家からは、経費がバカにならないとの懸念も出ていた。それを意識したようだ。大統領は最近「（廃止した）徴兵制をあらためて持ち出すわけではない」と強調している。むしろ「すべての国民の義務」という抽象的な呼び方を使い、「社会や環境、文化の領域での守るべき原則と取り組むべき闘いをフランスの若者に与える」のが目的で、それこそが「揺るぎない国民的連帯の土台となる」という。軍だけではなくほかの省庁も動員する構えで、「目的外使用」される徴兵制といったイメージ払拭（ふっしょく）に懸命だ。◇ばらばらになりそうな社会を再び統合する手段としての徴兵制。それはあながち「目的外使用」とも言い切れない。近代的な国民国家は、広い領土に暮らし、貧富や宗教、言語がちがう人々に同じ国民という意識を持たせなければならなかった。その役割を公教育などとともに徴兵制による軍隊も担ってきた。またその力を借りたいのだろう。大統領選後の世論調査で６割の人がマクロン氏の提案を支持した。治安への懸念だけでなく連帯感を失う社会への不安の表れでもあったのではないか。けれど、国民軍が専門家集団へと変貌（へんぼう）したのは時代の要請だった。そこへ再び往時の姿を重ねる期待のまなざし。「すべての国民の義務」がどんな形で実現するにしろ、託される課題は重い。"
"指導者の妹「最高のカード」　訪朝要請、北朝鮮に焦りも","2018年2月11日08時15分","国際,アジア・太平洋,有料会員限定記事","北朝鮮の金正恩（キムジョンウン）朝鮮労働党委員長が１０日、実妹の金与正（キムヨジョン）氏を通じ、文在寅（ムンジェイン）韓国大統領の訪朝を要請した。北朝鮮にとって、金与正氏の韓国派遣は「最高のカード」。その狙いは何か。北朝鮮の揺さぶりで米韓同盟はどうなるのか。（ソウル＝牧野愛博）韓国の対北朝鮮策に日本懸念　「文氏訪朝、ありえない」北朝鮮、文大統領に訪朝要請　「条件整え実現を」と返答１０日午前１１時過ぎ、北朝鮮高位級代表団が韓国大統領府の一室に姿を現した。金与正氏は青色のファイルを大事に扱い、テーブルの上に置いた。韓国メディアの映像分析によれば、ファイルには「朝鮮民主主義人民共和国　国務委員長」と表書きされていた。国務委員長は正恩氏の肩書の一つ。文氏に渡す正恩氏の親書だった。大統領府によれば、親書には、南北関係改善を目指す正恩氏の考えが記されていた。金与正氏は口頭で、文氏の訪朝を促す正恩氏の要請を伝えた。具体的な時期には触れなかった。脱北した元北朝鮮外交官は「外交上、口頭での伝達は親書よりもランクが低い。時期を示さないのは、南北関係が長く断絶するなか、解決すべき課題が残っているからだ。逆に言えばそれだけ北朝鮮を取り巻く状況は悪い。焦っている証拠だ」と語る。米韓関係筋は「北朝鮮は、韓国を米国の攻撃に対するシールド（盾）にするつもりではないか」と語る。米軍は最近、核兵器を搭載できるＢ５２戦略爆撃機６機やステルス性能を持つＢ２戦略爆撃機３機をグアムに前進配備した。ソウルの情報関係筋によれば、北朝鮮側は最近、米国や韓国の専門家らと頻繁に接触し、トランプ米政権が本気で攻撃する考えを持っているかどうか探っているという。金与正氏は北朝鮮の実質ナンバー２。康仁徳（カンインドク）元韓国統一相は「北朝鮮も死にもの狂いだ」とし、金与正氏の韓国派遣を「最高のカード」と表現した。情報関係筋は北朝鮮の思惑について「最高のカードを切って韓国に恩を売る。制裁緩和や米韓合同軍事演習の縮小・中止はもちろん、米国が攻撃を思いとどまるよう、韓国を説得役にするつもりだ」と語る。揺らぐ米韓関係北朝鮮の誘いに韓国は応じるのか。文在寅政権は平昌（ピョンチャン）冬季五輪を巡る南北合同チームの結成や経済政策への不評から、支持率が陰りを見せ始めている。韓国政府元高官は「文氏は人気挽回（ばんかい）を狙って平壌に行くかもしれない」と語る。ただ、大統領府当局者は１０日、「条件を整えて実現させよう」と述べた文氏の意図について、南北や米朝関係の改善が必要だとの認識も示した。最大の後ろ盾である同盟国、米国の支持なしには文氏も自由には動けない。肝心の米韓関係は揺らいでいる。「ペンス副大統領はレセプションに出席できない」。米側は９日夜の五輪歓迎レセプションが始まる１時間前に、こう通告した。ペンス氏は会場に来たが関係者にあいさつだけして引き揚げた。韓国はペンス氏が文氏の隣に座るよう提案していた。同じテーブルには北朝鮮の金永南（キムヨンナム）最高人民会議常任委員長もいた。米韓関係筋によれば、米側は「北朝鮮に誤ったメッセージを送るのを避けた」と語る。続く開会式でも米韓の摩擦は続いた。韓国は当初、最前列に文氏、ペンス氏、金永南氏らが座り、第２列に金与正氏らが座る案を提示。米側は「北朝鮮と同じ列には座れない」と拒否し、金永南氏は第２列に座ることになった。「こんな外交的な失敗は（文在寅政権と同じ革新系の）盧武鉉（ノムヒョン）政権でもなかった。韓米同盟の危機だ」。文氏の隣にペンス氏がいないレセプションの様子を聞いた韓国政府元高官はうめいた。韓国大統領府は８日の米韓会談について「ペンス氏は、韓米同盟がかつてないほど強固だという文氏の発言に同意した」と説明したばかりだった。文氏は「南北対話を米朝対話につなげる」と意気込み、１０日の会談でも米朝対話の早期実現を訴えた。米側からは、現状を無視した韓国の姿勢を憂慮する声が上がる。米韓関係の混乱は、韓国を不安に陥れている。５日、韓国外交省の李度勲（イドフン）朝鮮半島平和交渉本部長と米国務省のジョセフ・ユン北朝鮮政策特別代表がソウルで会談した。李氏は、「鼻血作戦」と呼ばれる限定先制攻撃案を巡る米国の真意を尋ねた。米政府は今月、駐韓大使にビクター・チャ元ホワイトハウス国家安全保障会議（ＮＳＣ）アジア部長を据える人事案の撤回を韓国に通報した。撤回の理由として、チャ氏が限定先制攻撃案に懸念を示したという説が流れたためだ。ユン氏は「北朝鮮の核・ミサイル開発を食い止める案の一つ」とする一方、「すべての案がテーブルの上に載っている」と語るばかりだった。米韓関係筋の一人は「ユン氏もホワイトハウスの真意はわからない。ましてや韓国が知るよしもない」と話す。韓国政府関係者は「米国は、韓国の事情など気に掛けないかもしれない」と語った。"
"「社会のため」問い続けて　パナソニックの模索続く","2018年2月11日06時58分","経済,産業・商品,国際,アジア・太平洋,環境・エネルギー,環境・世界の動き,有料記事","１０１年目のパナソニック暗がりで布を織る女性たちの手もとを、パナソニック製のソーラーランタンが明るく照らしていた。【特集】１０１年目のパナソニック作業の手を止めたユリアナ・ワダン・トビ（４４）は笑って言った。「夜も作業できるようになってうれしい」熱帯雨林に囲まれたインドネシア・フローレス島にあるリアンバリン村の人々にとって、伝統の織物「イカット」は貴重な収入源だ。以前は午後４時には作業を終えなければならなかったが、ランタンのおかげで生産量が増えた。ランタンは、パナソニックが２０１６年に贈った。村は電力供給が不安定なため、太陽光で充電できるランタンは、放課後に補講を行う寺子屋や、夜間の診療所でも活躍している。パナソニックの創業者、松下幸之助は、企業の社会的使命について、社員に繰り返し語っていた。「あらゆる物資を水道の水のごとく安く、豊富に供給し、この世から貧困を無くそう」。「水道哲学」と呼ばれた考えだ。豊かになった社会は、さらに製品を買うことで企業を潤す。「企業は社会の公器である」。幸之助がこう唱えたことはよく知られている。企業は社会から、人、カネ、土地、物を預かって事業を営む。だから本来的に社会全体のものだ――。企業に対する社会の期待は、時代とともに変化した。日本が、欧米の背中を追いかけた１９６０～７０年代、松下電器産業（現パナソニック）は、賃金を欧米企業並みに引き上げ、完全週休２日制もいち早く導入した。過疎問題が指摘されると、「１県１工場」を掲げ、北海道から九州まで工場を置いた。公害対策にも取り組んだ。幸之助は、社会が求めるものは、一企業で解決できるものばかりではないと考えたのだろう。晩年の７９年には私財７０億円を投じて「松下政経塾」を設けるなど、若手リーダーの育成に情熱を注いだ。政経塾１期生で前首相の野田佳彦（６０）は、幸之助について、「国家についても、経営者として、１００年という長い視野で捉えた。大きな理念を掲げ、どうしたら実現できるか、『ど真剣』に考え続けていた」と評する。だが創業者の思いとは裏腹に、「公器」であることを疑われることも増えた。松下電器が１万３千人の大規模なリストラに踏み切ったのは、０１年度のことだ。「幸之助の精神はどうなる」と、社内からも声が上がった。２９年、世界恐慌を受け、日本も不況に襲われた。幸之助は「従業員は解雇したらあかん」と指示した。工場を半日勤務としながら賃金は全額支払い、雇用も守った。この時社会から得た信頼は、その後の成長につながった。だが、創業以来最大の赤字に陥った０１年度は、違った対応を取った。当時人事担当の幹部だった福島伸一（６９）は、「配置転換などの策を打ったが、人余りはどうしようもなかった」と振り返る。バブル崩壊後の長い不況に、多くの日本企業が苦しんでいた時期だ。リストラで会社を立て直すことも、ある意味では社会に求められていた。今月８日、関西に拠点を置く企業の経営者たち約６００人が、京都市に集まっていた。年１回開かれている「関西財界セミナー」に出るためだ。議論は、経済環境や関西の盛り上げにとどまらなかった。「ＳＤＧｓ（エスディージーズ）に貢献する企業への投資が増えていく」「エネルギーや水問題にどう関わるかが重要だ」ＳＤＧｓは、国連が採択した「持続可能な開発目標」で、教育、気候変動、平和など１７テーマが並ぶ。経団連も達成に向けた協力を、企業に求めている。幸之助も、何度かセミナーの講師を務めた。だが当時と比べ、企業が社会から求められることは幅広く、複雑で、深い。パナソニックの社長である津賀一宏（６１）は「会社が大きくなったいま、より大きな意味で『公器』の意味が問われている」と言う。自社の利益だけを考えるな、という幸之助の教えは、今ほど求められている時代は無い。しかしパナソニックも、「公器」であり続けることは、簡単ではない。＝敬称略（新田哲史、金本有加）"
"韓国の対北朝鮮策に日本懸念　「文氏訪朝、ありえない」","2018年2月11日00時33分","政治,国政,国際,アジア・太平洋","日本政府は懸念と不満を強めている。小野寺五典防衛相は１０日、視察先の佐賀県で記者団に「過去、日本も韓国も北朝鮮の融和的な政策に乗ってしまい、結果として北朝鮮が核・ミサイル開発を継続した」と指摘。「その反省は韓国も十分認識し、しっかり対応されると思う」と話した。北朝鮮、文大統領に訪朝要請　「条件整え実現を」と返答外務省幹部は「北朝鮮は非核化への具体的な行動を一切示していないのに文氏が訪朝するなどありえない」と語る。そもそも安倍晋三首相の訪韓は、ペンス氏とともに文氏に圧力強化に向けた日米韓の結束を念押しするのが大きな目的だった。だが、必ずしも成果は出ておらず、日米両国には焦りもにじむ。日米関係筋によると、９日の日韓首脳会談直後、米国側の要請で安倍首相とペンス氏が急きょ会談。さらにペンス氏は自身の車に首相を招き入れ、文氏主催のレセプション会場までの車中でも今後の対応を協議したという。日本政府関係者はこう強調する。「韓国がこれ以上北朝鮮に傾斜しないよう、日米で連携してクギを刺し続ける必要がある」（平昌＝松井望美）"
"南北合同チームが初試合　文大統領と金永南氏も観戦","2018年2月10日23時42分","国際,アジア・太平洋,スポーツ,ウインタースポーツ,平昌五輪,有料記事","五輪初の南北合同チーム、女子アイスホッケー「コリア」が１０日夜、平昌冬季五輪の氷上競技会場がある韓国・江原道江陵（カンヌン）市でスイスとの初試合に臨んだ。ソウルで会談を終えた文在寅（ムンジェイン）大統領と北朝鮮の金正恩（キムジョンウン）朝鮮労働党委員長の妹の金与正（キムヨジョン）氏や金永南（キムヨンナム）最高人民会議常任委員長らも観戦。観客席を埋めた韓国の市民が「統一旗」を振り、北朝鮮の女性中心の応援団約２００人が一糸乱れぬ応援を展開した。南北合同チームは１月の南北実務協議で、選手の頭越しに結成が決定。急ごしらえで五輪本番を迎えた。会場周辺には約３時間前からチームの象徴でもある統一旗を持った韓国市民数百人が集まり「私たちは一つだ」と声を上げた。忠清南道公州市から仲間約４０人と来た団体職員ミン・ソッキュさん（２８）は「南北が一緒にプレーできるのは統一への道のりの一歩」と力を込めた。ソウルの会社員、金知恵さん（２５）は、この日の文氏と金与正氏らの会談に触れ「文大統領が北を訪問し、いい結果につながればいいと思う。北が攻撃的な傾向を改めることにつながれば」と話した。北朝鮮の応援団は、選手団と同じ赤いジャンパー姿で登場。一斉に立ち上がり「我々のチーム、勝て」と声援を送った。文氏らは応援団の真後ろに陣取り、文氏の左隣に国際オリンピック委員会のバッハ会長、金永南氏、金与正氏の順に、横一列に座った。試合は０―８で敗れた。文氏らは最後まで観戦し、応援団は試合終了後も「私たちは一つだ」と声を合わせた。文氏は、チームを南北融和の象徴として最大限利用してきた。９日、開会式直前に各国首脳を招いた歓迎レセプションでは「南北の選手が勝利のため互いを支える姿は、世界の人々の胸に大きな響きとして記憶されるだろう」と語った。開会式では聖火の最終点火者を務めたフィギュアスケート女子の五輪金メダリスト金姸児（キムヨナ）さんにチームの主軸の南北選手が聖火を手渡す演出もした。ただ、韓国の世論調査機関ギャラップの２日の発表では合同チームへの賛成は４０％、反対は５０％だ。応援に来た江原道の農業、金岩さん（６５）は「分断された国家がスポーツで力を合わせることはいいことだ。こういうことがこれからたくさんできれば、統一が少しずつ近づくと思う」。一方、江原道束草（ソクチョ）市から妻と来た男性（６３）は「今日は韓国選手を応援するために来た。南は南、北は北で出場すればよかった。残念だ」と語った。（江陵＝金順姫、武田肇）"
"北朝鮮、文大統領に訪朝要請　「条件整え実現を」と返答","2018年2月10日21時32分","国際,アジア・太平洋,有料記事","北朝鮮の金正恩（キムジョンウン）朝鮮労働党委員長の実妹、金与正（キムヨジョン）氏は１０日午前、正恩氏の特使として韓国の文在寅（ムンジェイン）大統領と会い、「早い時期に面会する用意がある。都合の良い時期に訪朝してほしい」とする正恩氏の考えを口頭で伝えた。韓国大統領府が発表した。文氏は「今後、条件を整えて実現させよう」と答えた。正恩氏の要請は、２００７年１０月以来３度目となる南北首脳会談の開催を求めたものだが、具体的な時期を示さず、口頭での要請にとどまった。国際社会の制裁や米国の限定攻撃などを避ける一時しのぎとして、対話に前向きな韓国への接近を狙ったとみられる。韓国大統領府当局者も１０日の会談後、「１０年以上ぶりに行う首脳会談で成果を上げるためには、半島を取り巻く環境を成熟させなければならない」と指摘。北朝鮮の核・ミサイル開発問題などを巡る米朝対話など、一定の前進が必要だとの見方を示した。金与正氏は会談で「私が特使だ。金正恩委員長の意思だ」と説明。南北関係改善を目指すとした正恩氏の親書を文氏に渡した。高位級代表団長の金永南（キムヨンナム）最高人民会議常任委員長は「五輪開会式が成功したことを共に祝いたい」と述べた。文氏は「南北関係発展のためにも、早期の米朝対話が必須だ。米国との対話をより積極的に進めてほしい」と要請した。金与正氏らの訪韓について「緊張緩和や南北関係改善への契機になった」と評価した。双方は南北関係と朝鮮半島を巡る問題全般について意見交換したが、文氏は北朝鮮の核開発については直接言及しなかったという。北朝鮮高官が韓国大統領府を訪れるのは、０９年８月に金大中（キムデジュン）元韓国大統領の死去を受けて訪韓した朝鮮労働党の金己男（キムギナム）書記らの弔問団以来。金与正氏は正恩氏の最側近で、党宣伝扇動部副部長を務める。北朝鮮最高指導者の直系血族の訪韓は初めて。金永南（キムヨンナム）最高人民会議常任委員長率いる北朝鮮高位級代表団は１０日夜、平昌（ピョンチャン）冬季五輪の会場のひとつ、江原道江陵（カンヌン）で趙明均（チョミョンギュン）統一相主催の夕食会に出席。その後、文氏とともに女子アイスホッケー南北合同チームの試合を観戦した。代表団は１１日に帰国する。（ソウル＝牧野愛博）"
