"title","date","tags","article"
"トランプ氏、ロシア疑惑の民主党側メモは公開せず","2018年2月10日19時39分","国際,北米,有料記事","ロシア疑惑を巡る米連邦捜査局（ＦＢＩ）の機密文書を巡り、トランプ大統領は９日、捜査手法を擁護する民主党作成の極秘メモの公開を承認しないことを決めた。同じ文書に基づき、共和党が作ったＦＢＩ批判の極秘メモは積極的に公開を承認している。恣意（しい）的な判断に民主党からは批判の声が高まっている。ロシア疑惑の極秘メモ公開　トランプ氏、ＦＢＩに対抗ホワイトハウスは、マクガーン法律顧問が下院情報委員会に宛てた書簡を公表。その中で「トランプ大統領は公開したいと思っているが、メモは多くの機密情報を含み、大統領は公開を承認できない」とした。民主党が作ったメモは、ＦＢＩの捜査手法を擁護するものだとされる。トランプ氏は、ロシア疑惑の捜査が公平でないことを印象付けようとする動きを強めており、民主党側からの異議を封印した形だ。民主党下院トップのペロシ院内総務は声明で「公開拒否はロシア疑惑に関し、驚くべき真実の隠蔽（いんぺい）だ」と批判した。一方でトランプ氏は、自身に近い共和党のニューネス下院情報委員長が作った極秘メモの公開については、２日に承認。メモは２０１６年の大統領選で、司法省とＦＢＩがトランプ陣営幹部への通信傍受に際し、令状の取得方法が不適正だったと主張している。司法省とＦＢＩは公開に猛反対。ＦＢＩは内容が不正確だとして「重大な懸念がある」と異例の声明も出した。しかし、トランプ氏は反対を押し切って公開を承認。「多くの人間が恥を知るべきだ」と断じた。（ワシントン＝杉山正）"
"倒壊したビルから３人の遺体　台湾地震の死者１５人に","2018年2月10日19時33分","国際,アジア・太平洋,中国","台湾東部の花蓮県などを襲った地震で１０日、新たに３人の遺体が見つかり、死者は計１５人となった。当局によると、倒壊したビル「雲門翠堤」の低層部分にあった旅館の居室付近から遺体が収容された。身元は確認されていないが、中国から旅行に来ていた安否不明の家族５人のうちの３人とみられるという。「激しい揺れ」「ホテル１階がつぶれた」　台湾で地震救出作業の支援のため現地入りしていた、日本の警察や消防などの専門家チームは同日、帰国のために花蓮を離れた。原田優団長（外務省）は「倒壊しかけた建物近くでの活動など困難さはあったが、（台湾の人々に）あたたかい歓迎の声をかけてもらったのが印象的だった」と語った。（花蓮＝西本秀）"
"非常事態宣言のモルディブでテレビ局閉鎖　脅迫相次ぐ","2018年2月10日17時29分","国際,アジア・太平洋","政府と野党側の対立が深まるインド洋の島国モルディブで、同国最大手で独立系のニュース放送局ラージェＴＶが８日夜、放送を停止した。地元メディアなどが報じた。ヤーミン政権による５日の非常事態宣言以降、放送局への放火や記者への暴力などの脅迫が相次いだためだ。モルディブで非常事態宣言　最高裁判事・元大統領ら逮捕同局は２０１３年の大統領選の前にも放火されており、「社員の安全のため放送を停止する以外に選択肢がなくなった」としている。地元記者は取材に「インターネットも遮断される恐れがある」と話した。一方、インド外務省などによると、９日夜、ＡＦＰ通信の記者２人が首都マレで逮捕されたという。インド政府が確認を急いでいる。モルディブでは、最高裁が１日、野党のナシード元大統領（英国に亡命中）ら政治犯９人を無罪とし、政治犯の釈放や罷免（ひめん）された国会議員の復権を命じた。ヤーミン大統領がこの命令を無視したことに野党側が反発、抗議デモが起きた。ヤーミン大統領は５日に非常事態宣言を出し、集会の自由などを制限。警察は最高裁判事２人を逮捕した。こうした事態を受け、ナシード氏は密接な関係を持つインドに、ヤーミン大統領は関係を強めてきた中国に支援を求め、対立と混乱が深まっている。（ニューデリー＝奈良部健）"
"脱北者の女子アイホ元代表　南北合同「政治利用でも…」","2018年2月10日15時34分","国際,アジア・太平洋,スポーツ,ウインタースポーツ,平昌五輪,有料会員限定記事","韓国と北朝鮮によるアイスホッケー女子、南北合同チームが１０日、初戦に臨んだ。その戦いぶりを複雑な思いで見つめる脱北者の女性がいる。南北合同チームが出場、結果と日程はこちら特集：平昌オリンピック北朝鮮の咸鏡北道清津（ハムギョンブクトチョンジン）生まれの皇甫永（ファンボヨン）さん（３８）。１８歳で韓国に逃れた後、アイスホッケー女子韓国代表になった。南北合同チームの初陣だった４日のスウェーデンの練習試合は、ニュースで内容を確認した。「北の選手もよくやっている。合同チームはうまくいっている」故郷の体育団でアイスホッケーを始めたのは１２歳の時。施設が整わない北朝鮮では、１年のうち１０カ月は土の上での練習だった。それでも毎日７時間、工夫しながら練習した。「精神力や闘志は負けない」２００３年の青森アジア冬季競技大会で、韓国代表として北朝鮮との試合に臨んだ。北朝鮮代表のうち８人は顔なじみ。同じ体育団出身の選手もいた。皇さんは心を躍らせ、指輪や時計などプレゼントを準備した。脱北者への敵意を自覚現実は厳しかった。試合中、皇さんは執拗（しつよう）な体の寄せを受けた。試合後の握手も１人には避けられた。プレゼントも渡せなかった。脱北者である自分に対する北朝鮮の敵意を自覚した。それでも大会中に誕生日を迎えた北の友人のため、宿舎のホテルに頼んでケーキを手配した。名乗れず、匿名で贈った。エレベーターで居合わせた北朝鮮の後輩は「あなたを好きになるには、時期尚早だ」と言った。政治利用された結果かもしれないが今はソウル近郊の京畿道高陽市のスケートリンクで子どもたちを教える。平昌五輪で後輩たちの試合を見に行く余裕はなさそうだ。北朝鮮選手が自分との接触を避けることも容易に想像がつく。それでも、後輩たちの試合は気がかりだ。「南北合同チームは政治利用された結果かもしれない。それでも五輪。悔いを残さず精いっぱい戦って欲しい」（牧野愛博）"
"正恩氏妹・与正氏、演出巧み　親書アピール、頭は下げず","2018年2月10日14時45分","国際,アジア・太平洋,平昌五輪","金正恩（キムジョンウン）朝鮮労働党委員長の実妹、金与正（キムヨジョン）氏が１０日、巧みな演出を見せた。金与正氏は１０日午前、文在寅（ムンジェイン）大統領らと会談するため、韓国大統領府を訪れた。金与正氏は会談前、青色のファイルを大事に扱い、テーブルの上に置いた。韓国メディアは映像を分析した結果、ファイルには「朝鮮民主主義人民共和国国務委員長」と表書きされていたと報じた。国務委員長は、金正恩氏の肩書の一つでもある。文氏に渡す親書の存在をメディアに意識的に示し、南北関係の接近ぶりを誇示したとみられる。また、金与正氏は文氏とあいさつした際、頭を下げなかった。金与正氏は９日に仁川空港に到着して以降、カメラの前では一貫して頭を下げないよう、視線を前方上に向けるしぐさを続けている。韓国側に譲歩したような印象を残さないよう、警戒しているとみられる。金与正氏は党宣伝扇動部の第１副部長。正恩氏の「愛民政治」と呼ばれる市民重視の政治スタイルを演出するなど、北朝鮮市民の思想統制に辣腕（らつわん）を振るっているとされている。（ソウル＝牧野愛博）"
"文氏、金永南氏らと会談　南北対話の進展焦点","2018年2月10日12時47分","国際,アジア・太平洋,平昌五輪,有料記事","韓国の文在寅（ムンジェイン）大統領は１０日午前１１時から、北朝鮮の金永南（キムヨンナム）最高人民会議常任委員長を団長とし、金正恩（キムジョンウン）朝鮮労働党委員長の実妹、金与正（キムヨジョン）氏も加わる高位級代表団と韓国大統領府で会談した。国際社会が厳しい北朝鮮制裁網を敷くなか、南北対話がどう進展するかが焦点だ。北朝鮮高官が韓国大統領府を訪れるのは、２００９年８月に金大中（キムデジュン）元韓国大統領の死去を受けて訪韓した朝鮮労働党の金己男（キムギナム）書記らの弔問団以来。金与正氏は正恩氏の最側近で、党宣伝扇動部副部長を務める。北朝鮮最高指導者の直系血族の訪韓は初めてだ。文氏は会談前、前夜の平昌（ピョンチャン）冬季五輪開会式に出席した金与正氏に「夜遅くまでご苦労様でした」と語りかけた。金与正氏は「大統領の様々なお気遣いのおかげで大丈夫でした」と答えた。文政権は「五輪を契機に始まった南北対話を、米朝対話につなげる」と主張。北朝鮮の非核化を訴える一方で、北朝鮮の核問題をめぐる韓国の影響力強化を目指して南北関係の改善を図ってきた。文政権は１月９日の南北高位級会談で、南北離散家族の再会事業や双方の軍事当局者による会談を提案。昨夏からは国際機関を通じた北朝鮮への８００万ドル（約９億円）相当の人道支援も表明し、実施時期を探ってきた。文氏は１０日の会談で、こうした提案を改めて行うとみられる。韓国内では、文氏は北朝鮮が非核化に応じれば３度目の南北首脳会談の開催も可能だとの考えを伝えるとの観測も出ている。これに対し、北朝鮮は核兵器と弾道ミサイルの放棄には応じない方針。逆に、金永南氏や金与正氏を派遣した見返りとして、米国に米韓合同軍事演習の延期や縮小を働きかけるよう、韓国に求める可能性もある。北朝鮮の労働新聞（電子版）は１０日、ペンス米副大統領の訪韓について「訪問の目的は反朝鮮キャンペーンであり、平和の象徴である五輪の場でも対決と戦争、謀略宣伝を行っている」と非難。「南朝鮮に高位級代表団を派遣したのは、人間の価値もない米国の人物と会って朝米対話の線をつなぐためではない」とこきおろした。文氏や北朝鮮代表団は、１０日夜に江原道（カンウォンド）江陵（カンヌン）で行われる女子アイスホッケー南北合同チームの試合や、１１日夜にある三池淵（サムジヨン）管弦楽団のソウル公演に、一緒に出席する可能性がある。（ソウル＝牧野愛博）"
"トランプ氏と金正恩氏そっくりさんが…五輪開会式混乱","2018年2月10日11時55分","国際,アジア・太平洋,北米,スポーツ,ウインタースポーツ,平昌五輪","９日にあった平昌（ピョンチャン）冬季五輪の開会式で、アメリカ選手団の入場行進中にハプニングが起きた。ドナルド・トランプ米大統領と、北朝鮮の金正恩（キム・ジョンウン）朝鮮労働党委員長の「そっくりさん」が報道関係者席に突然現れ、スマートフォンをかざす人々が集まるなどして混乱した。写真特集：平昌オリンピック開会式特集：平昌オリンピック偽者のトランプ氏は、「ＵＳＡ」と記された赤い帽子に、赤いネクタイのスーツ姿。偽者の金正恩氏は、独特のヘアスタイルに眼鏡姿で登場。「本物」の２人は式に来ておらず、米側はペンス副大統領が出席。北朝鮮側は金正恩氏の実妹、金与正（キム・ヨジョン）氏が出席していた。大会運営本部によると、２人は関係者席に入るためのＩＤカードを持っていなかったため、警備中のスタッフに会場外へ連れ出されたという。２人が何者なのかについては「現時点では分からない」としつつ、「有名なコメディアンではないようだ」としている。（藤田太郎）"
"世界はどう見た？五輪開会式　米報道「視聴者２０％減」","2018年2月10日10時58分","国際,スポーツ,ウインタースポーツ,カルチャー,テレビ・芸能,平昌五輪","寒空の下、華やかに行われた平昌冬季五輪の開会式。世界の反応は様々だった。写真特集：平昌オリンピック開会式特集：平昌オリンピックＡＰ通信は、米国ではこれまでに比べて盛り上がりが控えめだったことを配信。中継した米ＮＢＣについて、「米東部時間の午前６時に始まった開会式は、映像と音声は全てあったが、実況はなし。最小限の体験だった」。平昌五輪初日の視聴者は、「２０１４年ソチ五輪時の２千万人から、２０％減の１６００万人に落ちた」とも報じている。ＵＳＡトゥデーは震えるほどの寒さについて言及。式が始まった午後８時の会場周辺の気温は零下２・７度といわれており、「リレハンメル五輪（１９９４年）以来となる極寒の開会式」とし、「屋外の開会式を夜に実施するのは、これが最後になるのではないか」と予想していた。一方で、英ＢＢＣ（電子版）は好意的に報じた。スタジアム上空を飛び、五輪マークを形作った１２１８台のドローンが目を引いたという。「式典での『Ｗｏｗ　ｍｏｍｅｎｔｓ（すごい瞬間）』。ドローンを使ったパフォーマンスは、ギネス世界記録だ」と報じた。韓国の英字紙コリア・ヘラルド紙は、「ツイッター上で『サイバーパンク』という単語が飛び交った」と説明。サイバネティックス技術が高度に発達した未来を描くサイエンス・フィクションのジャンルの一つを示す用語を使って、盛り上がりを紹介した。ドーピング問題で国としての出場を認められなかったロシアのタス通信は、「ＯＡＲ＝Ｏｌｙｍｐｉｃ　Ａｔｈｌｅｔｅ　ｆｒｏｍ　Ｒｕｓｓｉａ」として個人資格で参加した１６８人のロシア選手を取り上げた。「ＯＡＲの選手たちは、観客からのサポートを感じた」という見出しで報じ、スケルトン男子のニキータ・トレグボフ選手の「行進した際には、多くの歓声をもらえた。すごくありがたかった」というコメントなどを伝えた。"
"トランプ氏、豪大使に太平洋軍司令官指名　対中強硬派","2018年2月10日10時38分","国際,北米","トランプ米大統領は９日、在日米軍を統制下におく米太平洋軍トップのハリー・ハリス司令官（海軍大将）をオーストラリア大使に指名する人事を発表した。軍の最高幹部を重要な同盟国の大使に据えることで、政権がアジア太平洋地域を重視している姿勢を示す狙いがあるとみられる。ホワイトハウスが９日に出した声明文では、ハリス氏について「絶大な知識と指導力をもち、インド洋・太平洋地域の地政学にも精通した海軍士官」と評価した。就任には上院の承認が必要となる。ハリス氏は対中強硬派として知られる。２０１６年１月の講演で、中国が領有権を主張する尖閣諸島（沖縄県）について「尖閣諸島が中国から攻撃されれば、米軍は疑いもなく尖閣諸島を防衛する」と明言。米国は尖閣諸島が日米安全保障条約の適用対象になるとの立場をとっていたが、ハリス氏は中国を名指しして牽制（けんせい）した。また、中国が人工島を造った南シナ海でも、人工島の近くを米艦船が横切る「航行の自由作戦」を積極的に実施した。ハリス氏は、横須賀生まれの日系人。１９７８年に米海軍兵学校を卒業し、イラク戦争などにも参加。オバマ前政権時の２０１５年、太平洋軍司令官に任命された。アジア系米国人では米海軍で最高位の階級にあった。（ワシントン＝土佐茂生）"
"万景峰への油提供要請、北朝鮮が撤回　楽団乗せ韓国入港","2018年2月10日10時36分","国際,アジア・太平洋","北朝鮮は９日、三池淵（サムジヨン）管弦楽団が乗船して韓国江原道（カンウォンド）・墨湖（ムゴ）港に入港した貨客船「万景峰（マンギョンボン）９２号」について、韓国に求めていた油類の提供要請を撤回した。韓国統一省が９日夜、明らかにした。１０日午前、三池淵管弦楽団がソウルに向けて陸路で出発するために下船した後、万景峰９２号は北朝鮮に戻るために出航した。北朝鮮の楽団、平昌五輪会場近くで公演　反対派の抗議も韓国政府は、北朝鮮による油類提供の要請を受けた後、国連制裁決議などに違反しないよう米国などと支援の是非を協議していた。統一省は北朝鮮が支援要請を撤回した経緯については明らかにしていない。一方、朝鮮中央通信は１０日朝、訪韓中の金永南（キムヨンナム）最高人民会議常任委員長が文在寅（ムンジェイン）韓国大統領と五輪歓迎行事であいさつし、記念撮影したと報じた。同通信は「南朝鮮の文在寅大統領」との肩書で紹介。金氏が「各国の首脳ともあいさつした」と伝えたが、安倍晋三首相には触れなかった。（ソウル＝牧野愛博）"
"米司法省ナンバー３辞任へ　トランプ氏近い人物に交代か","2018年2月10日10時33分","国際,北米","米司法省は９日、同省ナンバー３のレイチェル・ブランド司法次官が数週間後に辞任すると発表した。トランプ大統領がロシア疑惑捜査を担当する司法副長官の更迭を示唆しており、ブランド氏が担当を引き継ぐ可能性が取りざたされていた。トランプ氏が司法当局への批判を強める中での異例の辞任となる。司法省は声明でブランド氏の功績を称賛。「自身の成し遂げたことを誇りに思う」とするブランド氏の発言を盛り込んだ。ただ、辞任に至る経緯は明示されなかった。ブランド氏はトランプ氏に指名され、２０１７年５月に司法次官に就任した。オバマ前政権やブッシュ元政権でも要職を務めていた。司法次官を退任後は、民間への転職が決まっているという。ロシア疑惑を巡っては、セッションズ司法長官が自身のロシア側との接触が問題になり、昨年３月に捜査に関与しないことを表明。ナンバー２のローゼンスタイン司法副長官がマラー特別検察官を任命した。ローゼンスタイン氏が捜査に関する報告を受けるほか、マラー氏を解任する権限を持つ。しかし、トランプ氏はローゼンスタイン氏の捜査姿勢に不満を持ち、更迭を検討しているとされる。ローゼンスタイン氏が解任された場合は、特別検察官に関する権限がブランド氏に移るため、その去就が注目されていた。トランプ氏はブランド氏の後任に自らに近い人物を就任させた上で、ローゼンスタイン氏を解任する可能性がある。その場合、捜査介入との批判が高まりそうだ。トランプ氏は疑惑捜査を巡って、捜査当局が偏向していると印象付ける動きを強めている。トランプ氏は９日、民主党が機密文書に基づいて作成し、米連邦捜査局（ＦＢＩ）の捜査手法を擁護した極秘メモの公表を認めないことを決定。２日には、共和党側が同じ機密文書に基づいてＦＢＩの捜査手法を批判した極秘メモの公表を積極的に承認し、「多くの人間が恥を知るべきだ」などとしていた。（ワシントン＝杉山正）"
"北朝鮮の楽団、平昌五輪会場近くで公演　反対派の抗議も","2018年2月10日09時41分","国際,アジア・太平洋,平昌五輪,有料記事","北朝鮮から韓国入りした三池淵（サムジヨン）管弦楽団が８日夜、平昌（ピョンチャン）冬季五輪の氷上競技会場のある江原道江陵（カンウォンドカンヌン）市で祝賀公演をした。抽選で当選した韓国の市民や韓国政府に招待された離散家族、政府関係者ら約８００人が鑑賞した。一方で、公演前に反対派が集まって抗議するなど、韓国社会の複雑な受け止めも映しだした。６日夜に江陵市近郊の港に着岸した貨客船・万景峰９２号に宿泊する団員約１２０人は、８日朝から会場の江陵アートセンターでリハーサルをした。玄松月（ヒョンソンウォル）団長らは左胸に北朝鮮国旗がついたトレーナー姿で現れ、取材陣に手を振って余裕の表情を見せる団員もいた。団員は正午過ぎ、再びバスに乗り込んで万景峰９２号に戻って昼食をとったほかは、約１２時間の会場にとどまった。三池淵管弦楽団は、玄氏が団長の女性グループ、モランボン楽団など複数の芸術団から今回のために特別に編成されたとみられる。約１００分に及んだ公演では北朝鮮の人気歌謡「パンガップスムニダ（お目にかかれてうれしいです）」から始まり、韓国の歌謡曲や「白鳥の湖」などのクラシックも演奏された。司会役は「別れた親兄弟たちと再会したように感激し、うれしい。私たちは一つの民族だ」とあいさつ。舞台裏の大型スクリーンに離散家族の再会場面が映し出された。一部観客は玄氏と握手し、記念撮影した。韓国側が懸念した指導者を称賛したり体制を宣伝する曲はなかった。一方で、南北統一の悲願をうたった北朝鮮の曲には南北が協議の上、もとの歌詞にはない「独島」（島根県・竹島）という地名が挿入された。周辺では保守系団体が集まり、「核の放棄なく北を引き入れた文在寅政権は辞任せよ」「平壌（ピョンヤン）五輪反対」と公演中止を求めた。金正恩（キムジョンウン）・朝鮮労働党委員長の写真を焼くパフォーマンスを警察に阻まれ、参加者が「おまえらは韓国の警察か」と詰め寄り、もみ合いになった。妻と一緒に公演に訪れた江陵市の男性（６８）は「北のことを知りたくて申し込んだ。大局的に見れば、このような行事は未来のために必要だと思う」と話した。韓国統一省は、北朝鮮側に公演料を支払うことはないとしている。北朝鮮から船の燃料を提供してほしいとの要請があったが、応じていないとしている。（江陵＝武田肇）"
